,title,lyrics,artists,date,rank,cnt
368,Mama Used To Say,"[Intro]
The majority of people are not successful because they prepare to quit.They have a mental program that it's okay to prepare more for quiting then preparing to succeed, ama make my dreams to reality
No body gon stop me but me that's the only person that can, understand that if you want to make your dreams a reality you gotta understand that you can't quit

[Hook]
Mama Mamaaaa

My mama used to say, Just go and hustle boy
Until you get all of the dollar bill yo
My mama used to say
My mama used to say to me x2

Dollar bill Dollar bill
Dollar bill Dollar bill yo x2

My mama used to say to me
(Just go and hustle) (x2) x4

Cash rules everything around me CREAM
Dollar dollar bill yo yo
My niga used to say the industry might doubt me please
Guess we'll see about that
They used to tell me ""you won't be shit without me"" sheesh
We gotta chill about that
My mama used to say never sleep on your dreams
And oops I nearly pissed my bed

[Verse 1]

There's 2 kinds of people
The too kind and evil
I'm too kind even if nigas take your kindness for weakness
But my mama used to say never let your feelings change how you living

But I know y'all envy
The jealousy plenty
Took away the seat but y'all still can't stand me
My mama used to say be the last man standing always
Never give up no way
A few of them are gon hate
But respect they gon pay
Got a problem solve it
Be good to these people fuck being a savage
Be careful what you do bad news travel
A few snakes in the grass better watch your circle
And most of all never announce your finance
Always fight to keep a balance
And live your life but don't forget you're a parent
I wanna thank you for that lesson

[Hook]

[Verse 2]

The pain that came with the Karma
The shit I could avoided if I listened to my mama
When she said boy make sure you do lover her
Even if you leave make sure you do hug her
And say to her baby just know that I got you
We might be apart but there's no one besides you
And I won't lie there's something that's inside you
Something so special more precious than a diamond

You made a tyma, You made a tyma
Now my mama is a grandma
It's all on me to make sure I do better
And I put it on myself to make sure that I never
Let my little man even go through what I went through
Grow up without a father
Hell nah
So Ima listen to my mama when she say.. To my mama when she say

[Hook]

(Outro)
Sweet sweet child
Close your eyes ,life will get better if you try
And you don't know the path you may go
And if you believe , that makes you smile",Mag_SA & Just Couga,1982,"[94, 92, 30, 31, 33, 41, 45, 49, 55, 62, 72, 82, 86]",13
369,My Guy,"[Chorus] (Sonny Digital):
We dont know you
So we dont buy
We dont know you
So we dont try, really know the plug, yeah
Dat my guy, really know the plug, yeah
Dat my guy, [2x]

[Verse 1] (Sonny Digital):
Hit the plug
Bitch you know wassup
Rollin grams, Sonny in the cut
Disrespect the Slut, like I’m Spoon Loc
Gotta hit the plug pack
It ain't too low
Nigga you know
Diamonds, boy, like CuJo
Gas, yeah that fuel, bro
I want Mars like Bruno
And you know, I'm the one like Uno
Keep it hot like June bro
Plug coming soon doe

[Chorus](Sonny Digital):
We dont know you
So we dont buy
We dont know you
So we dont try, really know the plug, yeah
Dat my guy, really know the plug, yeah
Dat my guy, [2x]

[Verse 2]: (Black Boe)
I know the plug that's why I dont fuck with you
I'm smoking OG and I fuck with cookie too
Me and Sonny D might a smoke zip this what we do
And this pack from burner, it might clear the fucking room
I know the plug
Man I really know the PLUG
When I saw the last pack I fell in love
He got gas he dont fuck with midgets
And he pullin up in less than 60 minutes, yeah

[Chorus](Sonny Digital):
We dont know you
So we dont buy
We dont know you
So we dont try, really know the plug, yeah
Dat my guy, really know the plug, yeah
Dat my guy, [2x]

[Verse 3] (Sonny Digital):
VP on my wrist with the shit , yeah yeah
When I hit the plug I need my zips, yeah yeah
Pockets thick like Kylie Jenner Lips
When [?] with my plug kill view
[?]
I keep the gas on me
I got stash on me
[?] right pass on me
We know the plug, you gotta move right
But if you dont know niggas then you move like

[Chorus]:
We all know you
So we dont buy
We all know you
So we dont try, really know the plug, yeah
Dat my guy, really know the plug, yeah
Dat my guy, [2x]",Sonny Digital & Black Boe,1982,"[95, 93, 93, 43, 23, 23, 25, 28, 32, 36, 41, 47, 61, 71, 81]",15
370,One Hundred Ways,"[Verse 1: James Ingram]
Compliment what she does
Send her roses just because
If it's violins she loves
Let them play

Dedicate her favorite song
And hold her closer
All night long
Love her today
Find one hundred ways

[Verse 2: James Ingram]
Don't forget there could be
An old lover in her memory
If you need her so much more
Why don't you say

Maybe she has it in her mind
That she's just wasting her time
Ask her to stay
Find one hundred ways

[Bridge: James Ingram]
Bein' cool won't help
You keep a love warm
You'll just blow your chance
Take the time to open up your heart
That's the secret of romance

[Verse 3: James Ingram]
Sacrifice if you care
Buy her some moonlight to wear
If there's one more star she wants
Go all the way

In your arms tonight
She'll reflect
That she owes you the sweetest of debts
If she wants to pay
Find one hundred ways

[Interlude]

[Verse 3 Reprise: James Ingram]
In your arms tonight
She'll reflect
That she owes you the sweetest of debts
If she wants to pay
Find one hundred ways

[Outro: James Ingram]
Ya better believe it, whoa
Love her today
Find one hundred ways

I'm telling you
To love her today
Find one hundred ways

Whoa, love her, love her
Love her one hundred ways

You've got to love her today
Find one hundred ways",Quincy Jones,1982,"[96, 94, 34, 14, 15, 17, 21, 26, 28, 29, 32, 35, 40, 45, 52, 60, 69, 70, 73]",19
371,Should I Do It,"I swore when he hurt me so, I wouldn't see him anymore
But today he called my name - oh, I could feel the same old flame

Should I do it, should I fall? Should I do it after all oh?
Is it crazy, is it right? I really wanna love him tonight
Should I do it, should I play? Can I help it anyway?
When I feel him hold me tight, I'm gonna turn on like a light

I know when we're in his car, I couldn't go just so far
I wanna give him everything
So, when I hear the telephone ring, yeah:

Should I do it, should I fall?...
Oh, I'm so lonely and he's so fine
Maybe I should swallow my pride
Just one, one, one more time, yeah

Baby, I've got to know: Should I do it, should I fall?...",The Pointer Sisters,1982,"[97, 95, 63, 27, 13, 13, 15, 17, 19, 21, 25, 31, 37, 44, 62, 82]",16
372,You Got The Power,"You might be a financial wizard
With a sack of loot
But all I see is a slimy lizard
With an expensive suit
Go on and run your corporation
Go on and kiss some ass
You can buy up half of the nation
But you can't buy class

You bastards think it's funny
Lying and thieving all your life
Think all there is, is money
Got your future wrapped up tight

But just 'cos you got the power
That don't mean you got the right

You can take my fingers, buddy
You can take my eyes
You can take my past and future
It won't make you wise
You can have me thrown in jail
You can steal my booze
You can even steal my mail
Step on my blue suede shoes

You bastards might be clever
Got it mapped out in black and white
But you remember you can never
Teach a dog to stand upright

And just 'cos you got the power
That don't mean you got the right
And just 'cos you got the power
That don't mean you got the right

Go on out, make another deal
Feed your big fat face
Go on out, and cop a feel
Get on somebody's case
You surely could be satisfied
If you could get it all
But time ain't on your side
You're going to the wall

You think that life's just dollars
Won with greed and lust and spite
But I wasn't born to follow
Like to get my sleep at night
I surely do, honey

Just 'cos you got the power
That don't mean you got the right
Just 'cos you got the power
That don't mean you got the right
Just 'cos you got the power
That don't mean you got the right

You got your ass
And you are ready, buddy",Motörhead,1982,"[99, 96, 66, 66, 74, 82]",6
373,Juke Box Hero,"[Verse 1]
Standing in the rain, with his head hung low
Couldn't get a ticket, it was a sold out show
Heard the roar of the crowd, he could picture the scene
Put his ear to the wall, then like a distant scream
He heard one guitar, just blew him away
He saw stars in his eyes, and the very next day
Bought a beat up six string in a secondhand store
Didn't know how to play it, but he knew for sure
That one guitar felt good in his hands
Didn't take long to understand
Just one guitar, slung way down low
Was one way ticket, only one way to go

[Chorus]
So he started rocking
He is never going to stop
Got to keep on rocking
Someday he's going to make it to the top

And be a juke box hero, got stars in his eyes
He's a juke box hero
He took one guitar, juke box hero, stars in his eyes
Juke box hero, he'll come alive tonight

[Verse 2]
In a town without a name, in a heavy downpour
Thought he passed his own shadow, by the backstage door
Like a trip through the past, to that day in the rain
And that one guitar made his whole life change

[Chorus]
Now he needs to keep on rockin'
He just can't stop
Gotta keep on rocking'
Someday gonna make it to the top

And be a juke box hero, got stars in his eyes
He's a juke box hero
And be a juke box hero, got stars in his eyes
He took one guitar, stars in his eyes
He'll come alive tonight woah

[Guitar Solo]

[Chorus]
Yeah, he's gotta keep on rockin'
Never gonna stop
Gotta keep on rocking'
Someday gonna make it to the top
And be a juke box hero, got stars in his eyes
He's a juke box hero
Yeah juke box hero, got stars in his eyes
Juke box hero, ahh
Juke box hero, ahh
Juke box hero, got stars in his eyes
Stars in his eyes",Foreigner,1982,"[100, 99, 75, 75, 26, 26, 30, 31, 35, 39, 50, 61, 73]",13
374,If I Could Get You (into my Life),"[Verse 1]
Waking up from another day
I'm feeling so insane
Cause ever since I saw your face
I got it tattooed on my brain

[Bridge]
Did you know that you came and you got me like this?
Cause I know you're the one that I wanna be with
You gotta know I'd do anything
To get you to notice me

[Pre-Chorus]
What I gotta do to get you into my life?
I could be your bad boy or baby I could be nice
I would give you all the stars
If you give me the night
Come on, eh, eh, eh

[Chorus]
There's a million pretty girls all over
But they got nothing on you
Been all around the world
And no one gets me like the way you do
Baby I thought that you should know
None of the rest are even close
There's a million pretty girls all over
But you know this song's for you
This song's for you

[Verse 3]
Now I got your attention babe
There's some things I need to say
Like you're the one that I dream about
It's on my mind like every day (every day)

[Bridge]
Did you know that you came and you got me like this?
Cause I know you're the one that I wanna be with
You gotta know I'd do anything
To get you to notice me


[Pre-Chorus 2]
Got my head in the clouds
And I'm walking on air
Want you all to myself
And I don't want to share
Where you wanna go?
Cause I'm taking you there
Come on, eh, eh, eh

[Chorus]
There's a million pretty girls all over
But they got nothing on you
Been all around the world
And no one gets me like the way you do
Baby I thought that you should know
None of the rest are even close
There's a million pretty girls all over
But you know this song's for you
This song's for you


[Verse 4]
Yo, one in a million
So baby what are the odds?
A million miles away
But I know this is my song
You know you got the right girl
With the right muscle
Keep you reeled in but won't knock the hassle
I want you to want me
No I don't wanna be wondering
If you wanna be with me
When the skies get to thundering
I still want my heart fluttering
Every day without a shadow of a doubt
Baby all you gotta say

[Chorus]
There's a million pretty girls all over
But they got nothing on you
Been all around the world
And no one gets me like the way you do
Baby I thought that you should know
None of the rest are even close
There's a million pretty girls all over
But you know this song's for you
This song's for you


[Verse 5]
What I gotta do to get you into my life?
I could be your bad boy or baby I could be nice
I would give you all the stars
If you give me the night
Come on, eh, eh, eh

This song's for you

[Pre-Chorus]
What I gotta do to get you into my life?
I could be your bad boy or baby I could be nice
I would give you all the stars
If you give me the night
Come on, eh, eh, eh

[Outro]
This song's for you
This song's for you
This song's for you",Big Time Rush,1982,"[76, 78, 78, 84, 92, 93, 95, 96]",8
375,Right The First Time,"[Verse 1]
Betwixt and between, the fantastic dream and the fear
Do you wonder where she is this afternoon?
And does it get on your nerves, make you slightly perturbed
That there's things that you don't know about her?
And even the places that she's never been with you
Seem awful empty without her

[Chorus]
You can't look into those eyes
Down no telephone line
What if you were right first time?
You can't look into those eyes
Down no telephone line
What if you were right first time?

[Instrumental Break]

[Verse 2]
Betwixt and between, the fantastic dream and the fear
Do you wonder where she is this afternoon?
And with the needle in groove, is there owt to prove?
And tell me, are your feet still tapping?
I know there’s a first for a trip over the water
What is the worst that could happen?

[Chorus]
You can't look into those eyes
Down no telephone line
What if you were right first time?",Arctic Monkeys,1982,"[77, 77, 84, 85, 87]",5
376,All Night With Me,"[Verse 1]
I wish I knew what you were thinkin'
Sometimes with you it's hard to tell
You lay beside me without speakin'
Words are hard to find, better left behind
You pull me close as if to answer
The question runnin' through my head
If words could say it any better:

[Chorus]
Does it feel good?
Do you feel like stayin' all night with me?
Does it feel good? (Does it feel good?)
Do you feel like stayin' all night with me?
Does it feel good?
If it feels right, stay all night

[Verse 2]
We'll wake up early in the mornin'
Or never go to sleep at all
So happy just to be together

[Chorus]
Does it feel good?
Do you feel like stayin' all night with me?
Does it feel good? (Does it feel good?)
Do you feel like stayin' all night with me?
If it feels good, if it feels right, stay all night

[Bridge]
It's a long night, there'll be time for playin'
Never felt so right just to hear you sayin'
That it's all right, and you feel like stayin' all night with me

[Chorus]
Does it feel good? (Does it feel good?)
Do you feel like stayin' all night with me?
Does it feel good, does it feel right?
Why don't you stay all night with me?
Does it feel good? (Does it feel good?)
Do you feel like stayin' all night with me?
Does it feel good, does it feel right?
Why don't you stay all night with me?
Does it feel good? (Does it feel good?)
Do you feel like stayin' all night with me?
Does it feel...",Laura Branigan,1982,"[97, 69, 72, 78, 84, 92, 96]",7
377,Make Up Your Mind,"[Verse 1]
I never thought I'd be a killer
'Cause there's so much to lose
But if I can't drink the water
What else can I do?

And although the axe is heavy
It just sits in my hands
While you're changing like the current
Not a shore on land

[Pre-Chorus]
Every time I try to bring it down
You always turn my hand around

[Chorus]
Make up your mind (make up, make up)
Let me live or let me love you
While you've been saving your neck (make up, make up)
I've been breaking mine for you
The power is on, the guillotine hums
My back's to the wall, go on, let it fall, oh
Make up your mind (make up, make up)
Before I make it up for you

[Verse 2]
I never thought that I'd be facing
A sea that's bluer than the tide
Now my knees are shaking
And I can't look in your eyes

But if you're gonna make me do it
How'd you want it done?
Is it best to sip it slowly
Or drink it down in one?

[Pre-Chorus]
Every time I try to bring it down
You always turn my hand around

[Chorus]
Make up your mind (make up, make up)
Let me live or let me love you
While you've been saving your neck (make up, make up)
I've been breaking mine for you
The power is on, the guillotine hums
My back's to the wall, go on, let it fall, oh
Make up your mind (make up, make up)
Before I make it up for you

[Bridge]
The executioner's within me
And he comes, blindfold ready
Sword in hand
And arms so steady
Every time I try to bring it down
You always turn my hand around
But every time I try to bring it down
You always turn my hand around

[Chorus]
Make up your mind (make up, make up)
Let me live or let me love you
While you've been saving your neck (make up, make up)
I've been breaking mine for you
The power is on, the guillotine hums
My back's to the wall, go on, let it fall, oh
Make up your mind (make up, make up)
Before I make it up for you

Make up your mind (make up, make up)
Let me live or let me love you (let me love you)
While you've been saving your neck (make up, make up)
I've been breaking mine for you
(I've been breaking...)
The power is on, the guillotine hums
(I've been breaking...)
My back's to the wall, go on, let it fall, oh
(I've been breaking...)
Make up your mind
(I've been breaking, I've been breaking...)
Before I make it up for you",Florence + The Machine,1982,"[98, 71, 73, 75, 78, 81, 90]",7
378,Take Off,"[Intro]
MonstaBeatz

[Chorus]
Woke up this morning, can't remember nothing
Two bitches just flew in from London (Two bitches)
Last thing I remember they callin' me daddy
The mattress was covered in money (In hunnids)
Went to sleep with my jewelry and chains on
Had to wake up and recount the money (Recount it)
I got a bitch, she gon' kill for real, talk about Clyde and Bonnie (Brr)

[Post-Chorus]
Coupe with the kit, cop it (Got to)
Pull up with a stick, stop it (Stop it)
Rich nigga shit, solid (Rich nigga)
Old hunnids, pockets rotted (Cottage)
I go to space with the stars (Stars)
Might smoke a blunt with my pilot (Cookie)
Saturn, Moon, Earth, and Mars (Mars)
NASA takeoff with the rocket (NASA)

[Verse]
Half a million on a necklace (A half)
Young rich niggas we successful (Successful)
Said she wanna feel special (She what)
That coco make her feel special (Coco)
I count a hunnid or better (One hunnid)
Back end two hunnid or better (Two hunnid)
I might go put all my chains on (Ice)
I just might change up the weather (Change it)
She pop a perc, her pussy wetter (Drip)
I met the bitch at Coachella (Coachella)
If she nutella she'd probably do better
But can I get a E for effort? (E)
I prayed to God to wash my sins (God)
Nothing formed against me, not a weapon (No weapon)
Ask Him where do I begin (Where?)
Devil tryna take my blessings (My blessings)
They don't know the meaning of the white (Naw)
You don't really live this life (No)
Niggas in the hood shootin' twice (Pew pew)
See my niggas in the hood shoot precise (Brr)
Real wise, we ain't taking no advice (Naw)
I realize that these hoes ain't right (All of 'em)
Don't even ask, 'cause they know what's the price (Price)
Ain't gotta snow, they already know it's white (White)
I talk to God cause I been baptized (Baptized)
I got mob ties to the nawf side (Nawf side)
Pull up with the sticks on the niggas, straight slime (Skrt-Skrt)
They gon' make the nawf side high crime (Nawf)
Better not hit a lick with these niggas droppin' ten (Huh)
Hit a lick with these niggas droppin' dimes
Fuckin' on her friend I'ma break her back in (Smash)
Lookin' at the watch I can't waste time (T-T-Takeoff)

[Chorus]
Woke up this morning, can't remember nothing
Two bitches just flew in from London (Two bitches)
Last thing I remember they callin' me daddy
The mattress was covered in money (In hunnids)
Went to sleep with my jewelry and chains on
Had to wake up and recount the money (Recount it)
I got a bitch, she gon' kill for real, talk about Clyde and Bonnie (Brr)

[Post-Chorus]
Coupe with the kit, cop it (Got to)
Pull up with a stick, stop it (Stop it)
Rich nigga shit, solid (Rich nigga)
Old hunnids, pockets rotted (Cottage)
I go to space with the stars (Stars)
Might smoke a blunt with my pilot (Cookie)
Saturn, Moon, Earth, and Mars (Mars)
NASA takeoff with the rocket (NASA)",Takeoff,1982,"[100, 89, 37, 19, 16, 16, 19, 22, 24, 34, 40, 54, 66, 84]",14
379,Sweet Dreams,"[Intro]
(Turn the lights on)

[Verse 1]
Every night I rush to my bed
With hopes that maybe I'll get a chance to see you
When I close my eyes, I'm going out of my head
Lost in a fairytale, can you hold my hands and be my guide?

[Pre-Chorus]
Clouds filled with stars cover your skies
And I hope it rains; you're the perfect lullaby
What kind of dream is this?

[Chorus]
You could be a sweet dream or a beautiful nightmare
Either way, I don't wanna wake up from you
(Turn the lights on)
Sweet dream or a beautiful nightmare
Somebody pinch me, your love's too good to be true
(Turn the lights on)
My guilty pleasure, I ain't going nowhere
Baby, 'long as you're here, I'll be floating on air
'Cause you're mine
You can be a sweet dream or a beautiful nightmare
Either way I don't wanna wake up from you
(Turn the lights on)

[Verse 2]
I mention you when I say my prayers
I wrap you around all of my thoughts
Boy, you're my temporary high
I wish that when I wake up you're there
To wrap your arms around me for real
And tell me you'll stay by my side

[Pre-Chorus]
Clouds filled with stars cover the skies (Cover the skies)
And I hope it rains; you're the perfect lullaby
What kind of dream is this?

[Chorus]
You could be a sweet dream or a beautiful nightmare
Either way I don't wanna wake up from you
(Turn the lights on)
Sweet dream or a beautiful nightmare
Somebody pinch me, your love's too good to be true
(Turn the lights on)
My guilty pleasure, I ain't going nowhere
Baby, 'long as you're here, I'll be floating on air
'Cause you're mine
You can be a sweet dream or a beautiful nightmare
Either way I don't wanna wake up from you
(Turn the lights on)

[Bridge]
Tattoo your name across my heart
So it will remain
Not even death could make us part
What kind of dream is this?

[Chorus]
You could be a sweet dream or a beautiful nightmare
Either way I don't wanna wake up from you
(Turn the lights on)
Sweet dream or a beautiful nightmare
Somebody pinch me, your love's too good to be true
(Turn the lights on)
My guilty pleasure, I ain't going nowhere
Baby, 'long as you're here, I'll be floating on air
'Cause you're mine
You can be a sweet dream or a beautiful nightmare
Either way I don't wanna wake up from you
(Turn the lights on)
Either way I don't wanna wake up from you",Beyoncé,1982,"[86, 29, 17, 11, 5, 5, 6, 6, 6, 8, 10, 12, 19, 22, 26, 32, 42]",17
380,On A Carousel,"Riding along on a carousel, trying to catch up to you
Riding along on a carousel, will I catch up to you?

Horses chasing cause they're racing
So they ain't so far

On a carousel, on a carousel

Nearer and nearer by changing horses, still so far away
People fighting for their places just get in my way
Soon you'll leave and then I'll lose you
Still we're going round

On a carousel, on a carousel
Round and round and round and round
Round and round and round and round with you
Up, down, up, down, up, down, too

As she leaves, she drops the presents that she won before
Pulling ducks out of the water, got the highest score
Now's my chance and I must take it, a case of do-or-die

On a carousel, on a carousel
Round and round and round and round
Round and round and round and round with you
Up, down, up, down, up, down, too

Riding along on a carousel, trying to catch up to you
Riding along on a carousel, will I catch up to you?

Now we take our ride together
No more chasing her

On a carousel, on a carousel",The Hollies,1982,"[94, 50, 51, 58, 68, 75, 83]",7
