,title,lyrics,artists,date,rank,cnt
0,Maneater,"[Verse 1]
She'll only come out at night
The lean and hungry type
Nothing is new
I've seen her here before
Watching and waiting
Ooh, she's sitting with you, but her eyes are on the door
So many have paid to see what you think you're getting for free
The woman is wild, a she-cat tamed by the purr of a Jaguar
Money's the matter
If you're in it for love, you ain't gonna get too far

[Chorus]
(Oh-oh, here she comes)
Watch out, boy, she'll chew you up
(Oh-oh, here she comes)
She's a maneater
(Oh-oh, here she comes)
Watch out, boy, she'll chew you up
(Oh-oh, here she comes)
She's a maneater

[Verse 2]
I wouldn't if I were you
I know what she can do
She's deadly, man
She could really rip your world apart
Mind over matter
Ooh, the beauty is there but a beast is in the heart

[Chorus]
(Oh-oh, here she comes)
Watch out, boy, she'll chew you up
(Oh-oh, here she comes)
She's a maneater
(Oh-oh, here she comes)
Watch out, boy, she'll chew you up
(Oh-oh, here she comes)
She's a maneater

[Instrumental Bridge]

[Chorus]
Ooh
(Oh-oh, here she comes)
Here she comes, watch out, boy, she'll chew you up
(Whoa-oh, here she comes, watch out)
She's a maneater
(Oh-oh, here she comes, she's a maneater)
Ooh, she'll chew you up
(Oh-oh, here she comes)
Here she comes, she's a maneater
(Oh-oh, here she comes, watch out)
She'll only come out at night, ooh
(Oh-oh, here she comes)
Here she comes, she's a maneater
(Oh-oh, here she comes, she's a maneater)
The woman is wild, woo
(Oh-oh, here she comes)
Here she comes, watch out, boy, watch out, boy
(Oh-oh, here she comes)
Oh, watch out, watch out, watch out, watch out
(Oh-oh, here she comes, watch out)
Yeah, yeah, she's a maneater
(Oh-oh, here she comes, she's a maneater)
She's watching and waiting, ooh
(Oh-oh, here she comes)
Oh, she's a maneater",Hall & Oates,1982,"[1, 1, 3, 4, 7, 8, 12, 36, 42, 56, 65]",11
1,Mickey,"[Антихайп, СЛАВА КПСС]
Тут Соня Мармеладова, а вот тебе бы надо бы
Пару ингаляторов, удар дефибриллятора
Чтобы зачитать, как я, звезда амфитеатра
Ведь Соня на битах, как сеанс у педиатра
А дети все кричат: ""О Соня!""
Мышке твой хуй больно в кишках колется
Весь кишлак гомик, я как КиШ - на троне
Ты летишь, как Коби. Разряжаю весь патронник
Ра-та-та ты под землёй, как кобальт
Разрываюсь на битах, словно здесь Чернобыль
Школьница Дэма
Отряд камикадзе — тут школьница эмо
К-К-КОМБО как Кимбо Слайс,
Тут MGK, Соня - киборг Сайракс
Ты Майли Сайрус, я Savage-Savage
Двойная рифма - Double Damage
Я Дамблдор, ты тут долдон
Забываешь свой текст, как купить гандон
Жирный flow, Ким Дотком
Илюха поц норм, но он ебанько
Читает свой рэп с таким ебалом
Словно занят прямо щас тройным аналом
Двойным аналом, у всех изъяны, бро
У твоего грайма лицо Марьяны Ро
Это как так? Ты мудак, тик-так время утекло
Ты не вагван, ты не ванван
Твой Декамерон - плак-плак на битах
Илюха поц норм, но он ебанько
Ебанько
Ебанько
Ебанько
Ебанько
Ебанько
У твоего грайма лицо Марьяны Ро
Это как так? Ты мудак, тик-так время утекло
Ты не вагван, ты не ванван
Твой Декамерон - плак на битах
Не успел попасть в бит, пиф-паф по пятам
Эй, да у нас тут дырка
Мини Маус - МС Подстилка
В тебе грайма нет, слушай Меззу
Твой флоу — Рогатка, давалка с Версус
Флоу — шлюшка. Гулял с другими
Флоу — пушка. Слова, как гири
Чейни, помнишь на финале тебя знатно слили?
Ты хотел мне отплатить? Сука, скинь на Qiwi
Просто мусор, просто клининг
После тусы топить под lean'ом
Последний чирик, свое горе пятаки
Воскрешаю русский grime, будто Соня клирик
Я зомби-критик. Под зомби Риддим
Качусь в темноте мимо зон бикини
Но меня не проведешь, как Иисуса на мякине
Пусть твоё очко не клумба, но мы всё же засадили туда
Семя антихайпа
Я сожру тебя с говном со всеми котяхами
Ты боишься насекомых, ебанный гук
Тебя собьет мой Volkswagen Жук
Какие панчи?
Какие люди, такие панчи
Эти 2 подружки, сестрички Олсен
И отсосут сестрички awesome
Сестрички awesome
И отсосут сестрички awesome (Ах)
Эпидемия (ях), говнорэперов (рав!)
Я не буду даже сильно тут батлить вас
Эпидемия (ях), говнорэперов (рав!)
На десерт у меня твой шоколадный глаз

[#SLOVOSPB, Mickey Mouse]
[Hook]
Я рву бит каждый день. Это моя тактика
Я хочу, чтобы в зале кричали: ""Нахуй Антихайп""
Я рву бит каждый день. Это моя тактика
Я хочу, чтобы в зале кричали: ""Нахуй Антихайп""
Я рву бит каждый день. Это моя тактика
Я хочу, чтобы в зале кричали: ""Нахуй Антихайп""
Я рву бит каждый день. Это моя тактика
Я хочу, чтобы в зале кричали: ""Нахуй Антихайп""

[Verse]
Какой антихайп? Ты продался
Делая то что модно и что хочет челядь
Но чем больше сосешь, тем больше челюсть
Ты боишься Мирона, будто он чеченец
В тебе грайма нет и не было никогда
Переоценен, как в Юнайтед Погба

[Hook]
Я рву бит каждый день. Это моя тактика
Я хочу, чтобы в зале кричали: ""Нахуй Антихайп""
Я рву бит каждый день. Это моя тактика
Я хочу, чтобы в зале кричали: ""Нахуй Антихайп""
Я рву бит каждый день. Это моя тактика
Я хочу, чтобы в зале кричали: ""Нахуй Антихайп""
Ты убит на бите. Это моя тактика
Я хочу, чтобы в зале кричали: ""Нахуй Антихайп""

[Verse]
Какой антихайп? Ты продался
Делая то что модно и что хочет челядь
Но чем больше сосешь, тем больше челюсть
Ты боишься Мирона, будто он чеченец
В тебе грайма нет и не было никогда
Переоценен, как в Юнайтед Погба
Тебе дали хайпа, чуть больше бабла
И ты отрекся от того что раньше сказал
""Я лучше сдохну ебанным ноунеймом
Чем прославлюсь и стану тобой""
Вот это жопа, прям как у J. Lo
Можешь убить себя прям перед толпой
Ой, что передумал?
Где же совесть ты нашел Яндекс или Google
Скрывался, ставил на mute трубку
Ты продал имя, как свою куртку
Твой слушатель дети 12 лет
Ты певец малолеток и это твой удел
Посасывать хуец за монету тут пиздец
Опонненту, как членом бы ты не дудел
Штамповка! Где прежний запал и дух интеллекта
Андрюха сказал - Слава в миг исполнил, потому как Андрюха директор
Это хайп машина по продаже мерча и походу она грузовая
Нахуй качество, писать на количество легче, похоже на игру Замая
Слушатель, ты не поверишь глазам
Все его заслуги - это zero
Всю твою известность сделал ты сам?
Всю твои известность сделал Мирон
Куплеты тоска
Ведь это говно или подснежник
Да бля!
Замая ведь отсюда и так срежут

[Hook]
Каждый день. Это моя тактика
Я хочу, чтобы в зале кричали: ""Нахуй Антихайп""
Ты убит на бите. Это моя тактика
Я хочу, чтобы в зале кричали: ""Нахуй Антихайп""

[Outro]
Нахуй вас пидоры
""Нахуй Антихайп""
""Нахуй Антихайп""
""Нахуй Антихайп""
""Нахуй Антихайп""

[#SLOVOSPB, Чейни]
[Intro]
У него антихайп головного мозга
Головного мозга...

[Hook]
Слава не забыл свои корни просто
У него Антихайп головного мозга
Замая мы просто ебали в дёсна
У него Антихайп головного мозга

Слава не забыл свои корни просто
У него Антихайп головного мозга
Замая мы просто ебали в дёсна
У него Антихайп головного мозга

[Verse]
Как наступить на это борзое ебало
Чтобы порция навоза нам на кросы не попала
Батл, не выходим босыми - мы два сапога пара
Кто-то не выходит Боссом из того самого бара

Парень, на их поле боя ты – воин не великий
Без пробы свежей крови – не ровня для элит
Хмурил брови на них, а они бровью не повели
И все от мала до велика тебя продинамили

И тут бам – без разбора
Будут на органы все из вас порваны
Здесь царь бомба, есть в нас порох
Сделать раздолбанным весь танцол
Ведь здесь сто сорок, а его пульс иной
Переплюнул тебя, убери соплю, не ной
Как морозить хуйню, так ты в плюсе, но
На этом минусе ты абсолютный ноль

Вам шах и мат, всего в один ход
Ты падший примат, а не злобный Кинг Конг
Динозавр, а залы с тех пор не битком
Твой рэп – это сайт испортил бит.ком

Ком этот встанет в горле белком
Его я заставлю ссать кипятком
Я бы на месте Мирона вас слал далеко
Вы не антихайп - вы Слава и Ко

Слишком жестко, воу
Ты мне на батле не товарищ, а тамбовский волк
Это повесть Крылова – лаять брось, хуйло
Ведь у меня глаза, как у Слона, на Моську, лох

До вызова Мирона вас врозь вело
Замай притянутый за уши - в твой силок
Ты его бросил в лодку, но с его скиллом
Это говно не улов - оно само всплыло

Или как Бог над водой –
Иконой для потомков Тупака, Кападонны
В рэпе ты дедок, типа тебе так удобно?
А рвать на биток так – нихуя подобного

Вдох – снова под воду. И потом
Если вы, гондоны, тупо из-за опыта готовы
Называть воды потоком этот топовый потоп
То у кого-то много опыта тут только допотопного


Пробил как дно эхолот
Это мой прорыв года через твой потолок
Ты в ступе годы, а не воду толок
В говно по локоть - ты не воин болот

Замая мы просто ебали в дёсна
У тебя Антихайп головного мозга
Слава не забыл свои корни просто
У него Антихайп головного мозга

Я бы мог это доказывать, но
Мне без мазы из пальца высасывать гной
Одной твоей фразой пересказанной мной
Я за раз смою 2 заразы в одной

Суй в анус весь fame, Слава
Пиздуй нахуй звездой батлов
Долбись в сраку, я останусь
Ведь сверху, падла, больнее падать

[Антихайп, Замай]
[Intro]
Чейни!
Ты не прав, Чейни!
Пошел нахуй

[Hook]
Рвать на битах
Нахуй твой грайм
Рвать на битах
Нахуй твой грайм
Рвать на битах
Рвать на битах
Нахуй твой грайм
Е-е-е

[Verse 1]
Самый вырезаемый МЦ
А ты кто? Просто прицеп
В этой рэп игре, Ден Чейни
Я тут хан, а ты челядь

Че ты хочешь? Блять, я не понял
Позвал на бой, ты шоли гомик
Тебя в порнухе позовут на бис
Ведь меня учил стилю Рома Tills

[Hook]
Рвать на битах
Рвать на битах
Нахуй твой грайм
Рвать на битах
Рвать на битах
Рвать на битах
Нахуй твой хайп

[Verse 2]
Твой грайм - грим, ты не grime green
Твой блинк-блинк - это блин, блин
Ты не Кингпин, кретин
Твои панчи в молоко или кефир?

Тараторка года, ты как ебаный робот
Бит не замечаешь вовсе
Но бомбит, когда пролетаешь мимо орбит
Хайпа

Ты просто калека, ты мне не коллега
Я буду рвать тебя на битах
Мне похуй, Чейни

Рвать на битах
Рвать на битах
Нахуй твой грайм
Рвать на битах

Рвать на битах
Нахуй твой грайм
Я хан Замай
Рвать на битах

Рвать на битах
Нахуй твой грайм
Нахуй твой грайм
Че? Че? Рвать на битах

(Пошел нахуй Чейни я ебал тебя в рот)

Рвать на битах
Рвать на битах
Нахуй твой грайм
Нахуй твой грайм

[Командный раунд, Антихайп]

[Замай]
[Intro]
Хуевый, плохой, злой
Хуевый, плохой, злой
Хуевый, плохой, злой

[Verse]
Тысячи, тысячи, не совершенных грехов, еще
Тонны бумаги, тыщи, не марами дворов, трущоб
Килограммы на форматы, класть еще плотью тюки
Ведь я в лучах звездной болезни, как Склодовская-Кюри

И подохну когда придавит плитой ядерный гриф
Но позже чем, дядька Сэм тебя Микки Маус раскабалит
Ты как в цирке на туловище маска и парик
А я по жизне ебанутый, Дай мне 9 грамм, Айболит

Из чрева вылезает новый парадокс герой
Опустели кинозалы, просмотровое окно
Горит одно лишь, будто пуканы, всех этих прото звезд
Я Рокко Сиффреди, трахал вас в разных позах, но всерьез

[Hook]
Слово СПБ, холопы ТНТ
Вы уздечку на битах порвали? Не смеши людей
Ден Чейни, Микки Маус в белом доме комикс
Хуевый, плохой, злой Замай и Соня

Слово СПБ, холопы ТНТ
Вы уздечку на битах порвали? Не смеши людей
Че-че? в белом доме комикс
Хуевый, плохой, злой - это Замай и Соня

[СЛАВА КПСС]
Рвать на битах свою сраную глотку
Я не стану, мне надо бомбу
Набить гвоздями, подайте хавчик
И покурить, словно я Крысавчик

От фитиля
Что за жаркий пудель? Мс. Фигляр
Дикий Чейни, как Джеки Чан, но
Одену его туз, как футляр (р-р!)

Кого порвать? На каких битосах? Ты что Кобейн?
Любишь 2 ствола во рту. Порнохабу ты сказал: ""god damn""
Видя, как сосут эти малышки на битах
Ваша крыша уже едет, словно Чейни cadillac

Тучно, белая корова. Назовитесь ""Як-як-як""
Но я прожарю это мясо, словно в передаче ""Смак""
Отъезжаю от напасов, но верю все не напрасно
Моя туса, строго в красном. Зюганов и Карла Маркса

Борода светит вам
Твой черный flow - у меня Ку-клукс клан
Dead party, со мной Кыргызстан
Домой дойдете, но по кускам

Слова из книги ""О великом Чейни""
Но тут не слова о великом Чейни
Ведь это книга о великом Чейни
И тут не строчки из великой, сука, книги Чейни

Слово СПБ (книга Чейни), холопы ТНТ (книга Чейни)
Вы уздечку на битах (книга Чейни) порвали, не смеши людей

Чейни, Mickey Mouse, пошел-ка ты нахуй

Книга Чейни

Не смеши людей
Mickey Mouse и Чейни в белом доме комикс
Хуевый, плохой и злой - это Замай и Соня

[Командный раунд, #SLOVOSPB]

[Чейни]
[Verse]
Я живу не чтобы фан меня любил и целовал
Мое имя на могиле набивает цену вам
Или двигаться по фану из вагины в целлофан
На свет в конце туннеля, чтобы кинуться на фары

Будто пес, что бежит под колеса машины
Пока я жив ты просто скажи мне, что
Разменять мой возраст ошибок
На вшивую жизнь, этих полных фальшивок?

Нахуй вам жить на полусогнутых
Если на них не доходили до высот вы
Если вы, до выноса команды Зондер
Вскрылись и выдохлись, как банки содовой

Щека Бога, твоя щека
Я вещаю из убогого ящика, в будущем
Но 4 года маячив тут
Ставил крест на своем настоящем

А вы таращиться будете, да
На нем суммы просмотров без букв и дат
Но мне лететь на удар, в темноту не беда
Мне ничто осветит этот путь в никуда

Камикадзе все ближе к земле
И вселенная дышит этим выбросом лет
Один вдох, все выжать в себе
В забеге к себе, ведь ты же сильнее

Батл-рэп мне как, Мекка она теперь
Меня доведет от фаната до фанатика
Если эту секту придать, то анафеме
На волоске висят, как на канате

Проклинать его, он тянет вниз
А время альпинист, вниз это немыслимо
Снова чистый лист, но хуже для Дениса
Это рвать на битах душу атеиста

[Hook]
Пока мы летаем там, где Икар не летал
Вы стоите на своем, как Земля на китах
Мне на плечи давит дар, я как планку Титан
Держу SLOVOSPB и буду рвать на битах

Пока мы летаем там, где Икар не летал
Вы стоите на своем, как Земля на китах
Мне на плечи давит дар, я как планку Титан
Держу SLOVOSPB и буду рвать на битах

[Mickey Mouse]
[Verse]
Работал долго, ведь был никем
Выборг не Лондон, а Бирмингем
Я все вам отдал, чтобы быть свободным
Тут безысходность под BPM

Мы делали батлы по фану
До того, как это стало мейнстримом
Всем было поебать на рекламу
Если в кругу, то стадо не стимул

Путь от Альфа бара, до финала в А2
Будто полный зал или ебаный подвал
Я прошел не за день, не надо бабла
И мой flow теперь тебе достанет до гланд

#SLOVOSPB
И это значит то что я уже весь в игре
Не замечал ухмылок в спину и спесь гиен
Мы им брезгуем, время отсекало лишних, как лезвием

Я проклят
И в этом вся моя карма
Мой город Gotham, мой мир DC
А не счастливый и красочный Marvel

Скажи мне сука хоть что-то
То, что я и так не знал о себе
Меня не любили паблики ваши элитные
Зато самоотдача стала сильнее

И ярость огней я не замечал
Меня не остановить дернув за рычаг
И кажется мне я прожигал каждый свой день
Как до записи летела неделя за час

И я рву на битах, ведь другого выхода нет
Первые струны (что выдавали аккомпанемент)
Нас копировали всех под один трафарет
Ведь мы #SLOVOSPB и нас хранит Бафомет

[Hook]
Мы летаем там, где Икар не летал
Вы стоите на своем, как Земля на китах
Мне на плечи давит дар, я как планку Титан
Держу SLOVOSPB и буду рвать на битах

Пока мы летаем там, где Икар не летал
Вы стоите на своем, как Земля на китах
Мне на плечи давит дар, я как планку Титан
Держу SLOVOSPB и буду рвать на битах

Пока мы летаем там, где Икар не летал
Вы стоите на своем, как Земля на китах
Мне на плечи давит дар, я как планку Титан
Держу SLOVOSPB и буду рвать на битах

Пока мы летаем там, где Икар не летал
Вы стоите на своем, как Земля на китах
Мне на плечи давит дар, я как планку Титан
Держу SLOVOSPB и буду рвать на битах",Рвать на битах (Rvat Na Bitah),1982,"[2, 2, 1, 3, 6, 7, 13, 27, 30, 34, 38, 39, 48, 56, 63, 71, 83]",17
