,title,lyrics,artists,date,rank,cnt
103,You've Got Another Thing Comin',"[Verse 1]
One life I'm gonna live it up
I'm takin' flight I said I'll never get enough
Stand tall I'm young and kinda proud
I'm on top as long as the music's loud

[Chorus 1]
If you think I'll sit around as the world goes by
You're thinkin' like a fool cause it's a case of ""do or die""
Out there is a fortune waitin' to be had
You think I'll let it go? You're mad
You've got another thing comin'
You've got another thing comin'

[Verse 2]
That's right, here's where the talkin' ends
Well listen this night there'll be some action spent
Drive hard I'm callin' all the shots
I got an ace card comin' down on the rocks

[Chorus 2]
If you think I'll sit around while you chip away my brain
Listen I ain't foolin' and you'd better think again
Out there is a fortune waitin' to be had
You think I'll let it go? You're mad
You got another thing comin'
You got another thing comin'
You got another thing comin'

[Bridge]
In this world we're livin' in, we have our share of sorrow
Answer now is don't give in, aim for a new tomorrow

[Guitar Solo]

[Verse 3]
Oh so hot, no time to take a rest yeah
Act tough, ain't room for second best
Real strong, got me some security
Hey, I'm a big smash, I'm goin' for infinity yeah

[Chorus 1]
If you think I'll sit around as the world goes by
You're thinkin' like a fool cause it's a case of ""do or die""
Out there is a fortune waitin' to be had
You think I'll let it go? You're mad
You've got another thing comin'
You got another thing comin'
You got another thing comin'
You got another thing comin'

[Outro]
You got another thing comin'
You got another thing comin'
You got another thing comin'
You got another thing comin'
You got another thing comin'
You got another thing comin'
You got another thing comin'
You got another thing comin'",Judas Priest,1982,"[97, 87, 67, 67, 73, 82, 90]",7
104,Eye In The Sky,"[verse 1]
I think that I'm addicted to praying
Cause I finally found someone who understands what I'm saying
I don't have to be ashamed of who I am or how I feel just bein real when  I say I'm not embarrassed to say it
I look at other people, and I know we're not equal
But I just smile and get along because my pride can be lethal
Did I mention that I'm good at making illegal legal
I feel bad because you made me with these cool special features

Man I used be clumsy but I done learned how to juggle
The way I'm flexing my muscle it's getting hard to stay humble
I just jump over mountains like I don't know how to struggle
I'm talking climbing up easy like I was friends with Repunzel
Don't need a light in my tunnel
Because I know that you're with me
Every step by step RIP goes out to Whitney
Slow it down like in Houston
I hear some supporters rooting but none them gone take a bullet when these people start shooting
I just realized that I'm crazy I'd prolly crash a Mercedes
Just to prove to a nonbeliever Jesus Christ is the savior
I'm just tryna be apart do y'all accept behavior
I'm just tryna look apart I'll cut my face with a razor
Do I look good??
Wontchu come over for dinner don't I cook good?
Am I good enough do you like my neighborhood haaa?
Don't I fit the label good haaan or nah?

I'm so sophisticated, It's not the Jordan's man I worked to get this elevation
I'm tryna master every principle no limitation
I'm just tryna give my gift back to the creator
And ain't nobody have to teach me how to be creative
My mind is so amazing, should've of been in the matrix, I refuse to be basic
Do you think that I'm crazy, I'm tryna raise the ratings
Without having a baby, I'm the black power ranger
The things I used to like I don't enjoy em no mo
I got a new group friends I ain't lonely no mo
I finally met some people that are better than my equal, so now I can learn from them I'm not the coldest no mo
And since I'd rather hang with em old friends say that I'm distant
But you can't deny we ain't the same homies no more
I'm slayin dragons, I'm movin faster, I'm climb'n ladders, I'm sorry y'all I ain't ridin ponys no more

God you know I got issues, That involve repetition man I know she prolly mad cause I won't make the commitment
I'm really glad that you approve but we can't make it official
I'm just too afraid to lose and I refuse to need tissue
My cousin Dillon just died, car accident rocked him
And I hate it cause I wish somebody just woulda shot him
Man we coulda got the dude who did it just to say that we got him
I just need someone to blame I guess I do have a problem

[Hook]
You think that you know but I promise you don't you don't know what Im thinking
Im hot and I'm cold all inside I'm alive but I don't know the season
I don't know what's real and what's not, you see that my eyes are not blinking
Don't know what to believe in?
He knows that you're thinking
[repeat hook]

[outro]
I understand that I'm ugly, but I don't care cause I still love me
And Ima tell my dad on you cause it ain't funny, ha ha ha
I know he knows, I know he knows, I know he knows, I knows he knows
He knows, he knows, he knows...(repeat)",Aha Gazelle,1982,"[98, 95, 79, 55, 26, 11, 6, 3, 3, 3, 4, 6, 6, 9, 14, 14, 15, 17, 23, 28, 35, 44, 56, 72, 85]",25
105,Get Closer,"Darlin' if you want me to be closer to you, get closer to me
Darlin' if you want me to be closer to you, get closer to me
Darlin' if you want me to love, love only you, then love only me
Darlin' if you want me to see, see only you, then see only me

There's a line, I can't cross over
It's no good for me and it's no good for you

And there's a feelin', deep down inside me
I can't explain it and you're wondering why
You say we've been like strangers
But I'm not the others you can wrap 'round your fingers

Darlin' if you want me to be closer to you, get closer to me
Darlin' if you want me to be closer to you, get closer to me
Darlin' if you want me to love, love only you, then love only me
Darlin' if you want me to see, see only you, then see only me

There was a time, when I would come runnin'
I'd drop everything for the touch of your hand in mine

You were blind
And now you regret it
'Cause I can't forget it
It's locked in my mind
And I can't go on livin'

Day to day
Wondering if we'll be here tomorrow
People change and you're changin'
And I've given you my all
There's no more to borrow

Darlin' if you want me to be closer to you, get closer to me
Darlin' if you want me to be closer to you, get closer to me
Darlin' if you want me to love, love only you, then love only me
Darlin' if you want me to see, see only you, then see only me",Seals And Crofts,1982,"[99, 96, 81, 56, 29, 29, 31, 34, 40, 47, 62, 72]",12
106,Wake Up My Love,"[Verse 1]
Here I go again
Hear that knocking, won't you let me in?
Only want that same old thing
Yet it's me here ring, ring, ring

[Chorus]
I want your love, wake up my love and let it in

[Verse 2]
Well, you know it's me out here
Can't give up now, let us make that clear
All I've had's the run around
Though I'm barking like some hound

[Chorus]
I want your love, wake up my love and let it in
I want your love, wake up my love and let it in

[Verse 3]
My life's been so many ways
Too much darkness gets me crazed
All around us people fight
Christ, I'm looking for some light

[Chorus]
Inside your love, wake up my love and let it in

[Verse 4]
I don't have no friends of mine
Who can swing me down that vine
Not much sense in what I do
That is why I'm calling you

Inside my love
Wake up my love
And let it in

I want your love
Wake up my love
And let it in

Wake up my love
Wake up my love
And let it in

Oh I need you, Lord
I need you more
The emptiness outside
Lord, it drives me wild

I got tired of wrong and right
You can see I need your light
And that's me knocking on your door
And it's you I'm looking for

Oh, Lord
Oh, Lord
Wake up my love
Let it in

I want you love
Wake up my love
And let it in

I want you love
Wake up my love
And let it in",George Harrison,1982,"[100, 53, 53, 60, 68]",5
107,Pledge Pin,"Watch them go
'cause one by one they rise to fall
Hearts in tow
It's just a game - she's only having fun
She laughs and turns away surprised
She mocks it all the same
Tonight's the loss tomorrow's gain
And in the end it's so

Stand in line
As one by one they march in time
In the wings
I stand and watch these foolish things go by
Just preparing for the play
Aloof she moves
The confidante, with practiced step
The merry dance she executes her role, role

As the cavalcade begins to thin
Do you stop and look around
Free to choose but not to win -
You're just too late
Your show is at an end -
Now you're the victim of your game
Through your fingers watch them slip
Familiar rules just hit and miss
For the one who never shows",Robert Plant,1982,"[89, 74, 74, 82, 89]",5
108,You Can Do Magic,"I never believed in things that I couldn't see
I said if I can't feel it then how can it be
No, no magic could happen to me
And then I saw you

I couldn't believe it, you took my heart
I couldn't retrieve it, said to myself
What's it all about
Now I know there can be no doubt

You can do magic
You can have anything that you desire
Magic, and you know
You're the one who can put out the fire

You know darn well
When you cast your spell you will get your way
When you hypnotize with your eyes
A heart of stone can turn to clay

And when the rain is beatin' upon the window pane
And when the night, it gets so cold, when I can't sleep
Again you come to me
I hold you tight, the rain disappears
Who would believe it
With a word you dry my tears

You can do magic
You can have anything that you desire
Magic, and you know
You're the one who can put out the fire

You know darn well
When you cast your spell you will get your way
When you hypnotize with your eyes
A heart of stone can turn to clay

And if I wanted to
I could never be free
I never believed it was so true
But now it's so clear to me

You can do magic
You can have anything that you desire
Magic, and you know
You're the one who can put out the fire

You know darn well
When you cast your spell you will get your way
When you hypnotize with your eyes
A heart of stone can turn to clay",America,1982,"[92, 75, 34, 23, 8, 8, 8, 8, 8, 9, 11, 12, 14, 18, 20, 23, 27, 43, 60, 74]",20
109,I Keep Forgettin' (Every Time You're Near),"[Chorus]
I keep forgettin' we're not in love anymore
I keep forgettin' things will never be the same again
I keep forgettin' how you made that so clear
I keep forgettin'

[Verse 1]
Everytime you're near
Everytime I see you smile
Hear your ""hello""
Saying you can only stay a while

[Pre-Chorus 1]
Hey, I know that it's hard for you
To say the things that we both know are true
But tell me how come (I)

[Chorus]
I keep forgettin' we're not in love anymore
I keep forgettin' things will never be the same again
I keep forgettin' how you made that so clear
I keep forgettin'

[Verse 2]
Everytime I hear
How you never want to live a lie
How it's gone too far
And you don't have to tell me why

[Pre-Chorus 2]
Why you're gone and why the game is through
If this is what's real, if this is what's true
Tell me how come (I)

[Chorus]
I keep forgettin' we're not in love anymore (Baby)
I keep forgettin' things will never be the same again
I keep forgettin' how you made that so clear (Yeah)
I keep forgettin'

[Bridge]
Don't say that, don't say that, don't say that
I know you're not mine anymore-anyway-anytime
But tell me how come (I)

[Chorus]
I keep forgettin' we're not in love anymore
I keep forgettin' things will never be the same again
I keep forgettin' how you made that so clear
I keep forgettin'
I keep forgettin' we're not in love anymore
I keep forgettin' things will never be the same again
I keep forgettin' how you made that so clear
I keep forgettin'",Michael McDonald,1982,"[93, 76, 46, 25, 9, 4, 4, 4, 6, 7, 9, 15, 21, 25, 28, 33, 44, 55, 69]",19
110,I Wouldn't Beg For Water,"I make friends, I make enemies, it doesn't matter all that much to me
I'm not the kind who deals behind the scenes
I won't sell my soul, I'd be nothing without some integrity

Chorus:
I wouldn't beg for water, I wouldn't beg for water
If my soul was on fire, that's the last thing I would ever do
I wouldn't beg for water, I wouldn't beg for water
If my soul was on fire, but I'd get down on my knees for you

I've got pride, it's not the foolish kind
Don't owe people favours, that's my peace of mind
I don't know why I deserve someone like you
But you're my one and only sole exception to all my rules

Chorus

Real love is hard to find, as holding back the sands of time
And time can change my life as much as you

I wouldn't beg for water, I wouldn't beg for water
If my soul was on fire, you know me well enough to know it's true
I wouldn't beg for water, I wouldn't beg for water
(If my soul was on fire), but I'd get down on my knees for you",Sheena Easton,1982,"[97, 83, 64, 64, 64, 74, 86]",7
111,The One You Love,"I know you need a friend, someone you can talk to
Who will understand what you're going through
When it comes to love, there's no easy answer
Only you can say what you're gonna do

I heard you on the phone, you took his number
Said you weren't alone, but you'd call him soon
Isn't he the guy, the guy who left you cryin'?
Isn't he the one who made you blue?

When you remember those nights in his arms
You know you gotta make up your mind

Are you gonna stay with the one who loves you
Or are you goin' back to the one you love?
Someone's gonna cry when they know they've lost you
Someone's gonna thank the stars above

What you gonna say when he comes over?
There's no easy way to see this through
All the broken dreams, all the disappointment
Oh girl, what you gonna do?

Your heart keeps sayin' it's just not fair
But still you gotta make up your mind

Are you gonna stay with the one who loves you
Or are you goin' back to the one you love?
Someone's gonna cry when they know they've lost you
Someone's gonna thank the stars above",Glenn Frey,1982,"[98, 88, 75, 34, 15, 15, 16, 20, 22, 26, 32, 33, 35, 39, 53, 75, 87]",17
112,Love Come Down,"[Intro]
Love come down
All the way down

[Verse 1]
No sleep last night
Been dreaming of you
Please hold me tight
Cause I can't help the way that I feel
I just can't help the way that I feel

Deep in the night
You took my heart
Now danger's in sight
Cause I can't help the way that I feel
I just can't help the way that I feel
Do, do, dit, dit, dit, dit, dit, dit, do, do, do

[Chorus]
Baby, you make my love come down
You make my love come down
Make it come all the way down
Oh you make my love come down
Baby, you make my love come down
You make my love come down

[Verse 2]
Can't do without your tender love
There's no way out
And I can't help the way that I feel
I just can't help the way that I feel
Your love has a force
Got me under your spell
So take me on yours
And I can't help the way that I feel
I just can't help the way that I feel
Shoo, doo, doo, doo, doo, doo, doo, doo, doo, doo, doo, oh


[Chorus]
Baby, you make my love come down
You make my love come down
Make it come all the way down
You make my love come down
Inside out when you're around
Ooh, you make my love come down (Baby, you make)
(Baby, you make my)

[Bridge]
Love come down
Ooh, you make my love come down
Make it come all the way down
You make my love come down
Inside out when you're around
Ooh, you make my love come down (Baby, you make)
(Baby, you make)
(Love come down)

[Outro]
I can't help the way that I feel without you, baby
I can't help the way I feel
(All the way down)
You make my, you make my love come down
(You're around)
When you're around, baby, yeah
(Baby, you make, baby, you make my love come down)
Baby, you make my love come down, come down
Come down",Evelyn “Champagne” King,1982,"[99, 90, 81, 38, 17, 17, 20, 22, 30, 32, 36, 43, 49, 63, 76, 85]",16
113,Break It To Me Gently,"Did you think that your smile
Could hide what's on your mind?
No matter how I tried
I just couldn't be so blind
We've been close but people grow
And they sometimes grow apart
There's just one thing I ask you
If you've had a change of heart…

CHORUS:
(And)Break it to me gently
If ya have to, then tell me lies
Break it to me gently
At least leave me with my pride
Try to spare my feelings
If the feelings have to die
Break it to me gently
If you have to say goodbye

I'm not ashamed to admit
I really hurt inside
After all these are my feelings
Why should I make them hide?
But I won't hold you back
There'll be no pulling on your sleeve
Just let me down easy
And go softly when you leave…

CHORUS:
(And)Break it to me gently
If ya have to, then tell me lies
Break it to me gently
At least leave me with my pride
Try to spare my feelings
If the feelings have to die
Break it to me gently
If you have to say goodbye

You always knew that you had my heart
It's still yours, if you wanna take it
But when you go, as I know you must
Be gentle with your breaking

CHORUS:
(And)Break it to me gently
If ya have to, then tell me lies
Break it to me gently
At least leave me with my pride
Trust me and my feelings
If the feelings have to die
Break it to me gently
If you have to say goodbye

Break it to me gently
If you have to say goodbye
Goodbye, goodbye...",Angela Bofill,1982,"[100, 91, 86, 62, 24, 11, 11, 11, 13, 13, 15, 27, 36, 40, 47, 53, 74]",17
114,Valerie,"[Verse 1]
There comes a time in a man's life
Where he must take responsibility
For the choices he has made
And there are certain things that he must do
Things that he must say

[Chorus]
Like I love you
And I need you
I only want you
And nobody's going to know if it's true

[Verse 2]
I never thought I'd feel this kind of hesitation (To put)
My hand on another girl
I wish I didn't have to lie
I wish I could let you know

[Chorus]
'Cause I love you
And I need you
I only want you
And nobody's going to know if it's true

[Bridge]
Valerie (Oh, Valerie)
I know you can see through me
(I know you can see through my lies)
Valerie (Oh, Valerie)
You just choose to never know
(No, you just don’t know what I do, what I do, oh, Valerie)
Valerie
Why pretend to trust in me?
(I don't know why you try to trust in me baby, but I think I know)
Valerie (I know, Valerie)
You'd rather this than be alone

[Chorus]
'Cause I love you
And I need you
I only want you
And nobody's going to know if it's true
'Cause I love you
And I need you
I only want you
And nobody's going to know if it's true

[Outro]
And I love you
('Cause I love you baby)
And I need you
(When I need, need)
I only want you
And nobody gonna know...",The Weeknd,1982,"[87, 70, 70, 79]",4
115,New World Man,"[Verse 1]
He's a rebel and a runner
He's a signal turning green
He's a restless young romantic
Wants to run the big machine
He's got a problem with his poisons
But you know he'll find a cure
He's cleaning up his systems
To keep his nature pure

[Pre-Chorus]
Learning to match the beat of the Old World Man
Learning to catch the heat of the Third World Man

[Chorus 1]
He's got to make his own mistakes
And learn to mend the mess he makes
He's old enough to know what's right
But young enough not to choose it
He's noble enough to win the world
But weak enough to lose it
He's a New World Man

[Verse 2]
He's a radio receiver
Tuned to factories and farms
He's a writer and a ranger
And a young boy bearing arms
He's got a problem with his power
With weapons on patrol
He's got to walk a fine line
And keep his self-control

[Pre-Chorus]
Trying to save the day for the Old World Man
Trying to pave the way for the Third World Man

[Chorus 2]
He's not concerned with yesterday
He knows constant change is here today
He's noble enough to know what's right
But weak enough not to choose it
He's wise enough to win the world
But fool enough to lose it
He's a New World Man

[Outro]
Learning to match the beat of the Old World Man
He's learning to catch the heat of the Third World Man

He's a New World Man [2x]",Rush,1982,"[89, 83, 54, 21, 21, 21, 23, 27, 33, 53, 63, 72]",12
116,Gypsy,"[Verse 1]
Sometimes a story has no end
Sometimes I think that we could just be friends
""'Cause I'm a wandering man,"" he said to me
""And what about the future plans?
Does this thing we have even makes sense?
When I got the whole world in front of me?""
So, I said...

[Chorus 1]
I don't wanna be alone forever, but I can be tonight
I don't wanna be alone forever, but I love gypsy life
I don't wanna be alone forever
Maybe we can see the world together
I don't wanna be alone forever, but I can be
Tonight!
Tonight!

[Verse 2]
So I just packed my baggage, and
Said goodbye to family and friends
And took a road to nowhere on my own
Like Dorothy on a yellow brick
Hope my ruby shoes get us there quick
'Cause I left everyone I love at home

[Chorus 1]
I don't wanna be alone forever, but I can be tonight
I don't wanna be alone forever, but I love gypsy life
I don't wanna be alone forever
Maybe we can see the world together
I don't wanna be alone forever, but I can be
Tonight!
Tonight!

[Hook]
'Cause I'm, I'm, I'm, I'm, I'm, I'm a gypsy, gypsy, gypsy, I'm
I'm, I'm, I'm, I'm, I'm, I'm a gypsy, gypsy, gypsy, I'm
I'm, I'm, I'm, I'm, I'm, I'm a gypsy, gypsy, gypsy, I'm
I'm, I'm, I'm, I'm, I'm, I'm a gypsy, gypsy, gypsy, I'm

[Bridge]
And then he asked me, he said
""Baby, why do we love each other?""
I said, ""Honey, it's simple
It's the way that you love and treat your mother.""

[Chorus 2]
Thought that I would be alone forever, but I won't be tonight
I'm a man without a home, but I think with you, I could spend my life
And you'll be my little gypsy princess
Pack your bags and we can chase the sunset
Bust the rearview and fire up the jets
'Cause it's you and me
Baby, for life (if you go with me)
For life (see the world with me)

[Hook]
'Cause I'm, I'm, I'm, I'm, I'm, I'm a gypsy, gypsy, gypsy, I'm
I'm, I'm, I'm, I'm, I'm, I'm a gypsy, gypsy, gypsy, I'm

[Outro]
Russia, UK, Paris
I'm Italian, Asian kompai
Africa, India, I'm a gypsy, gypsy, gypsy
I'm Latin-American
I don't speak German, but I try
Someday in Jakarta
I'm American, I'm gypsy
I'm Bangkok, Australian, Malaysia
Sweden, Finland, Norway
Be my home just for the day
I'm a gypsy, gypsy, gypsy
Hey...",Lady Gaga,1982,"[93, 87, 65, 27, 12, 12, 12, 15, 21, 27, 35, 46, 57, 69]",14
