,title,lyrics,artists,date,rank,cnt
182,Pop,"[Intro: Uncle Luke, Rick Ross, French Montana & Drake]
Don't stop, pop that, don't stop
Pop that, pop that, pop that
Don't stop, pop that, don't stop
Drop that pussy, bitch
Pop that pussy, pussy
What you twerkin' with?
Don't stop, pop that, don't stop
I'm Young Papi, Champagne
Pop that, pop that, pop that
They know the face, and they know the name
Don't stop, pop that, don't stop
Bounce
Drop that pussy, bitch
What you twerkin' with?

[Chorus: Uncle Luke & French Montana]
Don't stop, pop that, don't stop
Pop that, pop that
Work, work, work, work, bounce
Don't stop, pop that, don't stop
Pop that pussy
Work, work, work, what you twerkin' with? (Bounce)
Don't stop, pop that, don't stop
Pop that, pop that, pop that
Work, work, work, work, bounce
Don't stop, pop that, don't stop
Work, work, work, what you twerkin' with? (Bounce)
Don't stop, pop that, don't stop
Pop that, pop that, pop that
What you twerkin' with?
Don't stop, pop that, don't stop
Pop that, pussy, pussy
What you twerkin' with?
Don't stop, pop that, don't stop
Pop that, pop that, pop that
What you twerkin' with?
Don't stop, pop that, don't stop
Pop that, pussy, pussy
What you twerkin' with?

[Verse 1: French Montana]
Ayy, ayy, ayy, ayy, Montana!
Work-work-work-work-work-work
What you twerkin' with?
Throw it, bust it open
Show me what you twerkin' with
Ass so fat need a lap dance
I'm in that white ghost chasin' Pac-Man
Hundred out the lot, I be leanin', that CÎROC
Hundred large, bring a mop
Car's tinted like Barack
Got a Brinks truck in my pocket (Pocket)
30 chains on my collar (Collar)
Two drops, no mileage (Mileage)
Top off like Wallace
And I'm inhalin' smoke, bitch know that (Know that)
Filthy rich before rap ('Fore rap)
Your new deal, I throw that (Throw that)
Three beans I'm on that (Haaan)
We pop a molly (Haaan), she bust it open (Haaan)
She seen the 'gatti (Haaan), that pussy soakin' (Woo!)

[Chorus: Uncle Luke, French Montana & Rick Ross]
Don't stop, pop that, don't stop
Pop that, pop that, pop that (Bounce)
Don't stop, pop that, don't stop
Pop that, pussy, pussy
What you twerkin' with?
Don't stop, pop that, don't stop
Shout out to the infernos
Pop that, pop that, pop that (Bounce)
Strawberries, Luke what it do?
Don't stop, pop that, don't stop
Let's go
Pop that, pussy, pussy
What you twerkin' with?

[Verse 2: Rick Ross]
I love my big booty bitches, my life a Godfather picture
Local club in my city, I fell in love with a stripper
Bitches know I'm that nigga, talkin' four-door Bugatti
I'm the life of the party, let's get these hoes on the Molly
You know I came to stunt, so drop that pussy, bitch
I got what you want, drop that pussy, bitch (Woo)
Film it, film it, this bitch want me to film it
Ballin', ballin' like I play for New England
Spend it, spend it, spend a stack every minute
That's 50... one hundred, I see no fuckin' limits
Shout out to Uncle Luke (Huh)
Shout out my bitches too (Huh)
We the 2 Live Crew
Two for me, two for you (Woo)
Feed them bitches carrots (Huh)
Fuck em like a rabbit
Sorry that's a habit, smoke a spliff and then I vanish

[Chorus: Uncle Luke, French Montana & Drake]
Don't stop, pop that, don't stop
Pop that, pop that, pop that (Bounce)
Don't stop, pop that, don't stop
Pop that, pussy, pussy
What you twerkin' with? (Yeah)
Don't stop, pop that, don't stop
Pop that, pop that, pop that (Bounce, don't stop)
Don't stop, pop that, don't stop
Let's go
Pop that, pussy, pussy
What you twerkin' with?

[Verse 3: Drake]
I'm about bein' single, seein' double, makin' triple (Right)
I hope you pussy niggas hatin' never make a nickel (Right)
It's good to make it better when your people make it with you
Money comin', money goin', ain't like you could take it with you (Alright)
It's about to be a hit right now, fuck back then we the shit right now
Dropped Take Care, bought a mothafuckin' crib
And I'm pickin' up the keys to the bitch right now
OVO that's major shit, Toronto with me that's mayor shit
Gettin cheddar packs like K.D., OKC that's player shit
We don't dress alike, we don't rap alike
I shine different, I rhyme different
Only thing you got is some years on me
Man fuck you and your time difference
I'm Young Papi, Champagne
They know the face and they know the name
Got one watch that could prolly pay for like all your chains
And you'd owe me change, ah!
Greystone, 20 bottles that's all me
On the couch, wildin' out yelling free my niggas 'til they all free
One of my closest dawgs got three kids and they all three
But we always been that type of crew that been good without a plan B, so

[Chorus: Uncle Luke & French Montana]
Don't stop, pop that, don't stop
Pop that, pop that, pop that (Bounce)
Don't stop, pop that, don't stop
Pop that, pussy, pussy
What you twerkin' with?
Don't stop, pop that, don't stop
Pop that, pop that, pop that (Bounce)
Don't stop, pop that, don't stop
Pop that, pussy, pussy
What you twerkin' with?

[Verse 4: Lil Wayne]
Bitch! Stop talkin' that shit
And suck a nigga dick for some Trukfit
Okay I fuck a bitch and I'm gone
That’s gangsta: Al Capone
I make that pussy spit like Bone
I'm talkin' 'bout bone, bone, bone bone
I'm fuckin' with French, excuse my French
I lose my mind before I lose my bitch
Money ain't a thing but a chicken wing
Bitch I ball like two eyelids
YMCM beat that pussy up, stop playin'
I make her ass scream and holla like rock bands
I'm a beast, I'm off the leash
I am rich like a bitch
On my Proactiv shit, pop that pussy like a zit
I go by the name Lil Tunechi
Your girl is a groupie
And nigga, you's a square
And I will twist you like in a Rubik's
Motherfucker I'm on my skateboard
Watch me do a trick, ho
I’m 5'5"" but I could 6-9
Then beat that pussy like Klitschko
It's French Montana, fuck Joe
It's Weezy F, fuck hoes
It's Truk the world
It's Truk yo girl
It's Trukfit by the truck load, biatch!

[Chorus: Uncle Luke, French Montana & Lil Wayne]
Don't stop, pop that, don't stop
Pop that, pop that, pop that (Bounce)
Don't stop, pop that, don't stop
Pop that, pussy, pussy (Oh yeah)
What you twerkin' with?
Don't stop, pop that, don't stop (I forgot)
Pop that, pop that, pop that (Bounce)
Don't stop, pop that, don't stop
What you twerkin' with?
Young Moolah, baby!",French Montana,2001,"[99, 90, 85, 73, 62, 55, 47, 41, 31, 25, 19, 19, 19, 23, 29]",15
183,Bia' Bia',"[Intro: Big Kap]
Ayo check this out, supreme figga nigga Big Kap
Rockin with Lil' Jon, Eastside Boyz, Chyna Whyte
(Ludacris nigga) $hort Dog (Ay tell them niggas what's up though)
If you scared, get the fuck out the club, nigga!

[Chorus: Lil' Jon]
Bia Bia (Get 'em up, get 'em up), why you actin' like a - like a (Push 'em off, push 'em off)
Bia Bia (Get 'em up, get 'em up), why you fussin' like a - like a (Push 'em off, push 'em off)
Bia Bia (Get 'em up, get 'em up), why you lookin' like a - like a (Push 'em off, push 'em off)
Bia Bia (Get 'me up, get 'em up), why you frontin' like a - like a (Push 'em off, push 'em off)
Bia Bia (Get 'em up, get 'em up), why you actin' like a - like a (Push 'em off, push 'em off)
Bia Bia (Get 'em up, get 'em up), why you fussin' like a - like a (Push 'em off, push 'em off)
Bia Bia (Get 'em up, get 'em up), why you lookin' like a - like a (Push 'em off, push 'em off)
Bia Bia (Get 'me up, get 'em up), why you frontin' like a - like a (Push 'em off, push 'em off)

[Verse 1: Lil' Jon]
Well get 'em up (Get 'em up), put 'em up (Put 'em up)
Stop actin' like a bitch and get yo hands up
Well get 'em up (Get 'em up), put 'em up (Put 'em up)
Stop actin' like a bitch and get yo hands up
Well where you from, nigga (Where you from), where you from, nigga (Where you from)
God dammit motherfucker where you from (Where you from)
Well where you from, nigga (Where you from), where you from, nigga (Where you from)
God dammit motherfucker where you from (Where you from)
Well represent yo shit, represent yo shit
Say fuck that clique, say fuck that clique
Represent yo shit, represent yo shit
Say fuck that clique, say fuck that clique
Well you scared (You scared), you scared (You scared)
Stop actin' like a bitch you scared (You scared)
You scared (You scared), you scared (You scared)
Stop actin' like a bitch you scared (You scared)

[Chorus: Lil' Jon]
Bia Bia (Get 'em up, get 'em up), why you actin' like a - like a (Push 'em off, push 'em off)
Bia Bia (Get 'em up, get 'em up), why you fussin' like a - like a (Push 'em off, push 'em off)
Bia Bia (Get 'em up, get 'em up), why you lookin' like a - like a (Push 'em off, push 'em off)
Bia Bia (Get 'me up, get 'em up), why you frontin' like a - like a (Push 'em off, push 'em off)
Bia Bia (Get 'em up, get 'em up), why you actin' like a - like a (Push 'em off, push 'em off)
Bia Bia (Get 'em up, get 'em up), why you fussin' like a - like a (Push 'em off, push 'em off)
Bia Bia (Get 'em up, get 'em up), why you lookin' like a - like a (Push 'em off, push 'em off)
Bia Bia (Get 'me up, get 'em up), why you frontin' like a - like a (Push 'em off, push 'em off)

[Verse 2: Chyna Whyte]
Chyna Whyte don't suck no dicks or lick no nuts
Bitch I hit licks and flip bricks
Every two hours switch whips to keep the peoples off me
What you know about that No-Doz and coffee
No sleep, I'm lookin' 40 with three bricks in a 740
Bitch I ain't got time to party
I'm breakin' bread with Dominican niggas
Over a hot Bennigan's dinner
Thinkin' how I'ma cop the 6 at the beginnin' of winter
Chrome it out and then fit it with timber, that's wood grain
What you ain't know, this a hood thang
All my thugs let ya wood swang, bitches make ya ass clap
I'm takin' all y'all ASCAP and BMI
Catch me drivin' DUI
Look cause I don't give a fuck, nigga I'm livin' to die
Who on this track fuckin' with me, y'all is willin' to try
Chyna Whyte the thug bitch with no feelings inside, motherfucker

[Chorus: Lil' Jon]
Bia Bia (Get 'em up, get 'em up), why you actin' like a - like a (Push 'em off, push 'em off)
Bia Bia (Get 'em up, get 'em up), why you fussin' like a - like a (Push 'em off, push 'em off)
Bia Bia (Get 'em up, get 'em up), why you lookin' like a - like a (Push 'em off, push 'em off)
Bia Bia (Get 'me up, get 'em up), why you frontin' like a - like a (Push 'em off, push 'em off)
Bia Bia (Get 'em up, get 'em up), why you actin' like a - like a (Push 'em off, push 'em off)
Bia Bia (Get 'em up, get 'em up), why you fussin' like a - like a (Push 'em off, push 'em off)
Bia Bia (Get 'em up, get 'em up), why you lookin' like a - like a (Push 'em off, push 'em off)
Bia Bia (Get 'me up, get 'em up), why you frontin' like a - like a (Push 'em off, push 'em off)

[Verse 3: Ludacris]
Well pour out the Henn and Coke and fire up that dro'
It's Ludacris off Old National and Godby Road
The block is sold, ""CLEAR!"" then I shocked the globe
I clock the hoes, lock do's and drop the 'bows
I rock the shows; pop lock and knock yo nose
You Bia' Bia', I grab my .44 and mop the flo'
I Mop & Glo', the Feds tryin' to stop my dough
They claim they caught me at the docks with a flock of snow
I bring the pain, cock back and swing the thang
Yo' girl mad cause she told me don't even bring the thang
And then I told her, I said, ""it's cool, get at me""
And then my voice got raaaassspy
Cause I was smokin' on some Cali and my eyes were dazed
I was in the zone, coulda thrown up them tre's
And if you lost, Lil' Jon's got some Eastside ways
So stop actin' like a Bia if yo ass ain't blaze

[Chorus: Lil' Jon]
Bia Bia (Get 'em up, get 'em up), why you actin' like a - like a (Push 'em off, push 'em off)
Bia Bia (Get 'em up, get 'em up), why you fussin' like a - like a (Push 'em off, push 'em off)
Bia Bia (Get 'em up, get 'em up), why you lookin' like a - like a (Push 'em off, push 'em off)
Bia Bia (Get 'me up, get 'em up), why you frontin' like a - like a (Push 'em off, push 'em off)
Bia Bia (Get 'em up, get 'em up), why you actin' like a - like a (Push 'em off, push 'em off)
Bia Bia (Get 'em up, get 'em up), why you fussin' like a - like a (Push 'em off, push 'em off)
Bia Bia (Get 'em up, get 'em up), why you lookin' like a - like a (Push 'em off, push 'em off)
Bia Bia (Get 'me up, get 'em up), why you frontin' like a - like a (Push 'em off, push 'em off)

[Verse 4: Too $hort]
Bitch niggas in the house tell me what's up
A nigga slapped you in the mouth and told you shut up
Somebody holler get 'em and now you just a victim
Shorty tried to stick 'em, told the pit bull to sic 'em
I know he wanna run but he can't he assed out
Punched him in his chin and then he passed out
Woke up with his pockets turned inside-out
Always hit them weak motherfuckers right in they mouth
You better stay out the way and act like you ain't havin' shit
Cause niggas will run up in yo ass like you a nasty bitch
You little bitch, that's what the callin' you
You'd be a damn fool to act like you ballin' dude
Mindin' yo business, they grabbed you by yo collar
You feel like Marvin Gaye cause they make you wanna holler
But since you can't run, you might as well fight
Quit actin' like a bitch and live a real life
You just a ""Bia' Bia'!""",Lil Jon & The East Side Boyz,2001,"[100, 94, 94]",3
184,Get Ur Freak On,"[Intro]
Kore kara minna de mechakucha odotte
Sawago sawago!
Headbanger, hit me, hit me, hit me, hit me...
Yeah, gimme some new shit
Gimme some new shit
Gimme some new shit
Gimme some new shit

[Verse 1]
Missy be puttin' it down, I'm the hottest 'round
I told y'all motherfuckers, y'all can't stop me now
Listen to me now, I'm lastin' twenty rounds
And if you want me (nigga) then come on, get me now
Is you with me now? Then biggie, biggie bounce
I know you dig the way I sw-sw-switch my style
Holla
People sing around
Now people gather 'round, now people jump around

[Hook]
Go, get your freak on, go, get your freak on
Go, get your freak on, go, get your freak on
Go, get your freak on, go, get your freak on
Go, get your freak on
Go, getcha getcha getcha getcha getcha freak on
Go, get your freak on, go, get your freak on
Go, get your freak on, go, get your freak on
Go, get your freak on, go, get your freak on
Go, get your freak on
Go, getcha getcha getcha getcha getcha freak on

[Verse 2]
Who’s that bitch? People you know
Me and Timbaland been hot since twenty years ago
What tha dilly yo? Now what tha drilly yo?
If you wanna battle me then (nigga) let me know
Holla
Got to feel it, son
Lemme throw you some (maut mujhko)
People, here I come, now sweat me when I'm done
We got the radio shook like we got a gun

[Hook]
Go, get your freak on, go, get your freak on
Go, get your freak on, go, get your freak on
Go, get your freak on, go, get your freak on
Go, get your freak on
Go, getcha getcha getcha getcha getcha freak on
Go, get your freak on, go, get your freak on
Go, get your freak on, go, get your freak on
Go, get your freak on, go, get your freak on
Go, get your freak on
Go, getcha getcha getcha getcha getcha freak on

[Verse 3]
Quiet! (Shhh) Hush your mouth, silence when I spit it out
(Hah-choo!) In your face, open your mouth, give you a taste
Holla
Ain't no stoppin' me, copy written so don't copy me
Y'all do it sloppily and y'all can't come close to me
I know you feel me now, I know you hear me loud
I scream it loud and proud, Missy gon' blow it down
People gon' play me now, in and outta town
'Cause I'm the best around with this crazy style

[Hook]
Go, get your freak on, go, get your freak on
Go, get your freak on, go, get your freak on
Go, get your freak on, go, get your freak on
Go, get your freak on
Go, getcha getcha getcha getcha getcha freak on
Go, get your freak on, go, get your freak on
Go, get your freak on, go, get your freak on
Go, get your freak on, go, get your freak on
Go, get your freak on
Go, getcha getcha getcha getcha getcha freak on

[Outro]
Ichi, ni, san, ji",Missy Elliott,2001,"[47, 35, 24, 20, 20, 15, 11, 11, 8, 7, 9, 8, 8, 9, 10, 14, 14, 21, 29, 31, 44, 59, 59, 65]",24
185,I Could Not Ask For More,"[Verse 1]
Lying here with you
Listening to the rain
Smiling just to see
The smile upon your face

[Chorus 1]
These are the moments I thank God that I'm alive
These are the moments I'll remember all my life
I've found all I've waited for
And I could not ask for more

[Verse 2]
Looking in your eyes
Seeing all I need
Everything you are
Is everything in me

[Chorus 2]
These are the moments I know heaven must exist
These are the moments I know all I need is this
I've found all I've waited for, yeah
And I could not ask for more

[Bridge]
I could not ask for more than this time together
I could not ask for more than this time with you
And every prayer has been answered
Every dream I've had's come true
Yeah, right here in this moment
Is right where I'm meant to be
Here with you, here with me

[Chorus 1]
These are the moments I thank God that I'm alive
These are the moments I'll remember all my life
I've found all I've waited for
And I could not ask for more

[Bridge]
I could not ask for more than this time together
I could not ask for more than this time with you
And every prayer has been answered
Every dream I've had's come true
Yeah, right here in this moment
Is right where I'm meant to be
Here with you, here with me

[Outro]
No, I could not ask for more than this love you gave me
Cause it's all I've waited for
And I could not ask for more
No, yeah
No, I could not ask for more",Sara Evans,2001,"[82, 83, 71, 75, 73, 66, 50, 42, 35, 35, 46, 47, 47, 49, 52, 61, 62, 65, 73, 83]",20
186,Why They Call It Falling,"[Verse 1:]
It's like jumping it's like leaping
It's like walking on the ceiling
It's like floating
It's like flying through the air

It's like soaring
It's like gliding
It's a rocket ship you're riding
It's a feeling that can take you anywhere

[Chorus:]
So why they call it falling?
Why they call it falling?
Why they call it falling?
I don't know

[Verse 2:]
There was passion
There was laughter
The first morning after
I just couldn't get my feet to touch the ground

Every time we were together
We'd talked about forever
I was certain
It was heaven we had found

[Repeat Chorus:]

[Bridge:]
But you can't live your life
Walking in the clouds
Sooner or later
You have to come down

[Verse 3:]
It's like a knife
Through the heart
When it all comes apart
It's like someone takes a pin to your balloon

It's a hole
It's a cave
It's kind of like a grave
When he tells you that he's found somebody new

[Chorus:]
And why they call it falling
Why they call it falling
Why they call it falling
Now I know

Why they call it falling
Why they call it falling
Now I know",Lee Ann Womack,2001,"[91, 87, 78, 80, 82, 81, 81]",7
187,Don't Mess With The Radio,"[Chorus:]
One
Don't mess with the radio
Two
Don't tell me which way to go
Three
Just leave it up to me cause
Four
You riding with a pro

Five
You gotta leave it all behind
Six
We bout to get up in the mix now
Seven
Everyday is a blessing
Eight
Don't make no mistake about one

[Verse 1:]
I'm just riding out trying to figure out
What's up
This feeling can't be controlled
Trying not to look so fly

And it's 3:25
But I'm ready to roll
'Cause I've been waiting all week just to find
A party just to get out and jam
My destination's unclear
'Cause I know the party's wherever I am

[Repeat Chorus:]

[Verse 2:]
Now that the hour is 9:00
Time to check for this dime
Breaking hearts at the door

No time for standing in line
The beat is playin in my spine
And I can't take it no more

Throw your hands up
Let's cut this rug up
And party like it ain't no thang
We can do it all night 'til the daylight
No, it ain't no shame in my game, yeah

[Repeat Chorus x3:]",Nivea,2001,"[96, 90, 90]",3
188,Angel,"[Intro: The Weeknd and Children's Choir]
Ooohh

[Verse 1: The Weeknd]
Angel, oh oh oh oh
Knew you were special from the moment I saw you
I saw you, yeah
I said angel, oh oh oh oh
I feel you're closer every time I call you
I call you

[Pre-Chorus: The Weeknd]
Cause all I see are wings, I can see your wings
But I know what I am and the life I live, yeah, the life I live
And even though I sin, maybe we are born to live
But I know time will tell if we're meant for this
Yeah, if we're meant for this

[Chorus: The Weeknd]
And if we're not
I hope you find somebody
I hope you find somebody
I hope you find somebody
I hope you find somebody to love
Somebody to love
Somebody to love
Yeah, yeah, yeah

[Verse 2: The Weeknd]
Said angel, woah oh oh oh
You'll probably never take me back and I know this
Yeah I know this, aw man
I said angel, woah oh oh oh
I'm so desensitized to feeling these emotions
Yeah, no emotions baby

[Pre-Chorus: The Weeknd]
Cause all I see are wings, I can see your wings
But I know what I am and the life I live, yeah, the life I live
And even though I sin, we all want to live
But I know time will tell if we're meant for this
Yeah if we're meant for this

[Chorus: The Weeknd]
And if we're not
I hope you find somebody
I hope you find somebody
I hope you find somebody
I hope you find somebody to love
Somebody to love
Somebody to love
Yeah, yeah, yeah

[Bridge: The Weeknd]
And even though we live inside
A dangerously empty life
You always seem to bring the light
You always seem to bring the light
And even though we live inside
A dangerously empty life
You always seem to bring me light
You always seem to bring me light

[Chorus: The Weeknd and Maty Noyes]
I hope you find somebody
I hope you find somebody
I hope you find somebody
I hope you find somebody to love
Somebody to love
Somebody to love
Yeah, yeah, yeah, oh
I hope you find somebody
I hope you find somebody
I hope you find somebody
I hope you find somebody to love
Somebody to love
Somebody to love
Yeah, yeah, yeah, oh
I hope you find somebody
I hope you find somebody
I hope you find somebody
I hope you find somebody to love
Somebody to love
Somebody to love
Yeah, yeah, yeah, oh

[Outro: The Weeknd and Maty Noyes]
Ooh somebody baby
I hope you find somebody
I hope you find somebody
I hope you find somebody baby
Somebody to love
Somebody to love
Yeah, yeah, yeah",The Weeknd,2001,"[97, 98, 92, 94, 100, 94, 86, 86, 49, 89, 46, 88, 38, 86, 24, 93, 24, 87, 19, 85, 11, 87, 8, 78, 7, 70, 7, 70, 5, 3, 3, 3, 1, 2, 3, 3, 5, 7, 9, 12, 19, 24, 39, 56, 57]",45
189,"Baby, Come Over (This Is Our Night)","[Intro]
Baby, come on over tonight
We can make it all right
Take a piece of my heart
And go from the start

[Chorus]
You say that you want me
Again and again
You say that you need me
To be more than just your friend
So I thought about it
And maybe you're right
I've been checking your records
And they seem all right

[Chorus]
Baby, come on over tonight
We can make it all right
Take a piece of my heart (My heart)
And go from the start
Baby, come on over tonight (Yeah, yeah)
We can make it all right (Yeah, yeah)
Boy, there's no one like you (Ooh)
Do you feel it too? (Do you feel it too?)

[Post-Chorus]
Baby, come over, come on
Baby, come over, ah
This is our night tonight

[Verse 2]
So when we get together
If just for a while
Let's make it happen
Don't waste any time
And now I need to find out
What you're about
So come over tonight
Let's sort this out

[Chorus]
Baby, come on over tonight (Yeah, yeah)
We can make it all right (make it all right)
Take a piece of my heart (My heart)
And go from the start
Baby, come on over tonight
We can make it all right (make it all right)
Boy, there's no one like you (Yeah)
Do you feel it too?
Baby, come on over tonight (baby, I'm waiting, there's no hesitating now)
We can make it all right
Take a piece of my heart
And go from the start
Baby, come on over tonight (La da da da da)
We can make it all right (La da da da da)
Boy, there's no one like you
Do you feel it too?

[Bridge]
Baby, come over
Baby, come over
Come on over tonight
Yeah, yeah

[Breakdown]
This is our night tonight
Everything's gonna be alright
This is our night tonight
Everything's gonna be alright
This is our night tonight (Baby, come on over tonight)
Everything's gonna be alright
This is our night tonight
Everything's gonna be alright

[Chorus]
Baby, come on over tonight (Yeah, yeah, yeah)
We can make it all right
Take a piece of my heart (Of my heart)
And go from the start
Baby, come on over tonight
We can make it all right (Baby)
Do you feel it too? (Do you feel it too?)
Baby, come on over (this is our night tonight, ooh)
Everything's gonna be alright
This is our night tonight
Everything's gonna be alright (Baby, come on over)
This is our night (tonight, we can make it all right)
(Gonna be, gonna be)
Boy, there's no one like you (Oh yeah yeah yeah)
Do you feel it too?

[Outro]
Baby, come over
This is our night tonight
Baby, come over",Samantha Mumba,2001,"[99, 100, 95, 92, 94, 83, 84, 74, 72, 72, 64, 54, 49, 50, 64, 68, 68]",17
