,title,lyrics,artists,date,rank,cnt
227,Now Or Never,"[Team]
Sixteen, sixteen, sixteen minutes left, better get it done
Sixteen, sixteen, sixteen more minutes, get ready, game on!
Sixteen, sixteen, sixteen minutes left, running out of time
Sixteen, sixteen, sixteen more minutes till it's on the line
Sixteen, sixteen, sixteen minutes left, gotta get it done
Sixteen, sixteen, sixteen more minutes till we're number one!

[Coach:] Let's go team

[Verse 1]
[Troy:] Got to get it together
Yeah, pull up and shoot
[Team:] SCORE!
[Troy:] Are you ready, are you with me?
[Team:] Team, team, team, team, team, yeah
[Troy:] Shake them with the crossover (Wildcats!)
Tell me what are we here for (To win!)
'Cause we know that we're the best team
[Coach:] Come on boys, come on boys, come on!

[Pre-Chorus]
[Troy:] The way we play tonight
Is what we leave behind (that's right)
It all comes down to right now, it's up to us (let's go)
[Troy & Team:] So what are we going to be (we're gonna be...)
T-E-A-M team!
[Troy:] Got to work it out, turn it on
[Team:] Come on!

[Chorus: Troy and Team]
This is the last time to get it right
This is the last chance to make it our night
We got to show what we're all about (Wildcats!)
Work together (Go)
This is the last chance to make our mark (Shoot!)
History will know who we are
This is the last game so make it count
It's now or never

[Verse 2]
[Wildcats Cheerleaders:] W-I-L-D
[Coach Bolton:] 'Atta boy
[Wildcats Cheerleaders:] Wildcats
You know you're on
W-I-L-D
Wildcats, come on come on
[West High Knight Cheerleaders:] West High Knights (yeah!)
Yeah, we're doing it right (oh yeah)
[Wildcat Cheerleaders:] W-I-L-D Wildcats
[Crowd:] Now's the time

[Troy:] Got to get it inside, down low
In the paint, now shoot
[Team:] SCORE!
[West High Knights:] Defense
[Troy:] We got to work it together
[Team:] Gimme the ball
Gimme the ball
Gimme the ball
[Troy:] Fast break, keep the ball in control
Let it fly from downtown...
[Team:] 3 more
[Chad:] Show 'em we can do it better
[West High Knight Cheerleaders:] No way
[Team & Coach:] Go, go, go
[Coach:] Come on boys

[Crowd:] Wildcats!

[Pre-Chorus]
[Troy & Chad:] The way we play tonight
Is what we leave behind (That's right)
It all comes down to right now, it's up to us (Let's go)
So what are we going to be?
(We're gonna be)
[Team:] T-E-A-M team!
[Troy:] Got to work it out, turn it on
[Team:] Come on!

[Chorus]
[Troy:] This is the last time to get it right
This is the last chance to make it our night
We got to show what we're all about
[Team:] Wildcats!
[Troy:] Work together (Go!)
This is the last chance to make our mark
[Team:] Hoop!
[Troy:] History will know who we are
This is the last game so make it count
It's now or never

[Coach:] Come on Troy, come on Troy!

[Verse 3]
[Gabriela:] Troy!
[Troy:] Right now I can hardly breathe
[Gabriela:] Oh, you can do it, just know that I believe
[Troy:] And that's all I really need
[Gabriela:] Then come on
[Troy:] Make me strong
[Troy & Team:] It's time to turn it up, game on!

[Wildcat Cheerleaders]
Wildcats, gonna tear up
Go Wildcats, yeah, we're number one
Hey Wildcats, we're the champions
Go go go go go go team oh

[West High Knights Cheerleaders]
West High Knights, hey
Yeah we're putting up a fight

[Wildcat Cheerleaders]
Wildcats
We never quit it (what)
Gonna win it (what)
Let me hear you say
Hey hey hey hey hey
Wildcats

[West High Knight Cheerleaders:] Go West High, yeah
[Wildcat Cheerleaders:] Hey! Gonna win!
[Troy & Team:] Got to show them how we do it
[Team & wildcat Cheerleaders:] Game on!

[Outro: Troy & Team]
This is the last time to get it right (oh)
This is the last chance to make it our night (yeah)
We got to show what we're all about (Team Wildcats!)
Work together
This is the last chance to make our mark
History will know who we are!
This is the last game so make it count
It's now or never

This is the last time to get it right
This is the last chance to make it our night (yeah)
We got to show what we're all about (Team Wildcats!)
Work together
This is the last chance to make our mark
History will know who we are!
This is the last game so make it count
It's now or never, yeah!",High School Musical Cast,1982,"[95, 64, 64, 70, 80, 90]",6
228,Love's Been A Little Bit Hard On Me,"I've got nothing to be ashamed of
(Love's been a little bit hard on me)
If I shy away it's only because
(Love's been a little bit hard on me)

(Love's been a little)
Oh love's been a little
(Love's been a little bit hard on me)
(Love's been a little)
Ya know it's just been a little
(Love's been a little bit hard on me)

I can't remember when it meant so much
(Love's been a little bit hard on me)
Now I shy away from the slightest touch
(Love's been a little bit hard on me)

(Love's been a little)
Oh love's been a little
(Love's been a little bit hard on me)
(Love's been a little)
Just a little, little
(Love's been a little bit hard on me)

Well, come out, come out
From that hopeless romance in side
Child, it's all right, it's all right
Shade so dark, so close to the light

Well come out, well come out
From that hopeless romance in side
Child, it's all right, it's all right
Shade so dark, so close to the light

I'll be back when I calm my fears
(Love's been a little bit hard on me)
Then I'll see you 'round in a thousand years
(Love's been a little bit hard on me)

(Love's been a little)
Oh love's been a little
(Love's been a little bit hard on me)
Oh, love ya know it's just been a little
(Love's been a little bit hard)
It's hard on me",Juice Newton,1982,"[97, 73, 29, 18, 14, 12, 7, 7, 8, 9, 12, 15, 18, 26, 32, 56, 70]",17
229,Do I Do,"[Verse 1]
Don't be that way
Fall apart twice a day
I just wish you could feel what you say
Show, never tell
But I know you too well
Got a mood that you wish you could sell

[Chorus]
If teardrops could be bottled
There'd be swimming pools filled by models
Told ""a tight dress is what makes you a whore""
If ""I love you"" was a promise
Would you break it, if you're honest?
Tell the mirror what you know she's heard before
I don't wanna be you...
Anymore

[Verse 2]
Hands getting cold
Losing feeling is getting old
Was I made from a broken mold?
Hurt, I can't shake
We've made every mistake
Only you know the way that I break

[Chorus]
If teardrops could be bottled
There'd be swimming pools filled by models
Told ""a tight dress is what makes you a whore""
If ""I love you"" was a promise
Would you break it, if you're honest?
Tell the mirror what you know she's heard before
I-I don't wanna be you
I don't wanna be you
I don't wanna be you...
Anymore",Billie Eilish,1982,"[98, 76, 30, 20, 16, 13, 13, 13, 16, 23, 27, 41, 45, 52]",14
230,Seasons Of The Heart,"Of course we have our differences
You shouldn't be surprised
It's as natural as changes
In the seasons and the skies
Sometimes we grow together
Sometimes we drift apart
A wiser man than I might know
The seasons of the heart

And I'm walking here beside you
In the early evening chill
A thing we've always loved to do
I know we always will
We have so much in common
So many things we share
That I can't believe my heart
When it implies that you're not there

Love is why I came here in the first place
Love is now the reason I must go
Love is all I ever hoped to find here
Love is still the only dream I know

So I don't know how to tell you
It's difficult to say
I never in my wildest dreams
Imagined it this way
But sometimes I just don't know you
There's a stranger in our home
When I'm lying right beside you
Is when I'm most alone

And I think my heart is broken
There's an emptiness inside
So many things I've longed for
Have so often been denied
Still I wouldn't try to change you
There's no one that's to blame
It's just some things that mean so much
And we just don't feel the same

Love is why I came here in the first place
Love is now the reason I must go
Love is all I ever hoped to find here
Love is still the only dream I know
True love is still the only dream I know",John Denver,1982,"[99, 78, 82, 84, 88]",5
231,I Found Somebody,"I never thought it could happen
It was the furthest thing from my mind
I just turned my back on a sad love affair
Was try'n' to leave it all behind
That's when I met you
I just couldn't say no
One look in your eyes
And I said here I go
I found somebody
I found somebody to love
I found somebody
I found somebody to love

I'd seen so much deceivin'
I almost stopped believin'
I'd ever fall in love again
I was runnin' around hidin' my heart
Fakin' it with all of my friends
I was down on my luck
That's when you came along
You put me back on my feet
You got me singin' this song

I found somebody
I found somebody to love
I found somebody
I found somebody to love
And she loves me in the midnight hour

You know ever since I found you
And put my arms around you
I don't need a doggone thing
You know that ev'ry day is such a beautiful day
I want the whole world to dance and sing
So don't you dare hang your head
Don't you dare be blue
If it can happen to me
It can happen to you

And you'll be singin' this song
I found somebody
I found somebody to love
I found somebody
I found somebody to love",Glenn Frey,1982,"[100, 91, 31, 31, 33, 35, 38, 44, 47, 53, 57, 70, 77]",13
232,What Kind Of Fool Am I,"[Verse 1]
What kind of fool am I, who never fell in love?
It seems that I'm the only one that I have been thinking of
What kind of life is this, an empty shell?
A lonely cell in which an empty heart must dwell
What kind of lips are these, that lied with every kiss?
That whispered empty words of love that left me alone like this

[Chorus]
Why can't I fall in love like other people can?
And maybe then I'll know what kind of fool I am

[Verse 1 (Refrain)]
What kind of fool am I, who never fell in love?

[Chorus]
Why can't I fall in love like other people can?
And maybe then I'll know what kind of fool I am",Lesley Gore,1982,"[92, 36, 21, 21, 21, 21, 21, 21, 24, 31, 51, 57]",12
233,Enough Is Enough,"[Verse 1]
Oh, how I miss the days
We'd get carried away
But you had a lot to say
Enough is enough, enough is enough
(Enough is enough)

We're fighting all the time
You say I'm out of line
But this life is only mine
Enough is enough, enough is enough
(Enough is enough)

[Pre-Chorus]
Understanding that I have to go this way
Is probably harder than asking me to stay
If there's a moment that you can't stand (enough is enough)
Get over ground where you can land

[Chorus]
Enough is enough
Enough is enough
(You can land)
Enough is enough

[Verse 2]
I've held on to all these ties
Unspun all your lies
And heard a thousand cries
Enough is enough, enough is enough
(Enough is enough)

On the edge of asking why
You don't even want to try
The feelings all combine
Enough is enough, enough is enough
(Enough is enough)

[Bridge]
You and I will see this through to the end
(We push, we fight)
Take your time, we'll wander together
(What's wrong, what's right)

You and I will see this through to the end
(We push, we fight)
Enough is enough
Take your time, we'll wander together
(What's wrong, what's right)
Enough is enough

[Outro]
Understanding the world won't turn your way (enough is enough)
Makes it harder for things to look okay
If there's a moment that you can't stand (enough is enough)
Get over ground where you can land
Enough is enough",Puppet & Cormak,1982,"[93, 50, 50, 56, 64, 72, 80, 90]",8
234,Caught Up In You,"[Verse 1]
I never knew there'd come a day
When I'd be sayin' to you
""Don't let this good love slip away
Now that we know that it's true.""

[Pre-Chorus 1]
Don't, don't you know the kind of man I am?
No, said I'd never fall in love again
But it's real, and the feeling comes shining through

[Chorus 1]
I'm so caught up in you, little girl
And I never did suspect a thing
So caught up in you, little girl
That I never wanna get myself free
And baby, it's true, you're the one
Who caught me, baby, you taught me
How good it could be

[Verse 2]
It took so long to change my mind
I thought that love was a game
I played around enough to find
No two are ever the same

[Pre-Chorus 2]
You made me realize the love I missed
So hot, love I couldn't quite resist
When it's right, the light just comes shining through

[Chorus 1]
I'm so caught up in you, little girl
You're the one that's got me down on my knees
So caught up in you, little girl
That I never wanna get myself free
And baby, it's true, you're the one
Who caught me, baby, you taught me
How good it could be

[Bridge]
Fill your days and your nights
No need to ever ask me twice, oh no
Whenever you want me
And if ever comes a day
When you should turn and walk away, oh no
I can't live without you
I'm so caught up in you
Yeah, yeah, yeah

[Pre-Chorus 3]
And if ever comes a day
When you should turn and walk away, oh no
I can't live without you

[Chorus 1]
I'm so caught up in you, little girl
You're the one that's got me down on my knees
So caught up in you, little girl
That I never wanna get myself free
And baby, it's true, you're the one
Who caught me, baby, you taught me
How good it could be

[Chorus 2]
Little girl
You're the one that's got me down on my knees
So caught up in you, little girl
That I never wanna get myself free
And baby, it's true, you're the one
Who caught me and taught me
You got me so caught up in you",38 Special,1982,"[94, 52, 35, 17, 15, 10, 10, 10, 12, 16, 20, 24, 31, 35, 41, 66, 82]",17
235,Still They Ride,"[Verse 1]
Jesse rides through the night
Under the Main Street light
Riding slow
This old town, ain't the same
Now nobody knows his name
Times have changed, still he rides

[Bridge]
Traffic lights, keeping time
Leading the wild and restless
Through the night

[Chorus]
Still they ride, on wheels of fire
They rule the night
Still they ride, the strong will survive
Chasing thunder

[Verse 2]
Spinning around, in a spell
It's hard to leave this carousel
Around and around
And around and around

[Chorus]",Journey,1982,"[95, 57, 39, 19, 19, 19, 20, 24, 27, 30, 34, 49, 58, 72]",14
236,Early In The Morning,"Oh, I never knew I loved you till you left me
Oh, I never knew I cared till you were gone
I was young and foolish, I didn't know what I was doin'
I didn't know I lost you till you're gone
Oh, I never knew I loved you till you were gone

So I gotta get up early in the morning
To find me another lover
So I gotta get up early in the morning
To find me another lover

So I gotta get up early in the morning
To find me another lover
Gotta get up early in the morning
To find me another lover

Now I gotta get up early every morning
'Cause the early bird always catches the worm
Now I gotta get up every morning
Gotta make up for the lesson I've learned
Gotta find me a lover that won't run for cover
Gotta find me a lover that won't run the mother

'Cause I gotta get up early in the morning
To find me another lover
So I gotta get up early in the morning
To find me another lover

So I gotta get up early in the morning
To find me another lover
So I gotta get up early in the morning
To find me another lover

I was young and foolish, I didn't know what I was doin'
I didn't know I lost you till you're gone
She had a pretty face that drove me wild
I even wanted her to have my child

Early in the morning
To find me another lover
So I gotta get up early in the morning
To find me another lover

So I gotta get up early in the morning
To find me another lover
So I gotta get up early in the morning
To find me another lover

(Team say it)
Gotta find me another lover
Gotta find me another lover
Gotta find me another lover
Gotta find me another lover

(Ladies just sing it one time, sing ladies)
Gotta find me another lover
Gotta find me another lover
Gotta find me another lover
Gotta find me another lover

Early in the mornin'
In the middle of the day, baby
Late at night, mama
Everything gonna be all right

Early in the mornin'
In the middle of the day, baby
Late at night, baby
Everything will be all right

Early in the mornin'
In the middle of the day, baby
Late at night, baby
Everything will be all right

Early in the mornin', baby
In the middle of the day, baby
Late at night, mama
Everything will gonna be all right, yeah

Early in the mornin', baby
In the middle of the day, baby
Late at night, mama
Everything will gonna be all right",The Gap Band,1982,"[96, 58, 40, 24, 24, 26, 28, 31, 43, 48, 57, 65, 76, 83]",14
237,Why,"[Refrain]
Why am I so in love?
Why am I so in love?
Why am I so in love?
I don't know why

[Verse]
Steady tryin' to maintain
Same things that'll blow a bitch mind frame
My brain can't fathom what the hate say
He say, she say, how 'bout me say?
Get the Vis-a, headed to the islands A-S-A-P
What's that on my shawty wrist? That's a AP
I'm the type to save a bitch, C-A-P-E
Feelin' like ET, flyin' out of the Addy
Fuckin' on shawty, she baddie, casual convo then at it
I mean I'm better than better, maybe I'm lyin'
I'm sadder than most of y'all with the money and the freedom, nigga
What is money really worth if it ain't love?
I'ma find a perfect balance, it's gon' take time
I heard shawty still in love through the grapevine
Heard shawty still in love through the grapevine
Heard shawty in love through the grapevine

[Chorus]
Mix a little bit of weed with a little bit of cash
With a little bit of this, with a little bit of that
We gon' be al-, we gon' be al- (right)
We gon' be al- (right) we gon' be al-
Mix a little bit of weed with a little bit of cash
With a little bit of this, with a little bit of that
We gon' be al-, we gon' be alright
We gon' be al- (right) we gon' be al-
Mix a little bit of weed with a little bit of cash
With a little bit of this, with a little bit of that
We gon' be al-, we gon' be al (right)
We gon' be alright, we gon' be al-
Mix a little bit of weed with a little bit of cash
With a little bit of this, with a little bit of that
We gon' be al- (right) we gon' be al-
We gon' be al- (right) we gon' be al-

[Refrain]
Why am I so in love?
I don't know why
Why am I so in love?
I don't know why

[Bridge]
She said I, oh, I, am fallin' for you, fallin' for you
I, oh, I, am fallin' for you, fallin' for you
I, oh, I, am fallin' for you, fallin' for you
I, oh, I, am fallin' for you, fallin' for you

[Refrain]
Why am I so in love?
Why am I so in love?
Why am I so in love?
I don't know why
Why am I so in love?
Why am I so in love?
Why am I so in love?
I don't know why",XXXTENTACION,1982,"[97, 74, 74, 78, 86, 89]",6
238,Foolin' Yourself,"Back when you were young
It was easy having fun
But you got to work
To keep your love alive

Here’s some free advice:
Sometimes you gotta play nice
Hold your baby tight
All through the night

Or he’ll leave you broke. Broken hearted
Your love, he departed
Yes if you think your love’s not on a shelf -
Girl, you’re only foolin' yourself

Well you can cheat, drink and lie
Stay gone all night
And at the end of the day
Tell yourself it’s alright

But you’ll be broke. Broken hearted
’cause your love will have departed
And if you think you won’t hurt anybody else
You’re only foolin' yourself",Nick Edelstein,1982,"[98, 65, 65, 72, 78, 88]",6
239,Going To A Go-Go,"[Verse 1]
Going to a go go[X2]
Na na na na, yeah

[Verse 1]
Well, there's a brand new place I've found
Where people go from miles around
They come from everywhere
And if you drop in there
You might see anyone in town

[Chorus[Chorus]
Going to a go go, everybody's
Going to a go go, well, come on now
Don't you want to go, yeah

[Bridge]
One more time, yeah I'm
Going to a go go, ooh ooh ooh ooh
Going to a go go, baby come on now

[Verse 2]
It doesn't matter where you are
A go go can be far
You'll see the people from your block
And don't be shocked
If you see your favorite star

[Chorus]

[Bridge]
Na na na na yeah, ooh tell me
Don't you want to go, yeah
Now it's alright, I-yi
Going to a go go, yes I am now
Going to a go go, oh come on now

[Verse 3]
It doesn't matter if you don't stagger
It doesn't matter if you don't drag
You should have some fun
I'm telling everyone
Most every taxi that you flag is

[Chorus]
Going to a go go, oh come on baby
Going to a go go, baby come on now
Don't you want to go, yeah
One more time, yeah

[Outro]
I'm going to a go go
Going to a go go, baby come on now
Going to a go go, oh come on baby
Going to a go go, oh come on now
Going to a go go",Phil Collins,1982,"[99, 86, 41, 25, 25, 25, 27, 30, 42, 56, 66]",11
240,Hooked On Swing,"[Verse 1]
I wake in the morning to a photo of your face
Sitting on the table watching me
Dial you on the phone to hear your voice answer
And sweet baby, I wish you were here with me, hey

Just thinking 'bout your lovin' makes me feel so good
So irresistible, it's got me hooked on you

[Chorus]
Hooked on you, you got me hooked
Hooked on you
Oh baby, I'm hooked on you
You got me hooked on you

You're under my power I like it
It is the power of love...hey hey hey

[Verse 2]
Visions of submission paint a smile I can't erase
Pull me closer to you tenderly
Prisoner to your love, you stole my heart, I'm captured now
Like the pain or jail of ecstasy, oh baby

Intoxicating pleasures from the things you do
A special kind of feeling like I never knew (it's so good, it's so good)
Just thinking 'bout your lovin' makes me feel so good
So irresistible, it's got me hooked on you

[Chorus]
Hooked on you, you got me hooked on you
Yeah baby, hooked on you
You've got me hooked on you
Hooked on you, oh oh, I
Oh oh, I...oh oh, I...

[Bridge]
There's nothing that I wouldn't do
(Baby, you got me hooked)
'Cause baby, I'm so into you
(Baby, you got me hooked)
You're all I need and even more
(Baby, you got me hooked)
I never felt this way before
(Baby, you got me hooked)

Oh, I'm hooked on a physical attraction
Start a chain reaction
You're my satisfaction
I'm hooked on you (You got me hooked)

Hooked on you
Hooked on you, yeah, hoo
You've got me hooked, ooh
You've got me hooked, oh yeah

Intoxicating pleasures from the things you do
A special kind of feeling like I never knew, it's so good
Just thinking 'bout your lovin' makes me feel so good
So irresistible, it's got me hooked on you

Hey, you've got me hooked on your lovin', got me hooked on your lovin'
Got me hooked
You've got me hooked
Hey, you've got me hooked on your lovin', got me hooked on your lovin'
Got me hooked
I'm so in love with you
Baby, it's me and you
Just tell me what to do
Baby, you've got me hooked
And when he starts with me
I won't give up and see
Baby, you've got me hooked, oh yeah

You've got me hooked on you
Baby, you've got me hooked on you
You've got me hooked on you
You've got me hooked on you
You've got me hooked

Better keep him on a leash",Karyn White,1982,"[100, 87, 53, 31, 31, 33, 34, 39, 46, 60, 73, 83]",12
241,Younger Days,"[Verse 1]
There's two ways this goes now
As our love comes crashing down
You could be the flame that burns out
Or you could turn and burn it down
And in my life I've found the sweetest killers hanging around
Waiting on your undeserving lips to smile on a life you know exists

[Chorus]
So if you worry, don't worry 'bout me
I always wanted you to see
The California coastline on your own time
And if you worry, don't worry 'bout me
I always wanted to be free
In the simple way
I found in all of those younger days

[Verse 2]
If I don't wake up trace me on the asphalt
Let the morning rain wash me away
There's two ways this goes now
As our love comes crashing down
You could be the flame that burns out
Or you could turn and burn it down
And look at what you have now
The silver dagger in your mouth
Waiting on the words to come down
That this ain't working out

[Chorus]
But if you worry, don't worry 'bout me
I always wanted you to see
The California coastline on your own time
And if you worry, don't worry 'bout me
I always wanted to be free
In the simple ways
I found in all those younger days

[Outro]
If you worry, don't worry about me
If you worry, don't worry about me
If you worry, don't worry about me
If you worry, don't worry about me
(Am I blue enough? Am I blue enough?)

If you worry, don't worry about me
If you worry, don't worry about me
If you worry, don't worry about me
If you worry, don't worry about me
(Am I blue enough? Am I blue enough?)",Mt. Joy,1982,"[80, 80, 90]",3
242,Nice Girls,"(broken up)
(oh oh oh oh oh oh)

(broke-broke-broken up)
(oh oh oh oh oh oh)

Broke-broke-broken up
Am I ever good enough?

I try to co-co-cover up
But secretly I'm not so tough

Watch them rip me up and tear me down, shake me up inside
But whatever doesn't kill me makes me stronger every time

(oh oh oh oh oh oh)

Be bold or be alone and the
Nice girls can go home
'Cause there's no room for those with no backbone

(hey!)

Be bold or be alone and the
Nice girls can go home
'Cause there's no room for those with no backbone

They try to fuck with me
Shoot me down relentlessly

All the cut-throat carnivores
(Ha!) They don't know what they're hunting for

Watch them rip me up and tear me down, shake me up inside
But whatever doesn't kill me makes me stronger every time

(oh oh oh oh oh oh)

Be bold or be alone and the
Nice girls can go home
'Cause there's no room for those with no backbone

(oh oh oh oh oh oh)

Be bold or be alone and the
Nice girls can go home
'Cause there's no room for those with no backbone

I can understand it but it's so hard to fake
When you're staying undercover
No one sees your mistakes

I just gotta be tough
I gotta be brave

No more backing away, or playing it safe
I know I'll figure it out, I'm finding my way
Gonna make it out on my own now gotta, I gotta be bold

Be bold or be alone and the
Nice girls can go home
'Cause there's no room for those with no backbone

Be bold or let it go and the
Nice girls can go home
'Cause there's no room for those with no backbone

'Cause I'm making this on my own",Repartee,1982,"[91, 55, 37, 37, 39, 42, 45, 50, 51, 55, 60, 79, 89]",13
