,title,lyrics,artists,date,rank,cnt
280,There Is No Arizona,"He promised her a new and better life out in Arizona
Underneath the blue never ending sky
Swore that he was gonna
Get things in order
He'd send for her
When he left her behind
It never crossed her mind

There is no Arizona
No Painted Desert, no Sedona
If there was a Grand Canyon
She could fill it up with the lies he's told her
But they don't exist, those dreams he sold her
She'll wake up and find
There is no Arizona

She got a postcard with no return address, postmarked Tombstone
It said ""I don't know where I'm goin' next but when I do
I'll let you know""
May, June, July, she wonders why
She's still waiting, she'll keep waiting cause

There is no Arizona
No Painted Desert, no Sedona
If there was a Grand Canyon
She could fill it up with the lies he's told her
But they don't exist, those dreams he sold her
She'll wake up and find
There is no Arizona

Each day the sun sets into the west
Her heart sinks lower in her chest and
Friends keep asking when she's going
Finally she tells them don't you know

There is no Arizona
No Painted Desert, no Sedona
If there was a Grand Canyon
She could fill it up with the lies he's told her
But they don't exist, those dreams he sold her
She'll wake up and find
There is no Arizona

He promised her a new and better life
Out in Arizona",Jamie O’Neal,2001,"[91, 88, 88, 89, 84, 78, 71, 58, 53, 51, 40, 40, 40, 46, 48, 56, 65, 77]",18
281,Pour Me,"[Chorus: Danny]
Pour me, pour me, pour me another
It holds me, holds me like no other
One more drink then I swear that I'm going home
Truth is, I don't really have a place to go
So pour me, pour me, pour me another

[Verse 1: Johnny 3 Tears]
I wake up right about the mid-afternoon
With the sun in the sky, but night's coming soon
And I walk to the mirror just to fix myself
Yeah, life gets harder when you love nothing else
So I pick up my pills from the counter drawer
Pick my self-esteem up off the fucking floor
I guess I'm a man of no recourse
As I crack another bottle, got no remorse
And I'll say a little prayer for the child in me
I swear I used to be one, I truly believed
That I'm not just a man with these broken dreams
That even I can go to heaven if I part the sea, so...

[Chorus: Danny]
Pour me, pour me, pour me another
It holds me, holds me like no other
One more drink then I swear that I'm going home
Truth is, I don't really have a place to go
So pour me, pour me, pour me another

[Verse 2: Johnny 3 Tears]
People get sick, and they'll watch you bleed
When you fall from the top, boy you better believe
At the bottom, they got just, yeah, just what you need
But at the bottom, you can't swim 'cause you drank up the sea
When we stop, and we look up to the sky
They don't ask any questions, they ask us why
Don't have any answers, don't know what to say
Our knees are getting tired, too tired to pray
That's when we lay down, end of the road
We all seem to walk it, guess I walked it alone
And I'm not just a man with these broken dreams
Even I can go to heaven if I part the sea, so…

[Chorus: Danny]
Pour me, pour me, pour me another
It holds me, holds me like no other
One more drink then I swear that I'm going home
Truth is, I don't really have a place to go
So pour me, pour me, pour me another

[Bridge: Danny & Johnny 3 Tears]
Time just seems to go on and on
On and on and on and on
Life inside a bottle, all along
All along, the bottle's gone
I'm not just a man with these broken dreams
Even I can go to heaven if I part the sea
What's life inside a bottle if it's gone?
One more song and I'm finally free
I'll meet you here in heaven between the sea
'Cause I'm not just a man with these broken dreams
Even I can go to heaven if I part the sea, so…

[Chorus: Danny]
Pour me, pour me, pour me another
It holds me, holds me like no other
One more drink then I swear that I'm going home
Truth is, I don't really have a place to go
So pour me, pour me, pour me another

[Outro: Danny]
Pour me, pour me
Pour me, pour me
Pour me, pour me
Pour me, pour me
Pour me another",Hollywood Undead,2001,"[94, 85, 78, 74, 71, 71, 73, 76, 80, 80, 85, 92, 95, 95]",14
282,Change The Game,"[Intro: Jay-Z]
Ugh, ugh, ugh, let's go!
Ugh, bounce
Ugh, bounce
Ugh, bounce
Ugh

[Refrain: Jay-Z, Beanie Sigel, & Memphis Bleek]
Shit, relax your mind, let your conscience be free
You're now rollin' with them thugs from the R-O-C
Sigel-Sigel in the house! Uh-huh, sick bastard (Yeah)
Get your wig pushed back by the wig push-back-er (Ugh, ugh)
Memph' Bleek in the house! Still here, never left (Ugh, ugh)
Still bust, more or less, still puff, BITCH! (Ugh, ugh)
Young Hova in the house—Jigga! (Yeah)
Cris' sipper, six-dipper, wrist-glitter, nigga!

[Verse 1: Jay-Z & Beanie Sigel]
Hold up, love
Every time you see Jiggaman, I'm rolling on dubs
Don't forget about them blades, shit, chopping it up
It's the motherfucking Roc, bitch, who hotter than us?
Jay-Hov, 'bout to change my name to Jay Peso
But in the meantime, call me William H. though
On the platinum Yamaha, got the engine gunning
Throwing it up like liquor on an empty stomach
{*cycle whizzes by*} Y'all don't hear nothing?
Who that, Mac? Naw, dawg, that's M. Bleek coming

[Verse 2: Memphis Bleek & Jay-Z]
Who the FUCK! want! what?!
Catch Bleek in South Beach out of the reach of the police
Gat on my lap (Yeah), bitch on my back (Holla)
'Gnac in my pocket, smoking that sticky chocolate (Ooohwee!)
Holler if you want drama with...
The Dynasty; Amil, Bleek, Jigga and...

[Verse 3: Beanie Sigel]
Sigel—Desert Eagle, dawg, who else but me?
Roc Airs, Roc-Wears, bandannas and white tees
Me without a gun dawg, unlikely
You know I keep the heat right under the wife-beat'
Three-X tee, I'm Lincoln now, you can't see the pound
Got a little gut, so the gat sit tucked (Fuck...)
I run wild, gun high, L.A. style
Bang the Roscoe 'til the sunrise; plus, I stay dumb high
Whether block shit or rock shit
Club shit or drug shit, I pop shit—I got shit
Get Sig' any track, I'ma spit the talk to it
Down South gon' bounce; Crips gon' walk to it
Get a ounce, get a woods, everybody spark to it
Every dawg, every Blood in the hood, bark to it
Get the ounce, get the 'Woods, everybody spark to it
We can smoke in here, put the choke in the air, yeah

[Chorus: (Static Major), Jay-Z, Beanie Sigel, & Memphis Bleek]
(Don't change the game for these hoes)
(Who plays the game like we supposed)
Sigel-Sigel in the house! Uh-huh, sick bastard (Yeah)
Get your wig pushed back by the wig push-backer (Ugh, ugh)
(Don't change the game for these hoes)
(Who plays the game like we supposed)
Memph' Bleek in the house! Still here, never left
Still bust, more or less, still puff, BITCH!
(Don't change the game for these hoes)
(Who plays the game like we supposed)
Young Hova in the house—Jigga!
Cris' sipper, six-dipper, wrist glitter, nigga!

[Verse 4: Jay-Z]
I wear more bling to The Source and Soul Trains
More chains than rings, niggas won't do a thing
I bangs the four-four in plain daylight; I'm deranged
Spray right at your brain; by the way, this is Hov
One-shot Dillinger, one shot killin' ya
It's only one Roc La Familia
Sigel lock Philly up, Brooklyn is me
Matter-fact, the East Coast—fuck took it from me?
Fourth album, still Jay, still spitting that real shit
Volume 3, still sold more records than Will Smith
Can't call this a comeback, I run rap, the fuck is y'all saying?
Five million? I done that, and I've come back
To do it again! (Uh-huh)
Ex-sinner, Grammy Award winner
Balling repeatedly, highlights on SportsCenter
Please repeat after me—it's only one rule
I will not lose!",JAY-Z,2001,"[98, 97, 93, 92, 100, 96, 92, 86, 87, 90, 98, 97, 97, 99]",14
283,That's How I Beat Shaq,"[Intro]
And it goes, and it goes
And it goes a little something like this
Hit It!
Aaron's in the house
Get up get up
I wanna make it back
Here we go
Aaron's in the house
Get up get up
I wanna make it back

[Verse 1]
Yo guys, check out, guess what happened to me
(Another crazy story, come on AC)
I was hanging at the court, just playing some ball
Working on my game (yeah, we heard it all)
I heard the fans screaming, I thought it was for me
But then I saw a shadow, it was 12 foot 3
It was Shaquille O'Neal (what? What did he say?)
(How 'bout some one-on-one, you wanna play?)
I told him why not, I got some time
But when I beat you real bad, try not to cry
(Please Aaron, are you for real?
One-on-one with Shaquille O'Neal?)
Yeah, 34 center from the L.A. Lakers
(You must've been nervous) I knew I could take him
Stared at Shaq, psyche him out
I said O'Neal, you're in my house now
Start the game the whistle blows
Pay attention close 'cause the story goes

[Chorus]
It's like boom (boom)
I put it in the hoop
Like slam (slam)
I heard the crowd screaming
Out jam (jam)
I swear that I'm telling you the facts
'Cause that's how I beat Shaq
It's like boom (boom)
I put it in the hoop
Like slam (slam)
I heard the crowd screaming
Out jam (jam)
I swear that I'm telling you the facts
'Cause that's how I beat Shaq

[Verse 2]
So check it out, I thought I had the lead
But then he started scoring mad points on me
I was scorin' the bricks (was he hitting all the shots?)
I knew that there was a way that I could make it stop
I had a plan, I could change the pace
I said, ""Yo Shaq you didn't tie your shoelace""
He looked down, I stole the ball
I'm taking him to school now, watch me all
A 3-pointer, nothing but net
Come on Shaq, had enough yet?
Down by two, I'm catching up
I guess you're getting nervous 'cause you already lost

[Chorus]
It's like boom (boom)
I put it in the hoop
Like slam (slam)
I heard the crowd screaming
Out jam (jam)
I swear that I'm telling you the facts
'Cause that's how I beat Shaq
It's like boom (boom)
I put it in the hoop
Like slam (slam)
I heard the crowd screaming
Out jam (jam)
I swear that I'm telling you the facts
'Cause that's how I beat Shaq
'Cause that's how I beat Shaq

[Bridge]
Dunk after dunk, jam after jam
Cheerleaders are cheering (Aaron's the man)
Dunk after dunk, jam after jam
Cheerleaders are cheering (Aaron's the man)

[Verse 3]
Announcers were shocked, couldn't believe it was real
(I can't believe a kid just stuffed O'Neal)
One more second, was all that remained
I put the ball up, I put him in shame
I must admit that it sounds real crazy
But the ball went in, then he cried like a baby
Sorry Shaq, I should've let you win
You're good too and we can still be friends
The fans went nuts, they put me on their shoulders
Then I heard a voice and it sounded like my mother's
(Get up for school, you're gonna be late)
Ma, can't you see that I'm playing a game?
(How you could be playing if you're still in bed?)
(Are you gettin' sick, did you hit your head?)
Aw, man it was all a dream
I guess that kinda thing could never happen to me
If it was a dream and it wasn't real
How'd I get a jersey with the name O'Neal? Woah

[Chorus]
Boom (boom)
I put it in the hoop
Like slam (slam)
I heard the crowd screaming
Out jam (jam)
I swear that I'm telling you the facts
'Cause that's how I beat Shaq
Boom (boom)
I put it in the hoop
Like slam (slam)
I heard the crowd screaming
Out jam (jam)
I swear that I'm telling you the facts
'Cause that's how I beat Shaq",Aaron Carter,2001,"[100, 96]",2
284,Don't Tell Me,"[Produced by No I.D.]

[Verse 1]
I know your tears more than you cause I see them so much
That's what happens when you're here with no trust
Okay, I lied, cheated, you cried
You done worse shit and I'm still here right
And motherfuck your friends, all them hoes hating
If you're not down then what's your location
I called and checked in every night and that was not probation
They gave they two cents and we ain't ask for no donation
Man you on some other other shit
Just found out about my other other bitch
Went from I love you to you don't know who you fucking with
Fresh off a vaca' and already need another trip
She said I had enough tries
Oh, and I'm the reason that she doesn't trust guys
What's the perfect girl if it's not the perfect time
If you wanna leave fine

[Hook]
Just don't tell me you love me
You're gonna make it too hard for me
I wish you were ugly
It wouldn't be so hard to leave
Cause baby I hate to love you
I can't make up my mind
Cause right when I tell you it's over
By the end of the night I be right back in bed with you
I be right back in bed with you
So don't tell me you love me

[Verse 2]
Wishing I would've tried more, she wanted the truth
Truthfully I wish I lied more cause when I was true
All I heard was ""bye"" more, ""fuck you""
""Who is that"" and ""I don't know why"" more (Shut da fuck up)
We were picture perfect and I tore it all apart
But if I pick up all the pieces we could still be a collage
Feeling like we ended too soon
Used to stay home and do it in all the rooms
Back shots, I know what you like
Had you hitting high notes and you ain't even need no autotune
Nights I was Patron'd up
Girls dressed alike looking like they cloned up
Same nights I wouldn't pick my phone up
And you was thinking damn boy grow up
And I could still hear her leaving
Crazy when a heart breaks it never breaks even
I even found another girl that's perfect
And I'm the only reason we're not working
Cause what's the perfect girl if it's not the perfect time
And if you wanna stay fine

[Hook]
Just don't tell me you love me
You're gonna make it too hard for me
I wish you were ugly
It wouldn't be so hard to leave
Cause baby I hate to love you
I can't make up my mind
Cause right when I tell you it's over
By the end of the night I be right back in bed with you
I be right back in bed with you
So don't tell me you love me

[Outro]
So don't tell me you love me
Whatever you do whatever you do",Big Sean,2001,"[45, 32, 27, 20, 13, 9, 8, 7, 6, 6, 6, 4, 4, 16, 19, 22, 26]",17
285,Love Don't Cost A Thing,"[Chorus]
Think you gotta keep me iced, you don't
Think I'm gonna spend your cash, I won't
Even if you were broke
My love don't cost a thing
Think I wanna drive your Benz, I don't
If I wanna floss, I got my own
Even if you were broke
My love don't cost a thing

[Verse 1]
When you rolled up in the Escalade
Saw that truck you gave to the valet
Knew that it was game when you looked at me
Pulling up your sleeve so I could see the Rollie bling
Saw you later in the corner booth
Raising up a toast, so I would notice you
But your heart's a mess, think you oughta know
Doesn't matter if you're balling out of control

[Pre-Chorus]
All that matters is
That you treat me right
Give me all the things I need
That money can't buy, yeah

[Chorus]
Think you gotta keep me iced, you don't
Think I'm gonna spend your cash, I won't
Even if you were broke
My love don't cost a thing
Think I wanna drive your Benz, I don't (Ooh)
If I wanna floss, I got my own
Even if you were broke
My love don't cost a thing

[Verse 2]
When I took a chance thought you'd understand (You don't understand)
Baby, credit cards aren't romance
So you're trying to buy what's already yours
What I need from you is not available in stores
Seen a side of you (You) that I really feel (Feel)
Doing way too much (Much), never keep it real (Real)
If it doesn't change, gotta hit the road
Now I'm leaving, where's my keys? I've got to go

[Pre-Chorus]
All that matters is
That you treat me right
Give me all the things I need
That money can't buy, yeah

[Chorus]
Think you gotta keep me iced, you don't
Think I'm gonna spend your cash, I won't (Baby)
Even if you were broke
My love don't cost a thing (Love don't cost a thing)
Think I wanna drive your Benz, I don't (No)
If I wanna floss, I got my own
Even if you were broke
My love don't cost a thing

[Bridge]
Love don't cost a thing, a thing, a thing
Yeah, yeah, yeah
You think the money that you make (That you make)
Can substitute the time you take (The time you take)
Take the keys here to my heart
Then you can win my heart, and get what's in my heart (Don't cost a thing)
I think you need to take some time
To show me that your love is true (Ooh)
There's more than dollar signs in you
Then you can win my heart, and get what's in my heart

[Chorus]
Think you gotta keep me iced, you don't
Think I'm gonna spend your cash, I won't
Even if you were broke
My love don't cost a thing (Love don't cost a thing)
Think I wanna drive your Benz, I don't
If I wanna floss, I got my own
Even if you were broke (Even if you were broke)
My love don't cost a thing (My love don't cost a thing)
Think you gotta keep me iced, you don't
Think I'm gonna spend your cash, I won't
Even if you were broke
My love don't cost a thing
Think I wanna drive your Benz, I don't (Think I wanna)
If I wanna floss, I got my own (If I wanna, don't)
Even if you were broke
My love don't cost a thing
Think you gotta keep me iced, you don't (Think I wanna)
Think I'm gonna spend your cash, I won't (If I want my own)
Even if you were broke
My love don't cost a thing
Think I wanna drive your Benz, I don't (Think I wanna)
If I wanna floss, I got my own (If I want my own)
Even if you were broke
My love don't cost a thing",Jennifer Lopez,2001,"[48, 39, 23, 15, 11, 5, 5, 5, 3, 3, 5, 6, 5, 4, 10, 13, 14]",17
286,Danger (Been So Long),"[Intro: Mystikal]
You know what time it is, nigga
And you know who the fuck this is
Danger, danger; get on the floor
The nigga right chea; sing it

[Hook: Nivea (Mystikal)]
Been so long, (sing it)
Since he's been on, (sing it)
So please, (get on the floor)
Show me, (the nigga right chea)
What it is that you want to see

[Verse 1: Mystikal and Nivea]
Go tell the DJ to put my shit on
I'm keeping you niggas and bitches in jump from the minute I get on
Taking they shirt off, showing they tattoos
Screaming and hollering and all
Got the gift to come up with it
Put it together, deliver it, make them feel it, bitch I been on
Sharp like you pulled me out the pencil sharpener
Bad like that student in the principal office
Put rappers in coffins, they dive like dolphins
I'm the damnedest lyrical marvel you don't come across often
So watch yourself
Or fuck around and get beside yourself, I know
Go head though, bounce them titties
Shake that ass, drop that pussy but stay in line ho
Fuck I can't, cause you can can
Cocked up, head down, pussy popping on a handstand
Leave that pussy smoking
If you gon' do something then bend over, and bust that pussy open

[Hook: Mystikal]
Been so long, (sing it)
Since he's been on, (sing it)
So please, (get on the floor)
Show me, (the nigga right chea)
What it is that you want to see

[Hook: Mystikal]
Been so long, (sing it)
Since he's been on, (sing it)
So please
Show me
What it is that you want to see

[Verse 2:  Mystikal and Nivea]
My fucking concert line around the corner
Parking cars, niggas looking for they bitch, nothing on her
You looking good momma; why, pssh what's up homie
Sirens, limousines, and the club owner ya bitch you
If you late, ain't no getting in this bitch cause it's filling up
Inside packed from the floor to the ceiling up
The building ain't big enough
I'm backstage bouncing, adrenaline building up
The pussy cutter, did I stutter
The heart flutter, make your woman drawers melt like butter
Down like Nelly, I'm hype like Belly
The rhyme-seller, kick ass like Jim Kelly
Stand up, round out, boot up and frown
Tell a nigga if he wanna try it then bitch come on down
No sweat, no blood, no tears
And if I tell you it's the shit then, bitch that's what it is

[Hook: Mystikal]
Been so long, (sing it)
Since he's been on, (sing it)
So please, (get on the floor)
Show me, (the nigga right chea)
What it is that you want to see

[Hook: Mystikal]
Been so long, (sing it)
Since he's been on, (sing it)
So please, (get on the floor)
Show me, (the nigga right chea)
What it is that you want to see

[Outro: Mystikal and Nivea]
Danger, talking bout
Danger, motherfucker look
Get on the flo'
The nigga right chea
Danger, motherfucker, watch your back
Danger, look look
Nigga what, look look
Get on the flo'
The nigga right chea, get 'em up

[Outro: Mystikal and Nivea]
Danger, talking bout
Danger, motherfucker look
Get on the flo'
The nigga right chea
Danger, motherfucker, watch your back
Danger, look look
Nigga what, look look
Get on the flo'
The nigga right chea, get 'em up

[Verse 3]
I wanna see these fake rappers get off the mic
Gimme my room, you grabbed my space
Look out you all in my life, watch out man
I'm ripping a solo, I jump in the show, the rest are no more
Threw lyrical bolos, head butts and rhyme elbows
Get off me; tip-toe, wild slow, wild softly
Hurry up, you might not be able to do that shortly
Ain't trying to forget the chea
The whole crowd screaming out danger, danger

[Hook: Mystikal]
Been so long, (sing it)
Since he's been on, (sing it)
So please, (get on the floor)
Show me, (the nigga right chea)
What it is that you want to see

[Hook: Mystikal]
Been so long, (sing it)
Since he's been on, (sing it)
So please, (get on the floor)
Show me, (the nigga right chea)
What it is that you want to see

[Outro: Mystikal]
Danger
Danger
Get on the floor
The nigga right here",Mystikal,2001,"[62, 66, 45, 39, 34, 26, 26, 22, 19, 21, 17, 14, 17, 19, 20, 23, 23]",17
287,Could It Be,"[Intro: Lance Skiiiwalker]
Uh, can you bring the waiter back over here again?
She's kinda cute
Eh, what's your name?

[Verse 1: Lance Skiiiwalker]
Say baby can we dip?
So, so I can swing you by my way
Hey, we lovers on the hip
Well, well I guess I'll be  born that way
Say, that's why we skinny dip
To, a cabin in my hide away
Girl, oh
Girl, we’re lovers at heart, baby

[Hook: Lance Skiiiwalker]
So, I tip her, I tip her a few (two)
Our waitress is (cute, so)
I tip her, I tip her a few (two)
Our waitress is (cute, so)
I tip her, I tip her a few (two)
Our waitress is (cute, so)
I tip her, I tip her a few (two)
This waitress is (cute, so)

[Interlude: Lance Skiiiwalker]
I still want your number though
Please

[Beat Change]

[Verse 2: Lance Skiiiwalker]
Roses bloom, so girl why are you
Blue, baby let me take you, show you, could it be?
If it's cool, when it's cool
My hide out, baby come and run away with me
And lay low
San Pedro, where's my coupe?
Sugar, let me kiss you crazy, massage your feet
Girl it's cool, girl it's cool
We lay out, baby come and run away with me
Lock you up, find the key
To these adventures baby come around and see
Past the stars, through the trees
To a better living, baby come and grab a seat

[Outro]
Um, so when you available?
Never? Oh, okay, alright, okay bye, bye
I hope that didn't hurt you too bad

[Video directed by PANAMÆRA, Kendrick Lamar and Dave Free]",Lance Skiiiwalker,2001,"[76, 65, 55, 44, 39, 36, 27, 29, 26, 31, 36, 43, 57, 73, 82, 84, 78]",17
288,Soul Sista,"[Intro]
Hey sis, sista

[Verse 1]
It's all in her eyes, you and me
Words just disguise all the things that you be
What is deep? Steeper than steep
Soul only knows, this type of vibe gets stronger in time

[Verse 2]
Won't go on unnoticed, so concrete can't hold this
Hearts filled righteously
Whatever it is, I know that it's real
Long as you know, no complaints, you're all that I feel

[Chorus 1]
Sista soul
You must be my soul sista, soul sista
Sista soul
Hey sis, you must be my soul sista, soul sista
Sista soul
Hey sis, you must be my soul sista
Sista soul

[Verse 3]
You are so fine, like spaces that fall in my soul
See baby that has no rhyme
Do you like how it feels when I smoke you out head down to your toes?
Making you, making you scream and shout

[Chorus 2]
You must be my soul sista, soul sista, you my
Sista soul
You must be my soul sista, soul sista, you my
Sista soul
You must be my soul sista, soul sista, you my
Sista soul
You must be my soul sista, soul sista, hey
Sista soul
Sista soul
You must be my soul sista, soul sista, sista, sista, sista soul
Sista soul

[Outro]
Sista soul, sista soul, sista soul, hey, baby
Can I love you in the right way, please?
Soul, hold, baby, I want to love
You know, baby, I want to love in the right way
Hold you 'cause you're my soul sista, baby, you are my sista
All I wanna do is love you in the right way
Hold you on 'cause baby, you are my soul sista
Soul, love you in the right way, you're my, hey, hey, hey
You're my soul sista, you're my, hey, hey, hey, hey
Soul sista, hey my soul sista, soul
You're my soul sista, hey, yeah, yeah
I wanna love you in the right way
Hold you, don't you know what I say?
Told you, baby, don't you know?
You're my soul sista, hey
You're gonna really know it
You're, baby, I want it, I want it
Gimme, gimme",Bilal,2001,"[98, 98, 96, 81, 88, 89, 81, 71, 85, 83, 90, 85, 90, 97]",14
