,title,lyrics,artists,date,rank,cnt
91,Feelin' On Yo Booty,"[Chorus]
This is my song for real, no doubt (oh)
Said the DJ's making me feel thugged out
(Feeling thugged out here)
As I walk you to the dance floor (oh)
We begin to dance slow (yeah)
Put your arms around me
I'm feeling on your booty

[Verse 1]
Hey pretty mama, how you doing?
Said I'm just in town for the weekend
Looking for a little trouble to get into
Baby, tell me what you're drinking
And I got you, ooh

[Pre-Chorus]
Playas wanna play
Ballers wanna ball (oh yeah)
Rollers wanna roll
But I'm taking off after I dance, oh yeah

[Chorus]
This is my song for real, no doubt
Said the DJ's making me feel thugged out
(I'm feeling thugged out, oh yeah)
As I walk you to the dance floor
We begin to dance slow
Put your arms around me
I'm feeling on your booty (this is my song, oh)
This is my song for real, no doubt
Said the DJ's making me feel thugged out
(Feeling thugged out, yeah)
As I walk you to the dance floor
We begin to dance slow (oh)
Put your arms around me
I'm feeling on your booty

[Verse 2]
Now you're body's got me feeling like spending
With a back room I could come to live in
And your hair weave's looking kind of purty
The way you back it up on me baby
Lord have mercy

[Pre-Chorus]
Playas wanna play (um)
Ballers wanna ball (ballers wanna ball)
Rollers wanna roll
But I'm taking off after I dance, oh yeah

[Chorus]
This is my song for real, no doubt
Said the DJ's making me feel thugged out
(I'm feeling thugged out, oh yeah)
As I walk you to the dance floor
We begin to dance slow (oooh)
Put your arms around me
I'm feeling on your booty (this is my song, oh yeah)
This is my song for real, no doubt
Said the DJ's (I'm feeling) making me feel thugged out (thugged out)
As I walk you to the dance floor (dance floor)
We begin to dance slow (we'll dance)
Put your arms around me (oh yeah)
I'm feeling on your booty

[Verse 3]
If it's your birthday
Then put your hands up
You wanna get drunk
Then put your hands up
And if you got some cash
Then put your hands up
Have your own job
Put your hands up

[Pre-Chorus]
Playas wanna play
Ballers wanna ball (ballers wanna ball)
Rollers wanna roll
Feels so good, say it again
Playas wanna play
Ballers wanna ball
Rollers wanna roll
But I'm taking off after I dance, oh yeah

[Chorus]
This is my song for real, no doubt
Said the DJ's making me feel thugged out (feeling thugged out)
As I walk you to the dance floor (walk you to the)
We begin to dance slow (we begin to)
Put your arms around me (put your arms a-, oh)
I'm feeling on your booty
This is my song for real, no doubt
Said the DJ's making me feel thugged out (feel thugged out)
As I walk you to the dance floor (walk you to the dance floor)
We begin to dance slow
Put your arms around me
I'm feeling on your booty
(Feeling on yo booty, yes am I)
This is my song for real, no doubt
Said the DJ's making me feel thugged out
(And I hope you like it, girl)
As I walk you to the dance floor (walk you to the dance)
We begin to dance slow (we begin to dance)
Put your arms around me (put your arms around)
I'm feeling on your booty
This is my song for real, no doubt
(Feeling on your booty, your booty)
Said the DJ's making me feel thugged out (booty, your boo)
As I walk you to the dance floor
(Feeling on your booty, your booty)
We begin to dance slow
Put your arms around me (your boo-ooty, your boo-ooty)
I'm feeling on your booty
This is my song for real, no doubt (boo-oo-oo-oo-ty, boo-oooty)
Said the DJ's making me feel thugged out
(Boo-boo-boo-boo-boo-booty, boo-booty hahahaha)
As I walk you to the dance floor
We begin to dance slow
Put your arms around me
I'm feeling on your booty",R. Kelly,2001,"[92, 92, 89, 88, 83, 82, 69, 59, 54, 47, 40, 36, 37, 48, 50, 57, 53, 59, 74]",19
92,Got Ur Self A...,"[Produced by Megahertz]

[Intro: Alabama 3 sample (Nas)]
Woke up this mornin' (yeah)
You got yourself a gun (yeah, yeah, yeah)
Got yourself a gun

[Chorus]
Yo, I'm livin' in this time behind enemy lines
So, I got mine, I hope you (got yourself a gun)
You from the hood, I hope you (got yourself a gun)
You want beef, I hope you (got yourself a gun)
And when I see you I'ma take what I want
So you tried to front, hope you (got yourself a gun)
You ain't real, hope you (got yourself a gun)

[Verse 1]
My first album had no famous guest appearances
The outcome: I'm crowned the best lyricist
Many years on this professional level
Why would you question who's better? The world is still mine
Tattoo's real, with ""God's Son"" across the belly, the boss of rap
You saw me in Belly with thoughts like that
To take it back to Africa, I did it with Biggie
Me and 2Pac were soldiers of the same struggle
You lames a huddle, your team's shook
Y'all feel the wrath of a killer, ‘cause this is my football field
Throwin' passes from a barrel, shoulder pads, apparel
But the QB don't stand for no quarterback
Every word is like a sawed-off blast 'cause y'all all soft
And I'm the black hearse that came to haul y'all ass in
It's for the hood by the corner store
Many try, many die, come at Nas if you want a war, get it bloody!

[Chorus]
I got mine, I hope you (got yourself a gun)
You from the hood, I hope you (got yourself a gun)
You want beef, I hope you (got yourself a gun)
And when I see you I'ma take what I want
So you tried to front, hope you (got yourself a gun)
You ain't real, hope you (got yourself a gun)

[Verse 2]
Yo, I'm the N, the A to the S-I-R
And if I wasn't, I must've been Escobar
You know the kid got his chipped tooth fixed
Hair parted with a, barber's preciseness
Bravehearted for life, it's
The return of the Golden Child, son of a blues player
So who are you, player? Y'all awaited the true savior
Puffin' that tropical, cups of that vodka, too
Papi chu', tore up, wake up in a hospital
Throw up? Never! 'Member I do this through righteous steps
You Judas thought I was gone, so in light of my death
Y'all been all happy-go-lucky, bunch of sambos
Call me ""God's Son"" with my pants low
I don't die slow, put them rags up like Petey Pablo
This is NASDAQ though, in my Nascar, with this Nas flow
What could beat that? Not a soul reppin'
Hit the record store, never let me go, get my whole collection, yo

[Chorus]
I got mine, I hope you (got yourself a gun)
You from the hood, I hope you (got yourself a gun)
You want beef, I hope you (got yourself a gun)
And when I see you I'ma take what I want
So you tried to front, hope you (got yourself a gun)
You ain't real, hope you (got yourself a gun)

[Verse 3]
It's, the, return of the prince, the boss
This is real hardcore, Kid Rock and Limp Bizkit soft
Sip Cris', get chips, wrist glist' – I floss
Stick-shift look sick up in that Boxster Porsche
With the top cut off, rich kids go and cop The Source
They don't know about the blocks I'm on
And everybody wanna know where the kid go
Where he rest at, where he shop at and dress at
Know he got dough, where does he live? Is he still in the Bridge?
Does he really know how ill that he is?
Got all of y'all watchin' my moves, my watch and my jewels
Hop in my coupe, dodge interviews like that
It's not only my jewels, ice anything, plenty chains
Look at my tennis shoes, I iced that
Who am I? The back twister, lingerie ripper
Automatic leg-spreader, quicker brain-getter
Keepin' it gangsta with ya (uhh)

[Chorus]
I got mine, I hope you (got yourself a gun)
You from the hood, I hope you (got yourself a gun)
You want beef, I hope you (got yourself a gun)
And when I see you I'ma take what I want
So you tried to front, hope you (got yourself a gun)
You ain't real, hope you (got yourself a gun)",Nas,2001,"[93, 93, 99]",3
93,What Am I Gonna Do,"[Intro]
All these years I been wanting you in my life
And now I finally I have you
I'ma do everything in my strength to keep you near
I care about you
I just wanna make you smile, hah
Let's go

[Verse 1]
All the many days you were on my mind
Visions of me with you all the time
You wasn't looking for a man
You made it clear (clear to me)
And now I'm ever so glad that I have you near

[Pre-Chorus]
Here in my life just you and I
We can do whatever we want to
I'm living my life with you by my side
One day I'ma make you my wife, baby

[Chorus]
I was excited 'cause I was fallin', fallin' in love with you
Now that I've fallen, what am I'm gonna do?
I was excited 'cause I was fallin', fallin' in love with you
Now that I've fallen, what am I'm gonna do?

[Verse 2]
I'll do whatever puts a smile on my baby's face
Girl, you're my best friend and you can never be replaced
There's nothing in this world I wouldn't do (Do for you)
You are one of my favorite dreams and I'm so glad that it came true

[Pre-Chorus]
Here in my life just you and I
We can go anywhere we want to
I'm living my life with you by my side
One day I'ma make you my wife, yes, I am

[Chorus]
I was excited 'cause I was fallin', fallin' in love with you
Now that I've fallen, what am I'm gonna do?
I was excited 'cause I was fallin', fallin' in love with you
Now that I've fallen, what am I'm gonna do?

[Bridge]
Since I gave you all my trust
And you never take my trust for granted
And you've given so much love
And you've given me so much love
You're everything I want and need
You're everything I want and I need
Girl, you got the best of me
Ooh, you got the best of me
Break it down
Ohh, ohh
Oh, I was fallin' in love

[Chorus]
I was excited 'cause I was fallin', fallin' in love with you
Now that I've fallen, what am I'm gonna do?
I was excited 'cause I was fallin', fallin' in love with you
Now that I've fallen, what am I'm gonna do?",Tyrese,2001,"[94, 90, 88, 86, 86, 84, 80, 76, 77, 78, 81, 78, 71, 79]",14
94,I'm A Survivor,"[Verse 1]
I was born 3 months too early
The doctor gave me 30 days
But I must have had my momma's will
And God's amazing grace
I guess I'll keep on living
Even if this love's to die for
Because your bags are packed and I ain't crying
You're walking out and I'm not trying to change your mind
Because I was born to be

[Chorus]
The baby girl without a chance
A victim of the circumstance
The one who ought to give up
But she's just too hard headed
A single mom who works two jobs
Who loves her kids and never stops
With gentle hands and a heart of a fighter
I'm a survivor

[Verse 2]
I don't believe in self-pity
It only brings you down
May be the queen of broken hearts
But I don't hide behind the crown
When the deck is stacked against me
I just play a different game
My roots are planted in the past
Though my life is changing fast
Who I am is who I want to be

[Chorus]
The baby girl without a chance
A victim of the circumstance
The one who ought to give up
But she's just too hard headed
A single mom who works two jobs
Who loves her kids and never stops
With gentle hands and a heart of a fighter
I'm a survivor

[Verse 3]
Oh, a single mom who works two jobs
Who loves her kids and never stop
With gentle hands and a heart of a fighter
I'm a survivor
But I must have had my mamma's will and God's
Amazing grace

[Outro]
I'm a survivor",Reba McEntire,2001,"[95, 86, 72, 55, 49, 55, 53, 53, 56, 57, 60, 62, 72, 70, 70, 81]",16
95,Do U Wanna Roll (Dolittle Theme),"[Snoop Dogg]
It's somethin about the West Coast, that makes me thank the East
Eastside! Eastside!
And somethin about the West Coast, that makes me bang the beat
HELP ME SING IT!

[Chorus: R.L.]
Do ya wanna roll, in my six fo'?
Let's have some fun baby, let's have some fun
Oh we'll get low (we'll get low) and dats for sho'!
And hop on dubs baby and have some fun, now check us out!

[Verse One: R.L.]
From when I met you at the roller rink
Cotton candy with her Shasta drink
Braced with caress that were white and pink
All the kissing we did, was on the cheek
Remember, like yesterday
We'd hop on our bikes and just ride away
Knew you'd be mine some how, some day
And I'ma say I do

[Chorus]

[Verse Two: Snoop Dogg]
Three, bottles of Moe', doe, models fa sho'
We havin a good time avoidin one time
Layin in the sunshine its all gravy!
Dipped it, hit a switch, what's crackin' baby?
Ride with me slide with a double-oh, sip on this moe'moe
Get your bubble on, bring your girlfriends
All y'all can come along
Cause we'll be doin this all summer long
In the Cadillac beatin' up some Battlecat
Dogg youse a fool baby lemme handle that
Oh you don't drink so you don't think
You ain't gon' win you don't speak, you ain't no freak
Cause I can turn you, learn you and burn you up
Gimme the cup sit down and shut up!
I be damned we done run outta Mo' again
Here we, here we go again!

[Chorus]

[Verse Three: R.L.]
I gotta Chevrolet, white walls and them
Twenty inch thangs in the coupe with Snoop
Gettin juiced orange juice top down
And feel the sun rays feelin kinda good right know
Right around my hood right now
Lookin for somethin to do like a barbecue
It's too hot to be in the house
A little bit of music and a couple of babes
A little bit of drank and a game of spades
Take your kids to your mama's house
Sure know what I'm talkin bout, it's about to go down!

[Chorus]

[Verse Four: Lil' Kim]
Aight aight, I admit I'm type picky
Take trips to Cali, strictly for the sticky
I'ma get get it crunk anywhere I go
Why you smooth haters actin' like y'all don't know
From barbecue's to barmitzvah's
O.G.'s crack the O.E. while they listen to me
Cris' on the table, chronic in the air
Come on pass that shit like that's that shit
We doin Battlecat pump this in the Sony
The Bee showin love to the westside homies
Give you somethin you can feel, real recognize the real...
Cause it's, cause it's somethin bout the East Coast
That makes us wanna squeeze mo'
For those that don't think that we ride
We gon' show you how we do the damn thing
We gon' show you how we do

[Chorus]",R.L.,2001,"[96, 91, 84, 84, 87, 88, 91, 93, 96, 100, 97, 94, 94]",13
96,What If,"[Verse 1: Johnny Orlando]
Let's talk about all the things that we shouldn't talk about
Those kind of words that will change all the things we talk about
Tell me do you ever think of us?
Should I ask for more or should I stop?

[Pre-Chorus: Johnny Orlando]
What if a tomorrow means that we are here together?
What if we are taking chances just to lose it all?
Am I really crazy thinking 'bout this all together?
What if I've been missing the writing on the wall?

[Chorus: Both]
What if I say
I know, you know
What if I told you I like you?
We stay, we go
What if I told you I like you?
I know, you know
What if I told you I like you?
We stay, we go
What if I told you I like you?
What if I told you I like you?
What if I told you I like you?

[Verse 2: Mackenzie Ziegler]
I hear everything they saying, saying 'bout us
It's not about right or wrong, it's about what we love
Would it be simple or would it be too complicated?
Should I keep going or maybe it's better to stop?

[Pre-Chorus: Mackenzie Ziegler]
What if a tomorrow means that we are here together?What if we are taking chances just to loose it all?
Am I really crazy thinking 'bout this all together?
What if I've been missing all the writing on the wall?

[Chorus: Both]
What if I say
I know, you know
What if I told you I like you?
We stay, we go
What if I told you I like you?
I know, you know
What if I told you I like you?
We stay, we go
What if I told you I like you?
What if I told you I like you?


[Bridge: Johnny Orlando, Mackenzie Ziegler, Both]
What if I say
I know, you know
What if I told you I like you?
We stay, we go
We stay, we go
What if I told you I like you?
I know, you know
What if I told you I like you?
We stay, we go
What if I told you I like you?
I like you
What if I told you I like you?
We stay, we go
What if I told you I like you?

[Outro: Johnny Orlando]
Let's talk about all the things we shouldn't talk about..",Johnny Orlando,2001,"[97, 98, 92, 89, 89, 87, 83, 80, 87, 85, 88, 90, 91, 98, 98]",15
97,Round And Round,"[Verse 1]
Out on the streets, that's where we'll meet
You make the night, I always cross the line
Tightened our belts, abuse ourselves
Get in our way, we'll put you on your shelf
Another day, some other way
We're gonna go, but then we'll see you again
I've had enough, we've had enough
Cold in vain, she said

[Pre-Chorus]
I knew right from the beginning
That you would end up winnin'
I knew right from the start
You'd put an arrow through my heart

[Chorus]
Round and round
With love we'll find a way just give it time
Round and round
What comes around goes around
I'll tell you why
... Dig

[Verse 2]
Lookin' at you, lookin' at me
The way you move, you know it's easy to see
The neon light's on me tonight
I've got a way, we're gonna prove it tonight
Like Romeo to Juliet
Time and time, I'm gonna make you mine
I've had enough, we've had enough
It's all the same, she said

[Pre-Chorus]
I knew right from the beginning
That you would end up winnin'
I knew right from the start
You'd put an arrow through my heart

[Chorus]
Round and round
With love we'll find a way just give it time
Round and round
What comes around goes around
I'll tell you why

Yeah!

[Solo]

[Verse 1]
Out on the streets, that's where we'll meet
You make the night, I always cross the line
Tightened our belts, abuse ourselves
Get in our way, we'll put you on your shelf

[Chorus]
Round and round
With love we'll find a way just give it time
Round and round
What comes around goes around
I'll tell you why

[Chorus]
Round and round
With love we'll find a way just give it time, time, time, time
Round and round
What comes around goes around
I'll tell you why, why, why, why
Round and round",RATT,2001,"[98, 96, 98]",3
98,God Bless America,"[Verse 1]
While the storm clouds gather far across the sea
Let us swear allegiance to a land that's free
Let us all be grateful that we are far from there
As we raise our voices in a solemn prayer

[Verse 2]
God bless America, land that I love
Stand beside her and guide her
Through the night with a light from above
From the mountains to the prairies
To the oceans white with foam
God bless America, my home sweet home
God bless America, my home sweet home",Irving Berlin,2001,[99],1
99,Who We Be,"[Intro: DMX]
Uhh, yeah, another one of those (this is for my nigga Q)
Down to earth joints (rest in peace baby - you know how we roll)
There's so many that don't know (you knew I could do it)

[Chorus]
They don't knooow, who we beee
They don't knooow, who we beee

[DMX over Chorus]
This goes out to my nigga Q - rest in peace baby (I miss you dog)
You still here with me?

[Verse 1: DMX]
What they don't know is:
The bullshit, the drama (uhh), the guns, the armour (uhh!)
The city, the farmer, the babies, the mama (what?!)
The projects, the drugs (uhh!), the children, the thugs
(uhh!) The tears, the hugs, the love, the slugs (c'mon!)
The funerals, the wakes, the churches, the coffins (uhh!)
The heartbroken mothers, it happens, too often (why?!)
The problems, the things, we use, to solve 'em (what?!)
Yonkers, the Bronx (uhh!), Brooklyn, Harlem (c'mon!)
The hurt, the pain, the dirt, the rain (uhh!)
The jerk, the fame, the work, the game (uhh!)
The friends, the foes, the Benz, the hoes (what?!)
The studios, the shows, comes, and it goes (c'mon!)
The jealousy, the envy, the phony, the friendly (uh-huh!)
The one that gave 'em the slugs, the one that put 'em in me
(whoo!) The snakes, the grass, too long, to see (uhh, uhh!)
The lawnmower, sittin', right next, to the tree (c'mon!)

[Chorus]
They don't knooow, who we beee
They don't knooow, who we beee
They don't knooow, who we beee
They don't knooow, who we beee

[Verse 2: DMX]
What we seeing is:
The streets, the cops, the system, harassment (uh-huh)
The options, get shot, go to jail, or getcha ass kicked
(aight) The lawyers, the part, they are, of the puzzle (uh-huh)
The release, the warning, ""Try not, to get in trouble"" (damn!)
The snitches, the odds (uhh), probation, parole (what?!)
The new charge, the bail, the warrant, the hole (damn!)
The cell, the bus, the ride, up North (uh-huh)
The greens, the boots, the yard, these hearts (uhh!)
The fightin', the stabbin', the pullin', the grabbin' (what?!)
The riot squad with the captain, nobody knows what happened
(what?!) The two years in a box, revenge, the plots (uhh!)
The twenty-three hours that's locked, the one hour that's not
(uhh!) The silence, the dark, the mind, so fragile (aight!)
The wish, that the streets, would have took you, when they had you
(damn) The days, the months, the years, despair
One night on my knees, here it comes, the prayer

[Chorus]
They don't knooow, who we beee
They don't knooow, who we beee
They don't knooow, who we beee
They don't knooow, who we beee

[Verse 3: DMX]
This here is all about:
My wife, my kids (uh-huh), the life that I live (uh-huh)
Through the night, I was his (uh-huh), it was right, but I did
(uh-huh) My ups, and downs (uhh), my slips, my falls (uhh)
My trials and tribulations (uhh), my heart, my balls (uhh)
My mother, my father, I love 'em, I hate 'em (uhh!)
Wish God, I didn't have 'em, but I'm glad that he made 'em
(uhh!) The roaches, the rats, the strays, the cats (what, what?!)
The guns, knives and bats, everytime we scrap
The hustlin', the dealin', the robbin', the stealin' (uhh!)
The shit, hit the ceiling', little boy, with no feelings
(damn) The frustration, rage, trapped inside a cage
Got beatin's 'til the age, I carried a twelve gauge
(aight!) Somebody stop me (please!), somebody come and get me
(what?!) Little did I know, that the Lord was ridin' with me
The dark, the light (uhh), my heart (uhh), the fight (uhh)
The wrong (uhh!), the right (uhh!), it's gone (uhh!), aight?

[Chorus]
They don't knooow, who we beee
They don't knooow, who we beee
They don't knooow, who we beee
They don't knooow, who we beee
They don't knooow, who we beee
They don't knooow, who we beee
They don't knooow, who we beee
They don't knooow, who we beee

[Outro: DMX over Chorus]
Man listen
These motherfuckers don't know, who we are!
They don't know
They couldn't possibly fuckin' know dawg
That's from the heart",DMX,2001,"[100, 89, 75, 64, 65, 60, 62, 66, 79, 83, 83, 89]",12
100,Hit 'Em Up Style (Oops!),"[Verse 1]
While he was scheming
I was beamin' in the Beamer just steamin'
Can't believe that I caught my man cheatin'
So I found another way to make him pay for it all
So I went to Neiman Marcus on a shopping spree-ah
And on my way I grabbed Sole and Mia
And as the cashbox rang, I thought everything away

[Pre-Chorus]
(Oops) There goes the dreams we used to say
(Oops) There goes the time we spent away
(Oops) There goes the love I had
But you cheated on me and that's for that now
(Oops) There goes the house we've made a home
(Oops) There goes ""You'll never leave me alone""
(Oops) For all the lies you told
This is what you're owed

[Chorus]
Hey ladies, when ya man wanna get buck wild
Just go back and hit 'em up style
Get your hands on his cash and
Spend it to the last dime for all the hard times
Oh, when you go, then everything goes
From the crib to the ride and the clothes
So you better let 'em know that
If he mess up, you gotta hit 'em up

[Verse 2]
While he was braggin'
I was coming down the hill just draggin'
All his pictures and his clothes in a bag and
Sold everything else 'til there was just nothing left
And I paid, all the bills about a month too late
It's a shame we have to play these games
The love we had just faded away, away

[Pre-Chorus]
(Oops) There goes the dreams we used to say
(Oops) There goes the time we spent away
(Oops) There goes the love I had
But you cheated on me and that's for that now
(Oops) There goes the house we've made a home
(Oops) There goes ""you'll never leave me alone""
(Oops) For all the lies you told
This is what you owe

[Chorus]
Hey ladies (Hey ladies), when ya man wanna get buck wild
Just go back and hit 'em up style
Get your hands on his cash and
Spend it to the last dime for all the hard times
Oh (Oh), when you go then everything goes
From the crib to the ride and the clothes
So you better let 'em know that
If he mess up, you gotta hit 'em up
Hey ladies (Ladies), when ya man wanna get buck wild (Oh)
Just go back and hit 'em up style
Get your hands on his cash and
Spend it to the last dime for all the hard times
Oh, when you go, then everything goes
From the crib to the ride and the clothes
So you better let 'em know that
If you mess up, you gotta hit 'em up

[Bridge]
All of the dreams you sold
Left me out in the cold
What happened to the days when we used to trust each other?
And all of the things I sold
Will take you until you get old
To get 'em back without me
'Cause revenge is just better than money, you'll see

[Chorus]
Hey ladies, when ya man wanna get buck wild
Just go back and hit 'em up style (Hit 'em up style)
Get your hands on his cash and (Oh yeah)
Oh, when you go then everything goes
From the crib to the ride and the clothes
So you better let 'em know that
If he mess up, you gotta hit 'em up
Hey ladies (Hey ladies, hey ladies, hey ladies, yeah)
Whoa, oh, oh, oh, oh
Oh, oh no, oh no, yeah, oh oh oh
If he mess up, you gotta hit 'em up (Hit 'em up, yeah)
Hey ladies, when ya man wanna get buck wild (Buck wild)
Just go back and hit 'em up style (Oh)
Get your hands on his cash and (Da da dum, da da dum)
Oh, when you go then everything goes (Everything goes)
From the crib to the ride and the clothes
So you better let 'em know that",Blu Cantrell,2001,"[46, 41, 43, 40, 34, 27, 16, 12, 8, 6, 5, 4, 4, 4, 5, 4, 4, 4, 3, 4, 3, 2, 2, 5, 44, 53, 59, 59, 65, 69, 71, 74, 74, 83]",34
