,title,lyrics,artistsFromLyrics,artists,date,rank,cnt
91,What If I Told You That I Love You,"[Intro]
What if I told you that I love you?
Would you tell me that you love me back?
What if I told you that I miss you?
Would you tell me that you miss me back?

[Pre-Chorus]
What if I told you that I need you? (Need you)
Would you tell me that you need me, yeah?
If I tell you all my feelings (Feelings)
Would you believe me, yeah?

[Chorus]
What if I told you that I lo-lo-lo-lo-lo-lo-lo-love you? Yeah
What if I told you that I lo-lo-lo-lo-lo-lo-lo-love you? Yeah
What if I told you that I need you? (Need you, need you)
Would you tell me that you need me, too?
What if I told you that I lo-lo-lo-lo-lo-lo-lo-love you?

[Verse 1]
Ayy, when you told me that you'd love me
Was I a fool to believe in you?
When you told me I was special
Was I dumb for trusting you?
When you told me that you want me
Did you really want me?
Or was this all a joke to you? (To you, to you)
I don't wanna say, ""I miss you""
If I don't know that you miss me back (Oh, no, no)
I don't wanna say the wrong thing
If I do, there's no coming back

[Pre-Chorus]
What if I told you that I need you? (Need you)
Would you tell me that you need me, yeah?
If I tell you all my feelings (Feelings)
Would you believe me, yeah?

[Chorus]
What if I told you that I lo-lo-lo-lo-lo-lo-lo-love you? (Na-na-na)
Yeah, what if I told you that I lo-lo-lo-lo-lo-lo-lo-love you?

[Verse 2]
I wish I told you that I loved you
Now it's too late, you have someone new
I hope he loves you like I do
Do you love the way he's treating you?

[Bridge]
What if I told you that I love you?
Would you tell me that you love me back? (Me back)
If I told you that I miss you
Would you tell me that you miss me back? (Me back)

[Pre-Chorus]
What if I told you that I need you?
Would you tell me that you need me, yeah?
If I tell you all my feelings
Would you believe me, yeah?

[Chorus]
What if I told you that I lo-lo-lo-lo-lo-lo-lo-love you? Yeah
What if I told you that I lo-lo-lo-lo-lo-lo-lo-love you? Yeah
What if I told you that I need you?
Would you tell me that you need me, too?
What if I told you that I love you?
What if I told you that I—",Ali Gatie,Ali Gatie,2020,[95],1
92,Catch,"[Verse 1]
I wasn't tryna feel like this
I wasn't tryna feel nothin' at all
I just came to meet my friends
And try to drink a long week off
I didn't want to stay too late
I wasn't tryna close it down
I was doin' my own thing
Yeah, up until you sat down

[Chorus]
I thought that I'd
Catch a buzz, catch a game
Catch up with the boys, the same old thing
Catch a cab back to my place
But then I saw your face
Now you got me tryna
Catch your eye, catch your name
Catch a spark and start a flame
The way you smile and I can't help myself
Girl, you got me tryna catch my breath
You got me tryna catch my breath, yeah

[Verse 2]
You got me doin' double-takes
You went and messed up all my plans
I only meant to hold this drink
Now I'm tryna hold your hand

[Chorus]
Yeah, I thought that I'd
Catch a buzz, catch a game
Catch up with the boys, the same old thing
Catch a cab back to my place
But then I saw your face
Now you got me tryna
Catch your eye, catch your name
Catch a spark and start a flame
The way you smile and I can't help myself
Girl, you got me tryna catch my breath, whoa
Ooh, you got me tryna catch my breath, whoa

[Bridge]
You got me catchin' feelin's
I wasn't even tryna feel this
I don't know how you started stealin'
My heart like you are in this bar
But I'm glad that you are

[Chorus]
'Cause I just thought that I'd
Catch a buzz, catch a game
Catch up with the boys, the same old thing
Catch a cab back to my place
But then I saw your face
Now you got me tryna
Catch your eye, catch your name
Catch a spark and start a flame
The way you smile and I can't help myself
Girl, you got me tryna catch my breath, oh
You got me tryna catch my breath, yeah
Ooh, you got me tryna catch my breath, whoa
You got me tryna catch my breath, whoa",Brett Young,Brett Young,2020,[96],1
93,Unaccommodating,"[Перевод песни ""Eminem - Unaccommodating ft. Young M.A""]

[Интро: Young M.A & Eminem]
Вот, что мы делаем? Окей
Аминь!

[Куплет 1: Young M.A]
Мне нравятся сучки, которые любят тверкать, тверкать
Тряси, тряси, качай, качай
Нигга, мы добились успеха, добились успеха, они ненавидят это, ненавидят это
Я супер-про, сама настойчивость, ловец нала
Не люблю сравнения, не выношу ожидания, я заплачу за терпение
Но я ненавижу платить по счетам (Ненавижу это)
И я заработала миллион без контракта с мейджор-лейблом (Я сделала это)
Да, ее жопа фальшивая, но она пришла (Она пришла, уф)
Деньги не вещь, ведь они не реальны
Это лишь брокерский сленг (Хах)
И нет, ничего от ""Saweetie"", ни при чем здесь Quavo (Migo)
Чувак, я просто накурена, пусть мои шлюшки залягут на дно (Ууу)
Я просто хочу бабок, и я сейчас не про баб (Ууу)
Поступай правильно и уничтожь ее тело, режим Дрэйка (Привет)
Сука, я ем в ресторане, грей свою плиту молча (Привет)
Презираю твою жизни, пока состою в банде (Гррр)
Ты можешь покинуть эти земли, сука, я гребу бабло (Хах)
Я сладкая как торт (Ха), храбрая, как лев, у
Как дела Маршал? Я марсианин, режим Уэйна (Факты)
Шея в поту, капли стекают по лбу, я будто стою под дождем (Кап, кап, кап)
Восемь ниггеров, восемь хитов, возьми восемь душ (Бррр)
Собери песо и я свободна, так? (Уплачен)
Самодельные цели (Хэй)
Когда боль уходит (Хах)
Куда она идет? (Куда?)
Конец косяка, вот куда жаришка идет (There)
В небеса, вот куда мой мозг летит (Воу)
Та же стая, тот же дьявол, продающий ту же одежду. (Воу)
Пиноккио и мой ствол, одинаковый нос
Я и мои ниггеры должны есть, мы делим одну плиту (Что?)
Дело закрыто, трупы в переулке, сука, улочка перекрыта

[Куплет 2: Eminem]
Конец игры, Танос над вами, ШЛЮШКИ
Над моим дерьмо, но я не крашу пальцы ног (йе)
Захвати вантуз, ведь Маршалл и М.А залетают в трубы лихо
Зови нас Тирет-турбо, потому как даже Дре знает, что (Дре знает)
Бит вламывается как заряженный Detox, тебе понадобятся трое спецов
Полицейский надевает на меня наручники за уклонение, но я не останавливаюсь
Пожалуйста, чувак, мне нужно, чтоб вы все продолжали нести хуйню, я питаюсь ею
Я полная противоположность этим отсталым, которые плюются своими слабыми рифмами, я покидаю бойню
Каждая мысль будет настолько ядовитой, что вы поперхнетесь, суки
Заткну ваши пищеводы, перекрою доступ к кислороду
И надеру ваши задницы будто в боксерском зале
Присматривай получше за Slim'ом, лучше хлопай когда я снова в топе
Я не добью, отдам любому, кто захочет подойти и прикончить, и не подумаю вмешаться
Меня спрашивают, закончилась ли война с MGK? Конечно
Я очистил его от смертных грехов, Я Бог, а Господь прощает даже сатанистов
Я двигаюсь дальше, но ты знаешь, что твои угрызения совести исчезают, когда ты рождаешься с рогами Люцифера
И ты из школы Notorious, Puba, Cube, а The Poor Righteous Teachers обучали моих студентов
Показали им все «Чертежи» и «Формулы»
Но, похоже, чем больше они изучают мою музыку, тем больше напоминают мне глаза
И я смотрю, как зрачки расширяются
Но я подумываю о том, чтобы крикнуть ""Сбросить бомбы!"" в игре
Будто я в толпе перед концертом Арианы Гранде

[Припев: Eminem]
Вот идет Саддам Хусейн, Рухолла Хомейни
Где же Усама? Я был ладен с работой в последнее время
Посмотри, как я себя веду, они хотят, чтобы я ушел
Они хотят прикончить меня в моем же доме, я не мешаю
Черт, я не понимаю, почему они меня ненавидят
Я такой же клоун, как Джон Уэйн Гейси
Они называют меня сумасшедший Канье
APESHIT, Бейонсе, Джей-Зи
И я вернулся с Дре, детка
И его операционной
Но он никогда не надевает халата, от Снупа, до Шейди

[Куплет 3: Eminem]
Шейди как тень или твой силуэт, интеллект, я лучше проверю, почему ты расстроен
Потому что я познакомился с твоей сучкой в инете, и теперь у меня есть минет, как под головой подушка
Эта малышка Ким обхватила губами стояк, а затем дунула
Как на пыльный картридж от старой Нинтендо
Вот же были времена, но клянусь не стану бедным снова, неа
Я не курю, но у меня есть бумага, чтобы быть откровенным, я роллю Индику
И я держу ее одной запятой, ноль, ноль, ноль, ноль
Реально, реально, реально, убийство, убийство, убийство, убивать, убивать, убивать
Никелированный, двадцать второй, второй, второй
Сука, заткнись нахуй, пока я тебя тоже не пристрелил
Чтобы получить несколько просмотров на YouTube я не буду снимать хуйню
Или то как забегаю в церковь, пью, пью, пью
Потому что это то, что я де-ла-ю
Но даже для неподготовленного человеческого глаза
Мы с тобой разные, ты и я
Кто-то должен был объяснить тебе почему
Если пойдешь против меня, то это просто безумие, ты умрешь (Ага)
Вот почему меня называют камикадзе, это просто самоубийство, да
Но я знаю магию, и вот мой последний трюк
Я собираюсь сказать ""абракадабра"" и вытащить Кролика из своей шляпы
У меня вот-вот начнется рецидив, и держу пари, что ты не знаешь, как будешь реагировать
Но выражение отвращения, я не сомневаюсь, что оно появится
Как только я начну, блять, пожирать трек
И ты отвергаешь это из страха
Как сауды когда башни рухнули

[Припев: Eminem]
Вот идет Саддам Хусейн, Рухолла Хомейни
Где же Усама? Я был ладен с работой в последнее время
Посмотри, как я себя веду, они хотят, чтобы я ушел
Они хотят прикончить меня в моем же доме, я не мешаю",Genius Russian Translations,Eminem Featuring Young M.A,2020,"[97, 36]",2
94,July,"[Verse 1: Noah Cyrus]
I've been holding my breath
I've been counting to 10
Over something you said
I've been holding back tears
While you're throwing back beers
I'm alone in my bed

[Pre-Chorus: Noah Cyrus]
You know I, I'm afraid of change
Guess that's why we stay the same

[Chorus: Noah Cyrus & Leon Bridges]
So tell me to leave
I'll pack my bags, get on the road
Find someone that loves you
Better than I do, darling, I know
'Cause you remind me every day
I'm not enough, but I still stay

[Verse 2: Leon Bridges]
Feels like a lifetime
Just tryna get by
While we're dying inside
I've done a lot of things wrong
Loving you being one
But I can't move on (Oh, I)

[Pre-Chorus: Leon Bridges]
You know I, I'm afraid of change
Guess that's why we stay the same

[Chorus: Leon Bridges]
So tell me to leave
I'll pack my bags, get on the road
Find someone that gives you
All of the things I could not know
'Cause I keep fighting all the way
I let you down so I could stay

[Bridge: Noah Cyrus & Leon Bridges, Both]
If you want me to leave
Then tell me to leave and, baby, I'll go
And, baby, I'll go

[Outro: Noah Cyrus & Leon Bridges]
You remind me every day
I'm not enough, but I still stay",Noah Cyrus & Leon Bridges,Noah Cyrus Featuring Leon Bridges,2020,"[98, 96, 91, 100]",4
95,You Gon' Learn,"          
            Lyrics for this song have yet to be released. Please check back once the song has been released.
          
        ",Genius Nederlandse Vertalingen,"Eminem Featuring Royce da 5'9"" & White Gold",2020,"[99, 52]",2
96,Dive Bar,"[Verse 1-Garth Brooks]
Well turn that bottle up and drink it
Crank that jukebox up and Hank it
Bartender, pour another round
Here's to our best bad decisions
Situation no conditions
Oh and memories we all need to drown
So fill your cup
Raise it up
Jump in and join the club
And float this whiskey river reservoir

[Chorus]
We're gonna spend the weekend in the deep end of a dive bar

[Verse 2-Blake Shelton]
'Cause up in here you're not the only loved and left her lost and lonely one who's ever swam against the tide
Thinkin' this is your oasis
It's the safest of the places
That a broken heart can find to hide
So here's a toast coast to coast
With a big old adios to wishes wasted on them falling stars

[Chorus]
We're gonna spend the weekend in the deep end of a dive bar

[Bridge]
Yeah it's just chapter after chapter of happy never after
But that's just the way the story goes
For some bar stool believers
Wear our heart out on our sleevers
Just going where the neon glows

[Guitar Solo]

[Bridge]
Yeah it's just chapter after chapter of happy never after
But that's just the way the story goes
Yeah we're just never quite belongers
Hanger on-ers way too longers
Just buzzing where the neon glows

[Pre-Chorus-Both]
Problems, we all got 'em
Let 'em sink down to the bottom
Doesn't matter who or where you are

[Chorus]
We're gonna spend the weekend in the deep end
The water's fine, ya'll so just come on in
To the deep end of a dive bar",Garth Brooks,Garth Brooks & Blake Shelton,2020,[100],1
97,Black Swan,"[Intro: Jimin]
Do your thang
Do your thang with me now
Do your thang
Do your thang with me now
What’s my thang?
What’s my thang? Tell me now
Tell me now
Yeah, yeah, yeah, yeah

[Verse 1: Suga]
Ayy, 심장이 뛰지 않는대
더는 음악을 들을 때
Tryna pull up
시간이 멈춘 듯해
Oh, that would be my first death
I been always afraid of

[Verse 2: RM]
이게 나를 더 못 울린다면
내 가슴을 더 떨리게 못 한다면
어쩜 이렇게 한 번 죽겠지 아마
But what if that moment’s right now, right now?

[Pre-Chorus: V, Jimin]
귓가엔 느린 심장 소리만 bump, bump, bump
벗어날래도 그 입속으로 jump, jump, jump
어떤 노래도 와닿지 못해
소리 없는 소릴 질러

[Chorus: All]
모든 빛이 침묵하는 바다 yeah, yeah, yeah
길 잃은 내 발목을 또 잡아 yeah, yeah, yeah
어떤 소리도 들리지 않아 yeah, yeah, yeah
Killin’ me now, killin’ me now
Do you hear me? Yeah
홀린 듯 천천히 가라앉아, nah, nah, nah
몸부림쳐봐도 사방이 바닥 nah, nah
모든 순간들이 영원이 돼, yeah, yeah, yeah
Feelin' me now, feelin' me now
Do you hear me? Yeah

[Refrain: Jimin, V]
Do your thang
Do your thang with me now
Do your thang
Do your thang with me now
What’s my thang?
What’s my thang? Tell me now
Tell me now, yeah, yeah, yeah, yeah

[Verse 3: j-hope]
Deeper
Yeah, I think I’m goin’ deeper
자꾸 초점을 잃어
이젠 놓아줘 싫어
차라리 내 발로 갈게
내가 뛰어들어갈게
가장 깊은 곳에서
나는 날 봤어

[Verse 4: Suga]
천천히 난 눈을 떠
여긴 나의 작업실 내 스튜디오
거센 파도
깜깜하게 나를 스쳐도
절대 끌려가지 않을 거야 다시 또
Inside I saw myself, myself

[Pre-Chorus: V, Jin]
귓가엔 빠른 심장 소리만 bump, bump, bump
두 눈을 뜨고 나의 숲으로 jump, jump, jump
그 무엇도 날 삼킬 수 없어
힘껏 나는 소리 질러

[Chorus: All]
모든 빛이 침묵하는 바다 yeah, yeah, yeah
길 잃은 내 발목을 또 잡아 yeah, yeah, yeah
어떤 소리도 들리지 않아 yeah, yeah, yeah
Killin’ me now, killin’ me now
Do you hear me? Yeah
홀린 듯 천천히 가라앉아 nah, nah, nah
몸부림쳐봐도 사방이 바닥 nah, nah
모든 순간들이 영원이 돼 yeah, yeah, yeah
Feelin' me now, feelin' me now
Do you hear me? Yeah

[Outro: Jin, Jungkook]
Do your thang
Do your thang with me now
Do your thang
Do your thang with me now
What’s my thang?
What’s my thang? Tell me now
Tell me now
Yeah, yeah, yeah, yeah",BTS,BTS,2020,[57],1
98,Leaving Heaven,"[Giriş: Eminem]
Evet (Bu günün geleceğini biliyordum)
Bazen, geri gelmen gerekir (Hepsi Cehenneme gidiyor adamım)
Birinin seviyesine inmek gerekir (evet)

[Verse 1: Eminem]
5 düzine sinek kafanın üzerinde uçuşuyor
Bana Grim Reaper (Ölüm) diye seslenin uyku kuzenimdir
Benim için ölüsün göreceğin son yüz benim
Ölmeden önce göreceğin son yüz (evet)
Gözüm bir kaplanınki gibidir hayatta kalan biriyim tekrar yükseleceğim
Muzaffer olacağım çünkü mirasıma (bacağıma) baktığımda
Bir kaç köpek ona yapışmaya çalışıyor
Triumph The Puppet'a benziyorlar bende dedim ki ''Siktir et''
Yaşanan katliamı kaz ta ki çok yükselene kadar gökyüzüne ulaşana kadar
Hepsinin sıra olup saldırmasına izin ver
Teker teker yığında doluşuyorlar
Onlara Toy Soldiers diye hitap edin (evet)
Çünkü hepsini arkalarından vuracağım
Şimdi gökyüzü simsiyah
Ama geri dönmeyeceğim,söyleyeceğimi söyledim
Uyanmış olan kendime uyumaya gitmeyi söyledim
Ama yinede hala beni provoke ediyorlar
Beni ruhsal olarak tamamen çökmüş halde görmek istiyorlar
Ama nasıl uyanık olmayabilirim ki?
Bu piçler beni durmadan dürterken

[Nakarat]
Cenneti terk ediyorum
Cenneti terk ediyorum
Melekler beni bulamayacak
Nereye gidiyorsun?

[Verse 2: Eminem]
Aşağıya doğru tekmelendim
Hemde yaklaşık 6 bin kere ben daha çocukken
Çocukken, beni aşağıladılar
Sayılamayacak kadar dışlandım
Durmadan bunu kendime hatırlatmalıyım hem şimdi hem o zaman (Evet)
Rotam böyleydi durmadan kendimi geliştirdim
Bir çukurda, kendime burdan nasıl çıkacağımı öğrettim
Ve yeteneklerimle bunu dengeledim
Çünkü hayat bir bozuk para (Hayat bir bozuk para)
Çünkü sadece yüzde biri
Hayatın vurduğu kişilerin hayatta kalan oranı
Bir asker kaçağıydım (AWOL -a wall) sırtımı buna vermiştim
Bana mücadeleden bahsetme orospu, en derinini ben yaşadım
İlk kez arkamdan bıçakladıklarında 5 ya da 6 yaşındaydım
Malcolm, Isaac, ve Boogie beni ekip üç tekerlekli bisikletimi çaldılar
Ve buna beyaz ırkçılığı der miydim bilmiyorum evet
Ama pigmentlere göre yargılanmanın nasıl bir şey olduğunu biliyorum
Ama iki taraftanda anlayamadım bunu
Ama yemin ederim ki onları geri getirirdim
İntikam almak için ruhumu satmaya bile razıydım (Ne?)
Bir düzen hakkında düşündüm beni fazlasıyla düşündürdü
Kendime güvenirsem,kesinlikle bunu başarırım
İşte bu yüzden durmadan mürekkep ile konuşuyorum
Ve ben son nefesimi verene kadar, yemin ederim ki onları boğup döveceğim
Tanrım, hangi şeytan kalpli onlara gider bende gideceğim
Sanki Aden bahçesindeyim derin son`a yaklaşmak üzereyim
Kötü olan beni çağıryor, şimdiden onla kaynaşıyorum ve

[Nakarat: Skylar Grey & Eminem]

Cenneti terk ediyorum
Cenneti terk ediyorum
Melekler beni bulamayacak
Nereye gidiyorsun?

[Verse 3: Eminem]
Peki, Macklemore odasını temiz ve güzel tutarken
(evet)
Beni haftada iki kere dövüyorlardı (Ne?)
Bir ısırık yemek için
Kanepe yastıklarını altüst ediyordum
Ben ve Denaun birkaç onsent bulabilseydik
İkimize kişi başına 25 kuruşa bir paket cips verirdi
Eski zamanlara dönmek için ters takla atardık
Sanırım o zamanlar hiçbir boka sahip değiliz denilebilirdi
Bu durumu annemin boktan ibaret olduğu ile çarp
Babam bir çuval boktan ibaretti öldü ama sikimde değil
Evet, hangi durum hiçbirzaman sahip olduğum sevgili babama geri götürür
O 1 yaşından 47 yaşına kadar uyuzun tekiydi
Tek istediğim söyleyeceklerimin kulağına küpe olması
Tıpkı kulak mememim bir küpe için bir iğneyle delinmesi gibi
Üzülmelimiyim? sen ölmeden önce benim için ölüydün zaten
Ben mi? bir damla gözyaşım akmadı
Cenazen için süslü bir duvar mı yapmam gerekirdi?
Tabutuna kahraman bayrağı mı örtmeliydim?
Hangi sikimdeydin?
De`Angelo beni Rio Granede`de kötü bir şekilde yaralarken
Asla torunlarınla tanışmadın, siktiğimin korkağı
Tek cesaretli olduğun konu şişman midendi
Seni cennete giderken görmedim
O yüzden cehennemi kontrol etmeye geliyorum
Ki bende seni pataklayabileyim
Yüzüne asla senden nefret ediyorum diyemeyeceğim için bu Durumdan nefret ediyorum
Gideceğim yerden geri dönüş yok
Gökyüzü karanlık,ruhum siyah,elimde kürek
Bıçakla kazıyorum,metalin üstüne adım atıyorum
Kan davamı ödeyeceğim,şeytana söyleyin

[Nakarat: Skylar Grey & Eminem]
Cenneti Terk ediyorum (Evet)
Cenneti Terk Ediyorum (Biliyorsun ki, cesedini çıkarana kadar kazmalıyım)
Melekler beni bulamayacak (Sadece yüzüne tüküreyim diye)
Nereye Gidiyorsun? (Elinde bebeklik fotoğrafıma bakıp gurur duyuyormuş gibi davranıyorsun)
Cenneti Terk ediyorum (Seni sikeyim, orospu)
Cenneti Terk ediyorum (Biliyor musun? hayatımda olsaydın)
Melekler beni bulamayacak (Yaşadığım şeylerin yarısını yaşamayacaktım bu yüzden seni suçluyorum)
Nereye Gidiyorsun? (Ya da sana teşekkürler demeliyim)
(Çünkü sen olsaydın ben kendim olmazdım haha)

[Çıkış: Skylar Grey & Eminem]
Bu yüzden en iyisi koş (Evet)
En iyisi, en iyisi koş (Neyse bırakıp gideceğim. Huzur içinde yat)
En iyisi, en iyisi koş (İbne, Haha)
En iyisi, en iyisi koş (Cehennemde görüşürüz)",Genius Türkçe Çeviri,Eminem Featuring Skylar Grey,2020,[61],1
99,Complicated,"[Verse 1]
Outside is cloudy, but I like that better (Better, better)
Behind the wheel, but still ain't on my way
Some people say they want to live forever
That's way too long, I'll just get through today

[Chorus]
Without any complications (Ooh, ooh, ooh, ooh)
Does it always gotta, does it always gotta
Gotta be so complicated? (Ooh, ooh, ooh, ooh)
Well, I'm way too young to be gettin' old

[Verse 2]
And all I wanna do is look, but I can't see, baby
Who you talkin' to while you talkin' to me, baby?
Let me, let me know if I can see you later
We could make it easy

[Verse 3]
Inside my head is getting pretty cluttered (Cluttered, cluttered)
I try, but can't clean up this mess I made
'Fore I start to think about the future
First, can I please get through a day?

[Chorus]
Without any complications (Ooh, ooh, ooh, ooh)
Does it always gotta, does it always gotta
Gotta be so complicated? (Ooh, ooh, ooh, ooh)
Well, I'm way too young to be gettin' old

[Outro]
Some people say they want to live forever
Without any complications (Ooh, ooh, ooh, ooh)
Does it always gotta, does it always gotta
Gotta be so complicated? (Ooh, ooh, ooh, ooh)
Well, I'm way too young to be gettin' old",Mac Miller,Mac Miller,2020,[63],1
