,title,lyrics,artistsFromLyrics,artists,date,rank,cnt
41,Heartache Medication,"[Verse 1]
Same old dive, same old end of the work week drink
Bartender knows my name, but I don't mind
She kicks 'em up strong, serves me up right

[Chorus]
And here I go again, I'm drinkin' one, I'm drinkin' two
I got my heartache medication, a strong dedication
To gettin' over you, turnin' me loose
On that hardwood jukebox lost in neon time
My heartache medication, well, it suits me fine
And I'm drinkin' enough to take you off my mind
I got my heartache medication

[Verse 2]
Another girl, another dance to a country song
Turnin' me on, here's to a good time
And halfway to feelin' alright

[Chorus]
And here I go again, I'm drinkin' one, I'm drinkin' two
I got my heartache medication, a strong dedication
To gettin' over you, turnin' me loose
On that hardwood jukebox lost in neon time
My heartache medication, well it suits me fine
And I'm drinkin' enough to take you off my mind
I got my heartache medication

[Bridge]
Single, drinkin' doubles
Teardrops turnin' into bubbles
Yeah, a little later on
I'll probably find me some trouble

[Chorus]
And here I go again, I'm drinkin' one, I'm drinkin' two
I got my heartache medication, a strong dedication
To gettin' over you, turnin' me loose
On that hardwood jukebox lost in neon time
My heartache medication, well it suits me fine
And I'm drinkin' enough to take you off my mind
I got my heartache medication

[Outro]
Heartache medication takin' me away
Oh whoa",Jon Pardi,Jon Pardi,2020,"[42, 51, 47, 51, 58, 75]",6
42,I Don't Care,"[Verse 1]
I'm at a fish I don't wanna be in
I'm not prepared and I have no clothes
I can face my back
Ask yourself if it's possible to buy a seat

Where is my hand?
I said to myself, ""Do you dance?"" (Satan)
Do you know that I love myself?
Is everything in life real?

[Pre-Chorus 1]
Holiday does not match with confidence
Each has many words, yes
I have a lot of shape and everything, mm
We want one with fox
(What does the fox say?)

[Chorus]
I want you to have a child
Everything was destroyed by poverty
And that man right in front of me

We can control the lightning chain
Yes, that's my son
What is your name?

Because you're still in prison, I'm sorry
Taxis in hell cost six dollars per minute
And I'm so happy with other people

We can control the lighting chain
Yes, that's my son
What is your name?

[Verse 2]
We do not want to be dinner
Terry, I do not know
I want to read my ears
This place exists

It is the disease of tension
But what I say is done
Education? Eh, it's nice for me to think about it
Find out the good things

[Pre-Chorus]
No human contact
Yes, everyone is right, yes
I'm very happy with the animals
And you can heal him

[Chorus]
I want you to have a child
Everything was destroyed by poverty
And that man right in front of me

We can control the lightning chain
Yes, that's my son
Yes, yes, yes, no

Because you're still in prison, I'm sorry
Taxis in hell cost six dollars per minute
And I'm so happy with other people

We can control the lighting chain
Yes, that's my son
Beyond the Gulf of Persia

[Bridge]
But who does not love me?
Every single Jesus
But who does not love me?
Dear, this is my own business

I do not like you, you are so beautiful
God, everything
But who does not love me?
Ayyyy

[Chorus]
I want you to have a child
Everything was destroyed by poverty
And that man right in front of me

We can control the lightning chain
Yes, that's my son
What is your name?

Because you're still in prison, I'm sorry
Taxis in hell cost six dollars per minute
And I'm so happy with other people

We can control the lighting chain
Yes, that's my son
What is your name?",MALINDA,Ed Sheeran & Justin Bieber,2020,"[44, 44, 38, 32, 28]",5
43,Hot,"[Intro: Gunna]
Wheezy outta here
Hot, hot, hot, hot
Hot, hot, hot, hot
Hot, hot, hot, hot
Hot, hot, hot, hot

[Chorus: Gunna]
Everything litty, I love when it's hot
Turned up the city, I broke off the notch
Got some more millis, I keep me a knot
I created history and made me a lot
He tried to diss me and ended on Fox
We call them chopsticks 'cause they gonna chop
Took her out of Follies 'cause her pussy pop
I run it like Nike, we got it on lock

[Verse 1: Gunna]
Cartier eye
I'm the bossman in a suit but no tie
I can't be sober, I gotta stay high
Pour me some syrup in a Canada Dry
Ridin' in the spaceship like Bonnie and Clyde
Don't worry, baby, I keep me some fire
Shenenehs and Birkins, she cannot decide
The latest Mercedes her go-to surprise
Don't sleep on miss lady, her pussy a prize
Dick in her back while I'm grippin' her sides
Bigger Maybach, this ain't regular size
We really fly, we like pelican glide
Bitch, you ain't slick, I can tell the disguise
Upgraded my wrist, put baguettes in that Sky
She sing, I might sign her and change her whole life
I told her to gargle and work on her highs

[Chorus: Gunna]
Everything litty, I love when it's hot
Turned up the city, I broke off the notch
Got some more millis, I keep me a knot
I created history and made me a lot
He tried to diss me and ended on Fox
We call them chopsticks 'cause they gonna chop
Took her out of Follies 'cause her pussy pop
I run it like Nike, we got it on lock

[Interlude: Young Thug]
Cash, money, checks, cash
Addy, Birkin, brand new extendos
I just wanna fuck the bitch by myself
I just passed her to the dawg like my Sprite

[Verse 2: Young Thug]
I took the Bentley coupe back, then I hopped in a Cayenne (Skrrt)
I put the bitch in the front of the Bentley, in front of the driver (Skrrt)
Ayy, man, this synthetic weed, you can't smoke in the Rolls Royce, woah, woah (Yeah, yeah)
I'm still double cupped up, I'm drinkin', I shoot off your tires, huh (Doo-doo-doo-doo-doo-doo-doo-doo)
I'm in the coupe by myself
I had to kick a door when I was 5
Keep the awards on the shelf
Whole sixteen round in the fire
I'm sick and tired of these young niggas act like they firin', they tellin' these lies
Actin' like they the ones created this and they get all the drip from my guys
Yeah, Cartier eyes
Cartier coat, Cartiers the watch
Cartier love, Cartier the thot
Cartier specs, buffalo on the side
Princess cut diamonds, they Cartier, yeah
Cartier bag for the Cartier thot
Sky Wrangler coupe with two hundred the dash
Cartier jeans, ain't no way I can sag
Ain't no way I'ma ever gon' go out bad
I can't go out, no way I'ma go out
I just grip on her ass and I show out
I sit like a champ and I wait on a hold-out
I just whip up a new Chanel Patek
I whip with the wrist and I don't break the door out
Turn the whole top floor to a whorehouse
Hundred racks in ones, dude brought the flood out

[Outro: Gunna]
Hot, hot, hot, hot
Hot, hot, hot, hot
Hot, hot, hot, hot, damn
Hot, hot, hot",Young Thug,Young Thug Featuring Gunna,2020,"[45, 42, 31, 21, 24, 33]",6
44,Kinfolks,"[Verse 1]
(I saw you going by)
I saw you going by, I had to say hello
I don't mean to pry, but girl, I gotta know
What is your name?
How come I ain't seen you around before? (Tell me)
Now you know I ain't ever had a type, having a type takes two
But I know what I like, and you're the only one of you
You're something else (Damn)
And I know we just met, but

[Chorus]
I wanna introduce you to my kinfolks, to my old friends
To the house in the pines where the road ends
Take you to my hometown, where I grew up
Where I thought I knew it all before I knew what love was
Gave up on it, but honey, you got my hopes up
And I'm thinking that I wanna introduce you to my kinfolks

[Verse 2]
(I wanna take you home)
I wanna take you home, not just take you home tonight
Get Joanie on the phone, she'll leave us on a light
I wanna see the way you look up under all those stars, yeah
You don't need to talk, word's gonna get around
They'll tell you how they thought I'd never settle down
Out on the porch, ain't it funny the way things change?

[Chorus]
I wanna introduce you to my kinfolks, to my old friends
To the house in the pines where the road ends
Take you to my hometown, where I grew up
Where I thought I knew it all before I knew what love was
Gave up on it, but honey, you got my hopes up
And I'm thinking that I wanna introduce you to my kinfolks

[Bridge]
I want you tonight
I don't ever wanna be without (Come on)
I don't wanna wait around for the right time

[Chorus]
I wanna introduce you to my kinfolks, to my old friends
To the house in the pines where the road ends
Take you to my hometown, where I grew up
Where I thought I knew it all before I knew what love was
Gave up on it, but honey, you got my hopes up
And I'm thinking that I wanna introduce you to my kinfolks

[Outro]
And I'm thinking that I wanna introduce you to my kinfolks
Woah",Sam Hunt,Sam Hunt,2020,"[46, 53, 51, 54, 60, 80]",6
45,Bandit,"[Intro: Juice WRLD]
It's funny, the shit I put on this song ain’t gon' sound nothin' like the shit we was just doin’
Oh, yeah
I just want bad bitches
Baddest, them bitches is the baddest, uh, uh
When I take the molly, I'm a savage
Uh, I say, uh

[Chorus: Juice WRLD]
I don't need no molly to be savage, uh
When I'm on that molly, I feel savage, uh, uh
She the definition of a bad bitch
Stole her, I'm the definition of a bandit, uh, ayy
I don't need no molly to be savage, uh, ayy
But when I'm on the molly, I feel savage
Ayy, my girl the definition of a bad bitch
Stole her heart, I'm the definition of a bandit

[Verse 1: Juice WRLD]
Put the Percs down and picked up the jiggas, jiggas, jiggas
Tommy in the fucking Tommy Hilfiger, ’figer, ’figer
That Tommy hit a nigga, Tommy Hilfiger, fuck niggas
I'm nice, when I’m high off the pills, I'ma fuck with her
I don't smoke skunk, but tonight I'm getting stuck, nigga
Pour the codeine up and put some molly in the cup with it
I know she a freak, uh-huh, she gon’ fuck with it
She my velcro, uh-huh, guess I'm stuck with her
I dive in it like a sailor, I love to nail her
Addicted to her paraphernalia, I had to tell her
I see it like a fortune teller
Your ex-nigga did good, I could do better
Bad bitch from the woods, I think she a hunter
She a killer and an eater, she a Jeffrey Dahmer
I can tell when she in her feelings, I can read her like a book
No TEC, no Beretta, FN on me, am I understood?
Yeah, yeah, yeah

[Chorus: Juice WRLD]
I don't need no molly to be savage, uh
When I'm on that molly, I feel savage, uh, uh
She the definition of a bad bitch
Stole her, I'm the definition of a bandit, uh, ayy
I don't need no molly to be savage, uh, ayy
But when I'm on the molly, I feel savage
Ayy, my girl the definition of a bad bitch
Stole her heart, I'm the definition of a bandit

[Verse 2: YoungBoy Never Broke Again]
My brother point her out and she a bad bitch, I'm on her
Must ain't heard that I'm a savage, once I get a bitch, I own her
I see she got swag, I got cash so I want her
See this four-five in my pants, put on your ass, push up on bruh
Shawty, she a rider with that glizzy on her (Glizzy on her)
And shawty, I'ma dada with no semi on me (Semi on me)
If we got a problem, we get rid of homie (Yeah)
Put twenty thousand in your pocket, we gon' get the money (Yeah)
I'm the definition of a bandit (Honest)
Took your heart from out his hands and still ain't saying shit (On my mama)
Some new killers in my circle you done ran with
Like this dirty .38, this bitch'll damage
Popping wheelies, 4K Trey, call when you land with it (Pop, pop, pop)
I let you drive and slide with my bros where they be laying with it (Skrrt)
I work this bitch, I open up a can with it
Like fuck the stove, I make it jump without my hand in it

[Chorus: Juice WRLD]
I don't need no molly to be savage, uh
When I'm on that molly, I feel savage, uh, uh
She the definition of a bad bitch
Stole her, I'm the definition of a bandit, uh, ayy
I don't need no molly to be savage, uh, ayy
But when I'm on the molly, I feel savage
Ayy, my girl the definition of a bad bitch
Stole her heart, I'm the definition of a bandit",Juice WRLD & YoungBoy Never Broke Again,Juice WRLD & YoungBoy Never Broke Again,2020,"[47, 47, 35, 28, 22, 27]",6
46,Juicy,"[Chorus: Doja Cat]
I keep it juicy, juicy, I eat that lunch, uh (Yeah)
She keep that booty, booty, she keep that plump, yeah (Yeah, yeah)
That natural beauty, beauty, yeah, yeah
If you could see it from the front
Wait 'til you see it from the back, back, back, back, back, juicy
(Wait 'til you see it from the—)
Back, back, yeah, back, back, back, juicy
(Wait 'til you see it from the—)
Back, back, back, back, back, juicy
(Wait 'til you see it from the—)
If you could see it from the front
Wait 'til you see it from the back

[Verse 1: Doja Cat]
He like the Doja with the Cat, yeah (Cat, cat, cat)
He like it thick, he like it fat, yeah (Fat, fat, fat)
Like to keep him wantin' more
He ask me, ""Doja, where you at, huh?"" (""Where you at? Where you at?"")
And all them niggas wanna know
How long it take to pull my pants up, mmm, mmm, mmm
Broke a fingernail and then some, mmm
Tryna squeeze into my True Religion denim, mmm, mmm, mmm
Sell it big, don't wanna sell you light (Yeah, I don't wanna sell it)
I don't buy it, where the cellulite? (Yeah, where that, where that at?)
He said the body unbelievable (Yeah)
Can't trust a big butt and a Gemini-i-i-i (Mmm)

[Chorus: Doja Cat]
I keep it juicy, juicy, I eat that lunch, uh (Yeah)
She keep that booty, booty, she keep that plump, yeah (Yeah, yeah)
That natural beauty, beauty, yeah, yeah
If you could see it from the front
Wait 'til you see it from the back, back, back, back, back, juicy
(Wait 'til you see it from the—)
Back, back, yeah, back, back, back, juicy
(Wait 'til you see it from the—)
Back, back, back, back, back, juicy
(Wait 'til you see it from the—)
If you could see it from the front
Wait 'til you see it from the back

[Verse 2: Tyga]
Bring that ass over, Doja, bring it back, back, back (Yeah)
I'm a big dog, tryna eat the kitty cat, cat
I'ma slide in, the way it fit, I can tell we match (Woo)
All about my racks, hella cheese, I don't fuck with rats (No)
Big crib in Hollywood, I don't even act (Yeah)
Come relax, let a nigga tap, hit you on the app (Woo)
Take a lil' *inhale*, with the *cough*, wipe the pain away
Juicy and it's tighter than a virgin, like Madonna say
I love when you give in, I love when you don't (Sometimes, ayy)
Hit me with the threesome, and sometimes you won't (Sometimes)
You told me don't fuck with no bitches you know (Nah)
You got it, yeah, you got it, babe, you bust it on the floor (Ayy, ayy)

[Chorus: Doja Cat & Tyga]
I keep it juicy, juicy, I eat that lunch, uh (Yeah, juicy)
She keep that booty, booty (Yeah), she keep that plump, yeah (Yeah, yeah)
That natural beauty, beauty, yeah, yeah
If you could see it from the front
Wait 'til you see it from the back, back, back, back, back, juicy
(Wait 'til you see it from the—)
Back, back, yeah, back, back, back, juicy
(Wait 'til you see it from the—)
Back, back, back, back, back, juicy
(Wait 'til you see it from the—)
If you could see it from the front (Yeah)
Wait 'til you see it from the back

[Bridge: Doja Cat]
He like it plump, he need that
Need the rump and need the thighs, he eat that
Eat that up, and in the night, he seek that
In the dark, and in the ride, he keep that
Keep it runnin', like it plump, he need that
Need the rump and need the thighs, he eat that
He eat that up and in the night, he seek that
In the dark, and in the ride, he keep that
Keep it runnin'

[Chorus: Doja Cat]
I keep it juicy, juicy, I eat that lunch, uh (Yeah)
She keep that booty, booty, she keep that plump, yeah (Yeah, yeah)
That natural beauty, beauty, yeah, yeah
If you could see it from the front
Wait 'til you see it from the back, back, back, back, back, juicy
(Wait 'til you see it from the—)
Back, back, yeah, back, back, back, juicy
(Wait 'til you see it from the—)
Back, back, back, back, back, juicy
(Wait 'til you see it from the—)
If you could see it from the front
Wait 'til you see it from the back",Doja Cat & Tyga,Doja Cat & Tyga,2020,"[48, 50, 45, 48, 45, 63]",6
47,Panini,"[Intro: Nessly]
D-D-Daytrip took it to ten (Hey)

[Verse 1]
Ayy, Panini, don't you be a meanie
Thought you wanted me to go up
Why you tryna keep me teeny? I
It's a dream, he wished it on a genie
I got fans finally, ain't you wanting them to see me? I

[Refrain]
I thought you want this for my life, for my life
Said you wanted to see me thrive, you lied

[Chorus]
Just say to me what you want from me
Just say to me what you want from me

[Verse 2]
Ayy, Panini, don't you be a meanie
Thought you wanted me to go up
Why you tryna keep me teeny now?
Now they need me, number one on streaming
Oh yeah, you used to love me
So what happened, what's the meaning? I

[Refrain]
I thought you want this for my life, for my life
Said you wanted to see me thrive, you lied

[Verse 3]
Now when it's all done, I get the upper hand
I need a big Benz, not another fan
But I still want you as a fan
I'ma need to sit down, don't mean to make demands
But I need you to...

[Chorus]
Say to me what you want from me
Just say to me what you want from me

[Outro: Nessly]
D-D-Daytrip took it to ten (Hey)",Lil Nas X,Lil Nas X,2020,"[49, 39, 28, 23, 17, 30]",6
48,South Of The Border,"She got the, mm, brown eyes, caramel thighs
Long  hair, no wedding ring, hey
I  saw you lookin' from across the way
And now I really wanna know your name
She got the, mm, white dress, but when she's wearin' less
Man,  you know that she drives me crazy
The,  mm, brown eyes, beautiful smile
You know I love watching you do your thing

I  love her hips, curves, lips say the words
""Te amo, mami, ah, te amo, mami""
I kiss her, this love is like a dream
So join me in this bed that I'm in
And  push up on me and sweat, darling

So I'm gonna put my time in
I won't stop until the angels sing
Jump in that water, be free
Come south of the border with me
Jump in that water, be free
Come south of the border with me

She got that, mm, green eyes, givin' me signs
That she really wants to know my name, hey
I saw you lookin' from across the way
And suddenly, I'm glad I came, ay!
Ven para acá quiero bailar, toma mi mano
Quiero sentir tu cuerpo en mi, estás temblando
Mm, green eyes, takin' your time
Now we know we'll never be the same

I love her lips 'cause she says the words
""Te amo, papi, ah, te amo, papi""
Don't wake up, this love is like a dream

So join me in this bed that I'm in
Push up on me and sweat, darling
So I'm gonna put my time in
I won't stop until the angels sing
Jump in that water, be free
Come south of the border with me
Jump in that water, be free
Come south of the border with me

Flawless diamonds
In a green field near Buenos Aires
Until the sun's rising
We won't stop until the angels sing
Jump in that water, be free
Come south of the border with me
Jump in that water, be free
Come south of the border with me

Yo
You never live 'til you risk your life (your life)
You wanna shine, you gotta get more ice (more ice)
Am I your lover or I'm just your vice? (skktt skktt)
A little crazy, but I'm just your type (ey)
You want the lips and the curves, need the whips and the furs
And the diamonds I prefer, and my closet his and hers, ayy
I want the lil' mamacita, margarita (margarita)
I’m with the Ed, Cardi B and Camila ey!
I’m just gonna say what I want
Cause whatever people say
I don’t really give a fuck, bitch
Let’s just spread some love
Yeah that’s what everyone wants
Kiss me like you need me, rub me like a genie
Pull up to my spot in Lamborghini
'Cause you gotta see me, never leave me
You got a boy that could finally do it all
I’ll do everything I can, I’ll tour you all around the world

So join me in this bed that I'm in (oh oh oh)
Push up on me and sweat, darling (oh oh oh oh oh)
So I'm gonna put my time in
I won't stop until the angels sing (oh oh oh oh oh oh oh oh)

Jump in that water, be free
Come south of the border with me
Come south of the border, border
Come south of the border with me
Come south of the border, border
Come south of the border with me
Jump in that water, be free
Come south of the border with me
Jump in that water, be free
Come south of the border with me


Original lyrics by Ed Sheeran
New rap verse written by Yves Laurence",Yves Laurence,Ed Sheeran Featuring Camila Cabello & Cardi B,2020,"[50, 56, 56, 61, 72, 100]",6
49,Tusa,"[Letra de ""Tusa""]

[Intro: Karol G & Nicki Minaj, Ovy On The Drums]
¿Qué pasa contigo? Dímelo
Rrr!
O-O-Ovy on the Drums! (Mmm)

[Verso 1: Karol G]
Ya no tiene excusa (No, no)
Hoy salió con su amiga dizque pa' matar la tusa (Ah; tusa)
Que porque un hombre le pagó mal (Ah)
Está dura y abusa (Eh)
Se cansó de ser buena
Ahora es ella quien los usa (Hmm-mm)
Que porque un hombre le pagó mal (Mal)
Ya no se le ve sentimental (-tal)
Dice que por otro man no llora, no (Llora)

[Coro: Karol G]
Pero si le ponen la canción (Hmm)
Le da una depresión tonta (Tonta)
Llorando lo comienza a llamar
Pero él la dejó en buzón (No)
¿Será porque con otra está (Con otra está)
Fingiendo que a otra se puede amar?

[Verso 2: Nicki Minaj]
Pero hice  todo este llanto por nada
Ahora soy una chica mala
And now you kickin' and screamin', a big toddler
Don't try to get your friends to come holla, holla
Ayo (Kyuh!), I used to lay low (Uh-huh)
I wasn't in the clubs, I was on my J.O (Oop!)
Until I realized you a epic fail
So don't tell your guys that I’m still your bae, yo (Ah!)
'Cause it's a new day, I'm in a new place (Uh-huh)
Gettin' some new D, sittin' on a new face (Okay)
'Cause I know I'm the baddest bitch that you ever really met (Oop!)
You searchin' for a badder bitch, and you ain't met her yet (Oop!)
Ayo! Tell 'em to back off, he wanna slack off
Ain't no more booty calls, you gotta jack off
It's me and Karol G, we let them rats talk
Don't run up on us, 'cause they lettin' the MACs off (Rrr!)

[Coro: Karol G]
Pero si le ponen la canción (Hmm)
Le da una depresión tonta (Tonta)
Llorando lo comienza a llamar
Pero él la dejó en buzón (No)
¿Será porque con otra está (Con otra está)
Fingiendo que a otra se puede amar?
Eh, ah

[Verso 3: Karol G]
Un-un shot pa' la pena profunda (Un shot, eh)
Y seguimo' gastando la funda (La funda)
Otro shot pa' la mente (Yeah, yeah)
Pa' que el recuerdo no la atormente (Ah; Oh)
Ya no le copia a nada (Na')
Su ex ya no vale nada (Nada)
Se va pa' la disco y sólo quiere perrear (Perrear)
Pero se confunde cuando empieza a tomar (Tomar)

[Pre-Coro: Karol G]
Ella se cura con rumba (Ah)
Y el amor pa' la tumba (Yeah)
To' los hombre' le zumban (Le zumban)

[Coro: Karol G]
Pero si le ponen la canción (Oh)
Le da una depresión tonta (Tonta)
Llorando lo comienza a llamar
Pero él la dejó en buzón (Oh)
¿Será porque con otra está (Con otra está)
Fingiendo que a otra se puede amar?

[Outro: Karol G & Nicki Minaj, Ovy On The Drums]
Hey, Karol G (Ajá; Karol G)
Nicki Minaj (Ah, ajá), hey
""The Queen"" with ""The Queen"" (Ajá, jajaja)
O-O-Ovy on the Drums
Ay!",KAROL G & Nicki Minaj,Karol G & Nicki Minaj,2020,"[51, 55, 69, 87, 76, 98]",6
50,Homesick,"[Verse 1]
Dancin' in the kitchen, you singing my favorite songs
Swinging on the front porch, just laughing at the dogs
How you swear you love me more
When you're whisperin' goodnight
All those little moments are every reason why

[Chorus]
I'm homesick
This feelin' that I'm feeling'
No, it don't quit
It's like half of me is missin'
Heaven knows it that all I wanna do
Is be alone with your brown eyes all tangled up
Just holdin' onto you tonight
Until the mornin'
Baby that's the damn truth
If home is where the heart is
Then I'm homesick for you

[Verse 2]
Well it says Kane Brown
On a sign with a line out the door
It sold out some little town
I've never been before
Yeah, they're screamin' my name
This is what we dreamed about
But out here singin' about you, baby, all I think about

[Chorus]
Is how I'm homesick
This feelin' that I'm feelin'
No, it don't quit
It's like half of me is missin'
Heaven knows it that all I wanna do
Is be alone with your brown eyes all tangled up
Just holdin' onto you tonight
Until the morning
Baby that's the damn truth
If home is where the heart is
I'm homesick for you

[Bridge]
Homesick for you
Yeah, yeah

[Chorus]
I'm homesick
This feelin' that I'm feelin'
No, it don't quit
It's like half of me is missin'
Heaven knows it that all I wanna do
Is be alone with your brown eyes, just tangled up
Just holdin' onto you tonight
Until the mornin'
Baby, that's the damn truth
If home is where the heart is
I'm homesick for you
I'm homesick for you
Yeah, yeah",Kane Brown,Kane Brown,2020,"[52, 66, 60, 63, 64, 88]",6
